09:00:01.019601 ARP, Request who-has 10.1.1.2 (Broadcast) tell 10.1.1.1, length 50
09:00:01.019601 ARP, Request who-has 10.1.1.2 (Broadcast) tell 10.1.1.1, length 50
09:00:01.036422 ARP, Reply 10.1.1.2 is-at 00:00:00:00:00:28 (oui Ethernet), length 50
09:00:01.040857 ARP, Reply 10.1.1.2 is-at 00:00:00:00:00:28 (oui Ethernet), length 50
09:00:06.023601 ARP, Request who-has 10.1.1.1 (Broadcast) tell 10.1.1.2, length 50
09:00:06.023601 ARP, Request who-has 10.1.1.1 (Broadcast) tell 10.1.1.2, length 50
09:00:06.060404 IP 10.1.1.2.49153 > 10.1.1.1.discard: UDP, length 512
09:00:06.066057 IP 10.1.1.2.49153 > 10.1.1.1.discard: UDP, length 512
09:00:06.069585 IP 10.1.1.2.49153 > 10.1.1.1.discard: UDP, length 512
09:00:06.073316 IP 10.1.1.2.49153 > 10.1.1.1.discard: UDP, length 512
09:00:06.080094 IP 10.1.1.2.49153 > 10.1.1.1.discard: UDP, length 512
09:00:06.086387 IP 10.1.1.2.49153 > 10.1.1.1.discard: UDP, length 512
09:00:06.089394 IP 10.1.1.2.49153 > 10.1.1.1.discard: UDP, length 512
09:00:06.108185 IP 10.1.1.2.49153 > 10.1.1.1.discard: UDP, length 512
09:00:06.111288 IP 10.1.1.2.49153 > 10.1.1.1.discard: UDP, length 512
09:00:06.114498 IP 10.1.1.2.49153 > 10.1.1.1.discard: UDP, length 512
09:00:06.118067 IP 10.1.1.2.49153 > 10.1.1.1.discard: UDP, length 512
09:00:06.128933 IP 10.1.1.2.49153 > 10.1.1.1.discard: UDP, length 512
09:00:06.135745 IP 10.1.1.2.49153 > 10.1.1.1.discard: UDP, length 512
09:00:06.142643 IP 10.1.1.2.49153 > 10.1.1.1.discard: UDP, length 512
09:00:06.153184 IP 10.1.1.2.49153 > 10.1.1.1.discard: UDP, length 512
09:00:06.160378 IP 10.1.1.2.49153 > 10.1.1.1.discard: UDP, length 512
09:00:06.167219 IP 10.1.1.2.49153 > 10.1.1.1.discard: UDP, length 512
09:00:06.177914 IP 10.1.1.2.49153 > 10.1.1.1.discard: UDP, length 512
09:00:06.184955 IP 10.1.1.2.49153 > 10.1.1.1.discard: UDP, length 512
09:00:06.191795 IP 10.1.1.2.49153 > 10.1.1.1.discard: UDP, length 512
09:00:06.202551 IP 10.1.1.2.49153 > 10.1.1.1.discard: UDP, length 512
09:00:06.209715 IP 10.1.1.2.49153 > 10.1.1.1.discard: UDP, length 512
09:00:06.216371 IP 10.1.1.2.49153 > 10.1.1.1.discard: UDP, length 512
09:00:06.227364 IP 10.1.1.2.49153 > 10.1.1.1.discard: UDP, length 512
09:00:06.233846 IP 10.1.1.2.49153 > 10.1.1.1.discard: UDP, length 512
09:00:06.240947 IP 10.1.1.2.49153 > 10.1.1.1.discard: UDP, length 512
09:00:06.251402 IP 10.1.1.2.49153 > 10.1.1.1.discard: UDP, length 512
09:00:06.259031 IP 10.1.1.2.49153 > 10.1.1.1.discard: UDP, length 512
09:00:06.265523 IP 10.1.1.2.49153 > 10.1.1.1.discard: UDP, length 512
09:00:06.276843 IP 10.1.1.2.49153 > 10.1.1.1.discard: UDP, length 512
09:00:06.282975 IP 10.1.1.2.49153 > 10.1.1.1.discard: UDP, length 512
09:00:06.290099 IP 10.1.1.2.49153 > 10.1.1.1.discard: UDP, length 512
09:00:06.300967 IP 10.1.1.2.49153 > 10.1.1.1.discard: UDP, length 512
09:00:06.307701 IP 10.1.1.2.49153 > 10.1.1.1.discard: UDP, length 512
09:00:06.314675 IP 10.1.1.2.49153 > 10.1.1.1.discard: UDP, length 512
09:00:06.325492 IP 10.1.1.2.49153 > 10.1.1.1.discard: UDP, length 512
09:00:06.332460 IP 10.1.1.2.49153 > 10.1.1.1.discard: UDP, length 512
09:00:06.339251 IP 10.1.1.2.49153 > 10.1.1.1.discard: UDP, length 512
09:00:06.349828 IP 10.1.1.2.49153 > 10.1.1.1.discard: UDP, length 512
09:00:06.357284 IP 10.1.1.2.49153 > 10.1.1.1.discard: UDP, length 512
09:00:06.363827 IP 10.1.1.2.49153 > 10.1.1.1.discard: UDP, length 512
09:00:06.374773 IP 10.1.1.2.49153 > 10.1.1.1.discard: UDP, length 512
09:00:06.381364 IP 10.1.1.2.49153 > 10.1.1.1.discard: UDP, length 512
09:00:06.388403 IP 10.1.1.2.49153 > 10.1.1.1.discard: UDP, length 512
09:00:06.398990 IP 10.1.1.2.49153 > 10.1.1.1.discard: UDP, length 512
09:00:06.406151 IP 10.1.1.2.49153 > 10.1.1.1.discard: UDP, length 512
09:00:06.412979 IP 10.1.1.2.49153 > 10.1.1.1.discard: UDP, length 512
09:00:06.423793 IP 10.1.1.2.49153 > 10.1.1.1.discard: UDP, length 512
09:00:06.430399 IP 10.1.1.2.49153 > 10.1.1.1.discard: UDP, length 512
09:00:06.437555 IP 10.1.1.2.49153 > 10.1.1.1.discard: UDP, length 512
09:00:06.448003 IP 10.1.1.2.49153 > 10.1.1.1.discard: UDP, length 512
09:00:06.455362 IP 10.1.1.2.49153 > 10.1.1.1.discard: UDP, length 512
09:00:06.462131 IP 10.1.1.2.49153 > 10.1.1.1.discard: UDP, length 512
09:00:06.473068 IP 10.1.1.2.49153 > 10.1.1.1.discard: UDP, length 512
09:00:06.479996 IP 10.1.1.2.49153 > 10.1.1.1.discard: UDP, length 512
09:00:06.486707 IP 10.1.1.2.49153 > 10.1.1.1.discard: UDP, length 512
09:00:06.497786 IP 10.1.1.2.49153 > 10.1.1.1.discard: UDP, length 512
09:00:06.504303 IP 10.1.1.2.49153 > 10.1.1.1.discard: UDP, length 512
09:00:06.511283 IP 10.1.1.2.49153 > 10.1.1.1.discard: UDP, length 512
09:00:06.522033 IP 10.1.1.2.49153 > 10.1.1.1.discard: UDP, length 512
09:00:06.529095 IP 10.1.1.2.49153 > 10.1.1.1.discard: UDP, length 512
09:00:06.535859 IP 10.1.1.2.49153 > 10.1.1.1.discard: UDP, length 512
09:00:06.546465 IP 10.1.1.2.49153 > 10.1.1.1.discard: UDP, length 512
09:00:06.553245 IP 10.1.1.2.49153 > 10.1.1.1.discard: UDP, length 512
09:00:06.560435 IP 10.1.1.2.49153 > 10.1.1.1.discard: UDP, length 512
09:00:06.570735 IP 10.1.1.2.49153 > 10.1.1.1.discard: UDP, length 512
09:00:06.577926 IP 10.1.1.2.49153 > 10.1.1.1.discard: UDP, length 512
09:00:06.585011 IP 10.1.1.2.49153 > 10.1.1.1.discard: UDP, length 512
09:00:06.595532 IP 10.1.1.2.49153 > 10.1.1.1.discard: UDP, length 512
09:00:06.602862 IP 10.1.1.2.49153 > 10.1.1.1.discard: UDP, length 512
09:00:06.609587 IP 10.1.1.2.49153 > 10.1.1.1.discard: UDP, length 512
09:00:06.620399 IP 10.1.1.2.49153 > 10.1.1.1.discard: UDP, length 512
09:00:06.627253 IP 10.1.1.2.49153 > 10.1.1.1.discard: UDP, length 512
09:00:06.634163 IP 10.1.1.2.49153 > 10.1.1.1.discard: UDP, length 512
09:00:06.645586 IP 10.1.1.2.49153 > 10.1.1.1.discard: UDP, length 512
09:00:06.652001 IP 10.1.1.2.49153 > 10.1.1.1.discard: UDP, length 512
09:00:06.658739 IP 10.1.1.2.49153 > 10.1.1.1.discard: UDP, length 512
09:00:06.669504 IP 10.1.1.2.49153 > 10.1.1.1.discard: UDP, length 512
09:00:06.676264 IP 10.1.1.2.49153 > 10.1.1.1.discard: UDP, length 512
09:00:06.683315 IP 10.1.1.2.49153 > 10.1.1.1.discard: UDP, length 512
09:00:06.694284 IP 10.1.1.2.49153 > 10.1.1.1.discard: UDP, length 512
09:00:06.701451 IP 10.1.1.2.49153 > 10.1.1.1.discard: UDP, length 512
09:00:06.707891 IP 10.1.1.2.49153 > 10.1.1.1.discard: UDP, length 512
09:00:06.719176 IP 10.1.1.2.49153 > 10.1.1.1.discard: UDP, length 512
09:00:06.725376 IP 10.1.1.2.49153 > 10.1.1.1.discard: UDP, length 512
09:00:06.732467 IP 10.1.1.2.49153 > 10.1.1.1.discard: UDP, length 512
09:00:06.743159 IP 10.1.1.2.49153 > 10.1.1.1.discard: UDP, length 512
09:00:06.750379 IP 10.1.1.2.49153 > 10.1.1.1.discard: UDP, length 512
09:00:06.757043 IP 10.1.1.2.49153 > 10.1.1.1.discard: UDP, length 512
09:00:06.767969 IP 10.1.1.2.49153 > 10.1.1.1.discard: UDP, length 512
09:00:06.774896 IP 10.1.1.2.49153 > 10.1.1.1.discard: UDP, length 512
09:00:06.781619 IP 10.1.1.2.49153 > 10.1.1.1.discard: UDP, length 512
09:00:06.792416 IP 10.1.1.2.49153 > 10.1.1.1.discard: UDP, length 512
09:00:06.799153 IP 10.1.1.2.49153 > 10.1.1.1.discard: UDP, length 512
09:00:06.806195 IP 10.1.1.2.49153 > 10.1.1.1.discard: UDP, length 512
09:00:06.817088 IP 10.1.1.2.49153 > 10.1.1.1.discard: UDP, length 512
09:00:06.824000 IP 10.1.1.2.49153 > 10.1.1.1.discard: UDP, length 512
09:00:06.830771 IP 10.1.1.2.49153 > 10.1.1.1.discard: UDP, length 512
09:00:06.841641 IP 10.1.1.2.49153 > 10.1.1.1.discard: UDP, length 512
09:00:06.848680 IP 10.1.1.2.49153 > 10.1.1.1.discard: UDP, length 512
09:00:06.855347 IP 10.1.1.2.49153 > 10.1.1.1.discard: UDP, length 512
09:00:06.866055 IP 10.1.1.2.49153 > 10.1.1.1.discard: UDP, length 512
09:00:06.872865 IP 10.1.1.2.49153 > 10.1.1.1.discard: UDP, length 512
09:00:06.879923 IP 10.1.1.2.49153 > 10.1.1.1.discard: UDP, length 512
09:00:06.890770 IP 10.1.1.2.49153 > 10.1.1.1.discard: UDP, length 512
09:00:06.897819 IP 10.1.1.2.49153 > 10.1.1.1.discard: UDP, length 512
09:00:06.904499 IP 10.1.1.2.49153 > 10.1.1.1.discard: UDP, length 512
09:00:06.915349 IP 10.1.1.2.49153 > 10.1.1.1.discard: UDP, length 512
09:00:06.922150 IP 10.1.1.2.49153 > 10.1.1.1.discard: UDP, length 512
09:00:06.929075 IP 10.1.1.2.49153 > 10.1.1.1.discard: UDP, length 512
09:00:06.939735 IP 10.1.1.2.49153 > 10.1.1.1.discard: UDP, length 512
09:00:06.947093 IP 10.1.1.2.49153 > 10.1.1.1.discard: UDP, length 512
09:00:06.953651 IP 10.1.1.2.49153 > 10.1.1.1.discard: UDP, length 512
09:00:06.965183 IP 10.1.1.2.49153 > 10.1.1.1.discard: UDP, length 512
09:00:06.971206 IP 10.1.1.2.49153 > 10.1.1.1.discard: UDP, length 512
09:00:06.978227 IP 10.1.1.2.49153 > 10.1.1.1.discard: UDP, length 512
09:00:06.988797 IP 10.1.1.2.49153 > 10.1.1.1.discard: UDP, length 512
09:00:06.995673 IP 10.1.1.2.49153 > 10.1.1.1.discard: UDP, length 512
09:00:07.002803 IP 10.1.1.2.49153 > 10.1.1.1.discard: UDP, length 512
09:00:07.013121 IP 10.1.1.2.49153 > 10.1.1.1.discard: UDP, length 512
09:00:07.020198 IP 10.1.1.2.49153 > 10.1.1.1.discard: UDP, length 512
09:00:07.027379 IP 10.1.1.2.49153 > 10.1.1.1.discard: UDP, length 512
09:00:07.037798 IP 10.1.1.2.49153 > 10.1.1.1.discard: UDP, length 512
09:00:07.044852 IP 10.1.1.2.49153 > 10.1.1.1.discard: UDP, length 512
09:00:07.051955 IP 10.1.1.2.49153 > 10.1.1.1.discard: UDP, length 512
09:00:07.062399 IP 10.1.1.2.49153 > 10.1.1.1.discard: UDP, length 512
09:00:07.069891 IP 10.1.1.2.49153 > 10.1.1.1.discard: UDP, length 512
09:00:07.076531 IP 10.1.1.2.49153 > 10.1.1.1.discard: UDP, length 512
09:00:07.087534 IP 10.1.1.2.49153 > 10.1.1.1.discard: UDP, length 512
09:00:07.094620 IP 10.1.1.2.49153 > 10.1.1.1.discard: UDP, length 512
09:00:07.101107 IP 10.1.1.2.49153 > 10.1.1.1.discard: UDP, length 512
09:00:07.112281 IP 10.1.1.2.49153 > 10.1.1.1.discard: UDP, length 512
09:00:07.118512 IP 10.1.1.2.49153 > 10.1.1.1.discard: UDP, length 512
09:00:07.125683 IP 10.1.1.2.49153 > 10.1.1.1.discard: UDP, length 512
09:00:07.136307 IP 10.1.1.2.49153 > 10.1.1.1.discard: UDP, length 512
09:00:07.143166 IP 10.1.1.2.49153 > 10.1.1.1.discard: UDP, length 512
09:00:07.150259 IP 10.1.1.2.49153 > 10.1.1.1.discard: UDP, length 512
09:00:07.160862 IP 10.1.1.2.49153 > 10.1.1.1.discard: UDP, length 512
09:00:07.167875 IP 10.1.1.2.49153 > 10.1.1.1.discard: UDP, length 512
09:00:07.174835 IP 10.1.1.2.49153 > 10.1.1.1.discard: UDP, length 512
09:00:07.185403 IP 10.1.1.2.49153 > 10.1.1.1.discard: UDP, length 512
09:00:07.192787 IP 10.1.1.2.49153 > 10.1.1.1.discard: UDP, length 512
09:00:07.199411 IP 10.1.1.2.49153 > 10.1.1.1.discard: UDP, length 512
09:00:07.210793 IP 10.1.1.2.49153 > 10.1.1.1.discard: UDP, length 512
09:00:07.217494 IP 10.1.1.2.49153 > 10.1.1.1.discard: UDP, length 512
09:00:07.223987 IP 10.1.1.2.49153 > 10.1.1.1.discard: UDP, length 512
09:00:07.235184 IP 10.1.1.2.49153 > 10.1.1.1.discard: UDP, length 512
09:00:07.241594 IP 10.1.1.2.49153 > 10.1.1.1.discard: UDP, length 512
09:00:07.248563 IP 10.1.1.2.49153 > 10.1.1.1.discard: UDP, length 512
09:00:07.259688 IP 10.1.1.2.49153 > 10.1.1.1.discard: UDP, length 512
09:00:07.266366 IP 10.1.1.2.49153 > 10.1.1.1.discard: UDP, length 512
09:00:07.273139 IP 10.1.1.2.49153 > 10.1.1.1.discard: UDP, length 512
09:00:07.284334 IP 10.1.1.2.49153 > 10.1.1.1.discard: UDP, length 512
09:00:07.290925 IP 10.1.1.2.49153 > 10.1.1.1.discard: UDP, length 512
09:00:07.297715 IP 10.1.1.2.49153 > 10.1.1.1.discard: UDP, length 512
09:00:07.308287 IP 10.1.1.2.49153 > 10.1.1.1.discard: UDP, length 512
09:00:07.315313 IP 10.1.1.2.49153 > 10.1.1.1.discard: UDP, length 512
09:00:07.322291 IP 10.1.1.2.49153 > 10.1.1.1.discard: UDP, length 512
09:00:07.332807 IP 10.1.1.2.49153 > 10.1.1.1.discard: UDP, length 512
09:00:07.339728 IP 10.1.1.2.49153 > 10.1.1.1.discard: UDP, length 512
09:00:07.346867 IP 10.1.1.2.49153 > 10.1.1.1.discard: UDP, length 512
09:00:07.357555 IP 10.1.1.2.49153 > 10.1.1.1.discard: UDP, length 512
09:00:07.364822 IP 10.1.1.2.49153 > 10.1.1.1.discard: UDP, length 512
09:00:07.371443 IP 10.1.1.2.49153 > 10.1.1.1.discard: UDP, length 512
09:00:07.382393 IP 10.1.1.2.49153 > 10.1.1.1.discard: UDP, length 512
09:00:07.389062 IP 10.1.1.2.49153 > 10.1.1.1.discard: UDP, length 512
09:00:07.396019 IP 10.1.1.2.49153 > 10.1.1.1.discard: UDP, length 512
09:00:07.406452 IP 10.1.1.2.49153 > 10.1.1.1.discard: UDP, length 512
09:00:07.413770 IP 10.1.1.2.49153 > 10.1.1.1.discard: UDP, length 512
09:00:07.420595 IP 10.1.1.2.49153 > 10.1.1.1.discard: UDP, length 512
09:00:07.431592 IP 10.1.1.2.49153 > 10.1.1.1.discard: UDP, length 512
09:00:07.438441 IP 10.1.1.2.49153 > 10.1.1.1.discard: UDP, length 512
09:00:07.445171 IP 10.1.1.2.49153 > 10.1.1.1.discard: UDP, length 512
09:00:07.456393 IP 10.1.1.2.49153 > 10.1.1.1.discard: UDP, length 512
09:00:07.463005 IP 10.1.1.2.49153 > 10.1.1.1.discard: UDP, length 512
09:00:07.469747 IP 10.1.1.2.49153 > 10.1.1.1.discard: UDP, length 512
09:00:07.480578 IP 10.1.1.2.49153 > 10.1.1.1.discard: UDP, length 512
09:00:07.487581 IP 10.1.1.2.49153 > 10.1.1.1.discard: UDP, length 512
09:00:07.494323 IP 10.1.1.2.49153 > 10.1.1.1.discard: UDP, length 512
09:00:07.505278 IP 10.1.1.2.49153 > 10.1.1.1.discard: UDP, length 512
09:00:07.511831 IP 10.1.1.2.49153 > 10.1.1.1.discard: UDP, length 512
09:00:07.518899 IP 10.1.1.2.49153 > 10.1.1.1.discard: UDP, length 512
09:00:07.529700 IP 10.1.1.2.49153 > 10.1.1.1.discard: UDP, length 512
09:00:07.536503 IP 10.1.1.2.49153 > 10.1.1.1.discard: UDP, length 512
09:00:07.543475 IP 10.1.1.2.49153 > 10.1.1.1.discard: UDP, length 512
09:00:07.553970 IP 10.1.1.2.49153 > 10.1.1.1.discard: UDP, length 512
09:00:07.561000 IP 10.1.1.2.49153 > 10.1.1.1.discard: UDP, length 512
09:00:07.568051 IP 10.1.1.2.49153 > 10.1.1.1.discard: UDP, length 512
09:00:07.578935 IP 10.1.1.2.49153 > 10.1.1.1.discard: UDP, length 512
09:00:07.585984 IP 10.1.1.2.49153 > 10.1.1.1.discard: UDP, length 512
09:00:07.592627 IP 10.1.1.2.49153 > 10.1.1.1.discard: UDP, length 512
09:00:07.604174 IP 10.1.1.2.49153 > 10.1.1.1.discard: UDP, length 512
09:00:07.610171 IP 10.1.1.2.49153 > 10.1.1.1.discard: UDP, length 512
09:00:07.617203 IP 10.1.1.2.49153 > 10.1.1.1.discard: UDP, length 512
09:00:07.628085 IP 10.1.1.2.49153 > 10.1.1.1.discard: UDP, length 512
09:00:07.635237 IP 10.1.1.2.49153 > 10.1.1.1.discard: UDP, length 512
09:00:07.641779 IP 10.1.1.2.49153 > 10.1.1.1.discard: UDP, length 512
09:00:07.653186 IP 10.1.1.2.49153 > 10.1.1.1.discard: UDP, length 512
09:00:07.659564 IP 10.1.1.2.49153 > 10.1.1.1.discard: UDP, length 512
09:00:07.666355 IP 10.1.1.2.49153 > 10.1.1.1.discard: UDP, length 512
09:00:07.677018 IP 10.1.1.2.49153 > 10.1.1.1.discard: UDP, length 512
09:00:07.684279 IP 10.1.1.2.49153 > 10.1.1.1.discard: UDP, length 512
09:00:07.690931 IP 10.1.1.2.49153 > 10.1.1.1.discard: UDP, length 512
09:00:07.701864 IP 10.1.1.2.49153 > 10.1.1.1.discard: UDP, length 512
09:00:07.708322 IP 10.1.1.2.49153 > 10.1.1.1.discard: UDP, length 512
09:00:07.715507 IP 10.1.1.2.49153 > 10.1.1.1.discard: UDP, length 512
09:00:07.725976 IP 10.1.1.2.49153 > 10.1.1.1.discard: UDP, length 512
09:00:07.733309 IP 10.1.1.2.49153 > 10.1.1.1.discard: UDP, length 512
09:00:07.740083 IP 10.1.1.2.49153 > 10.1.1.1.discard: UDP, length 512
09:00:07.750956 IP 10.1.1.2.49153 > 10.1.1.1.discard: UDP, length 512
09:00:07.757927 IP 10.1.1.2.49153 > 10.1.1.1.discard: UDP, length 512
09:00:07.764659 IP 10.1.1.2.49153 > 10.1.1.1.discard: UDP, length 512
09:00:07.775374 IP 10.1.1.2.49153 > 10.1.1.1.discard: UDP, length 512
09:00:07.782061 IP 10.1.1.2.49153 > 10.1.1.1.discard: UDP, length 512
09:00:07.789235 IP 10.1.1.2.49153 > 10.1.1.1.discard: UDP, length 512
09:00:07.799493 IP 10.1.1.2.49153 > 10.1.1.1.discard: UDP, length 512
09:00:07.806999 IP 10.1.1.2.49153 > 10.1.1.1.discard: UDP, length 512
09:00:07.813811 IP 10.1.1.2.49153 > 10.1.1.1.discard: UDP, length 512
09:00:07.824603 IP 10.1.1.2.49153 > 10.1.1.1.discard: UDP, length 512
09:00:07.831257 IP 10.1.1.2.49153 > 10.1.1.1.discard: UDP, length 512
09:00:07.838387 IP 10.1.1.2.49153 > 10.1.1.1.discard: UDP, length 512
09:00:07.849005 IP 10.1.1.2.49153 > 10.1.1.1.discard: UDP, length 512
09:00:07.855948 IP 10.1.1.2.49153 > 10.1.1.1.discard: UDP, length 512
09:00:07.862963 IP 10.1.1.2.49153 > 10.1.1.1.discard: UDP, length 512
09:00:07.873614 IP 10.1.1.2.49153 > 10.1.1.1.discard: UDP, length 512
09:00:07.880881 IP 10.1.1.2.49153 > 10.1.1.1.discard: UDP, length 512
09:00:07.887539 IP 10.1.1.2.49153 > 10.1.1.1.discard: UDP, length 512
09:00:07.898812 IP 10.1.1.2.49153 > 10.1.1.1.discard: UDP, length 512
09:00:07.905598 IP 10.1.1.2.49153 > 10.1.1.1.discard: UDP, length 512
09:00:07.912115 IP 10.1.1.2.49153 > 10.1.1.1.discard: UDP, length 512
09:00:07.923201 IP 10.1.1.2.49153 > 10.1.1.1.discard: UDP, length 512
09:00:07.929710 IP 10.1.1.2.49153 > 10.1.1.1.discard: UDP, length 512
09:00:07.936691 IP 10.1.1.2.49153 > 10.1.1.1.discard: UDP, length 512
09:00:07.947294 IP 10.1.1.2.49153 > 10.1.1.1.discard: UDP, length 512
09:00:07.954202 IP 10.1.1.2.49153 > 10.1.1.1.discard: UDP, length 512
09:00:07.961267 IP 10.1.1.2.49153 > 10.1.1.1.discard: UDP, length 512
09:00:07.972214 IP 10.1.1.2.49153 > 10.1.1.1.discard: UDP, length 512
09:00:07.978734 IP 10.1.1.2.49153 > 10.1.1.1.discard: UDP, length 512
09:00:07.985843 IP 10.1.1.2.49153 > 10.1.1.1.discard: UDP, length 512
09:00:07.996344 IP 10.1.1.2.49153 > 10.1.1.1.discard: UDP, length 512
09:00:08.003543 IP 10.1.1.2.49153 > 10.1.1.1.discard: UDP, length 512
09:00:08.010419 IP 10.1.1.2.49153 > 10.1.1.1.discard: UDP, length 512
09:00:08.020945 IP 10.1.1.2.49153 > 10.1.1.1.discard: UDP, length 512
09:00:08.028389 IP 10.1.1.2.49153 > 10.1.1.1.discard: UDP, length 512
09:00:08.034995 IP 10.1.1.2.49153 > 10.1.1.1.discard: UDP, length 512
09:00:08.045871 IP 10.1.1.2.49153 > 10.1.1.1.discard: UDP, length 512
09:00:08.052886 IP 10.1.1.2.49153 > 10.1.1.1.discard: UDP, length 512
09:00:08.059571 IP 10.1.1.2.49153 > 10.1.1.1.discard: UDP, length 512
09:00:08.070502 IP 10.1.1.2.49153 > 10.1.1.1.discard: UDP, length 512
09:00:08.077269 IP 10.1.1.2.49153 > 10.1.1.1.discard: UDP, length 512
09:00:08.084147 IP 10.1.1.2.49153 > 10.1.1.1.discard: UDP, length 512
09:00:08.095053 IP 10.1.1.2.49153 > 10.1.1.1.discard: UDP, length 512
09:00:08.102266 IP 10.1.1.2.49153 > 10.1.1.1.discard: UDP, length 512
09:00:08.108723 IP 10.1.1.2.49153 > 10.1.1.1.discard: UDP, length 512
09:00:08.119850 IP 10.1.1.2.49153 > 10.1.1.1.discard: UDP, length 512
09:00:08.126806 IP 10.1.1.2.49153 > 10.1.1.1.discard: UDP, length 512
09:00:08.133299 IP 10.1.1.2.49153 > 10.1.1.1.discard: UDP, length 512
09:00:08.144633 IP 10.1.1.2.49153 > 10.1.1.1.discard: UDP, length 512
09:00:08.151240 IP 10.1.1.2.49153 > 10.1.1.1.discard: UDP, length 512
09:00:08.157875 IP 10.1.1.2.49153 > 10.1.1.1.discard: UDP, length 512
09:00:08.168904 IP 10.1.1.2.49153 > 10.1.1.1.discard: UDP, length 512
09:00:08.175701 IP 10.1.1.2.49153 > 10.1.1.1.discard: UDP, length 512
09:00:08.182451 IP 10.1.1.2.49153 > 10.1.1.1.discard: UDP, length 512
09:00:08.193674 IP 10.1.1.2.49153 > 10.1.1.1.discard: UDP, length 512
09:00:08.200134 IP 10.1.1.2.49153 > 10.1.1.1.discard: UDP, length 512
09:00:08.207027 IP 10.1.1.2.49153 > 10.1.1.1.discard: UDP, length 512
09:00:08.217513 IP 10.1.1.2.49153 > 10.1.1.1.discard: UDP, length 512
09:00:08.224812 IP 10.1.1.2.49153 > 10.1.1.1.discard: UDP, length 512
09:00:08.231603 IP 10.1.1.2.49153 > 10.1.1.1.discard: UDP, length 512
09:00:08.242828 IP 10.1.1.2.49153 > 10.1.1.1.discard: UDP, length 512
09:00:08.249177 IP 10.1.1.2.49153 > 10.1.1.1.discard: UDP, length 512
09:00:08.256179 IP 10.1.1.2.49153 > 10.1.1.1.discard: UDP, length 512
09:00:08.266768 IP 10.1.1.2.49153 > 10.1.1.1.discard: UDP, length 512
09:00:08.273683 IP 10.1.1.2.49153 > 10.1.1.1.discard: UDP, length 512
09:00:08.280755 IP 10.1.1.2.49153 > 10.1.1.1.discard: UDP, length 512
09:00:08.291146 IP 10.1.1.2.49153 > 10.1.1.1.discard: UDP, length 512
09:00:08.298247 IP 10.1.1.2.49153 > 10.1.1.1.discard: UDP, length 512
09:00:08.305331 IP 10.1.1.2.49153 > 10.1.1.1.discard: UDP, length 512
09:00:08.316093 IP 10.1.1.2.49153 > 10.1.1.1.discard: UDP, length 512
09:00:08.323089 IP 10.1.1.2.49153 > 10.1.1.1.discard: UDP, length 512
09:00:08.329907 IP 10.1.1.2.49153 > 10.1.1.1.discard: UDP, length 512
09:00:08.340665 IP 10.1.1.2.49153 > 10.1.1.1.discard: UDP, length 512
09:00:08.347342 IP 10.1.1.2.49153 > 10.1.1.1.discard: UDP, length 512
09:00:08.354483 IP 10.1.1.2.49153 > 10.1.1.1.discard: UDP, length 512
09:00:08.365010 IP 10.1.1.2.49153 > 10.1.1.1.discard: UDP, length 512
09:00:08.371888 IP 10.1.1.2.49153 > 10.1.1.1.discard: UDP, length 512
09:00:08.379059 IP 10.1.1.2.49153 > 10.1.1.1.discard: UDP, length 512
09:00:08.390086 IP 10.1.1.2.49153 > 10.1.1.1.discard: UDP, length 512
09:00:08.396813 IP 10.1.1.2.49153 > 10.1.1.1.discard: UDP, length 512
09:00:08.403635 IP 10.1.1.2.49153 > 10.1.1.1.discard: UDP, length 512
09:00:08.414873 IP 10.1.1.2.49153 > 10.1.1.1.discard: UDP, length 512
09:00:08.421466 IP 10.1.1.2.49153 > 10.1.1.1.discard: UDP, length 512
09:00:08.428211 IP 10.1.1.2.49153 > 10.1.1.1.discard: UDP, length 512
09:00:08.439176 IP 10.1.1.2.49153 > 10.1.1.1.discard: UDP, length 512
09:00:08.445764 IP 10.1.1.2.49153 > 10.1.1.1.discard: UDP, length 512
09:00:08.452787 IP 10.1.1.2.49153 > 10.1.1.1.discard: UDP, length 512
09:00:08.463276 IP 10.1.1.2.49153 > 10.1.1.1.discard: UDP, length 512
09:00:08.470743 IP 10.1.1.2.49153 > 10.1.1.1.discard: UDP, length 512
09:00:08.477363 IP 10.1.1.2.49153 > 10.1.1.1.discard: UDP, length 512
09:00:08.488245 IP 10.1.1.2.49153 > 10.1.1.1.discard: UDP, length 512
09:00:08.494781 IP 10.1.1.2.49153 > 10.1.1.1.discard: UDP, length 512
09:00:08.501939 IP 10.1.1.2.49153 > 10.1.1.1.discard: UDP, length 512
09:00:08.512360 IP 10.1.1.2.49153 > 10.1.1.1.discard: UDP, length 512
09:00:08.519682 IP 10.1.1.2.49153 > 10.1.1.1.discard: UDP, length 512
09:00:08.526515 IP 10.1.1.2.49153 > 10.1.1.1.discard: UDP, length 512
09:00:08.537633 IP 10.1.1.2.49153 > 10.1.1.1.discard: UDP, length 512
09:00:08.544572 IP 10.1.1.2.49153 > 10.1.1.1.discard: UDP, length 512
09:00:08.551091 IP 10.1.1.2.49153 > 10.1.1.1.discard: UDP, length 512
09:00:08.562283 IP 10.1.1.2.49153 > 10.1.1.1.discard: UDP, length 512
09:00:08.568745 IP 10.1.1.2.49153 > 10.1.1.1.discard: UDP, length 512
09:00:08.575667 IP 10.1.1.2.49153 > 10.1.1.1.discard: UDP, length 512
09:00:08.586500 IP 10.1.1.2.49153 > 10.1.1.1.discard: UDP, length 512
09:00:08.593461 IP 10.1.1.2.49153 > 10.1.1.1.discard: UDP, length 512
09:00:08.600243 IP 10.1.1.2.49153 > 10.1.1.1.discard: UDP, length 512
09:00:08.610912 IP 10.1.1.2.49153 > 10.1.1.1.discard: UDP, length 512
09:00:08.618466 IP 10.1.1.2.49153 > 10.1.1.1.discard: UDP, length 512
09:00:08.624819 IP 10.1.1.2.49153 > 10.1.1.1.discard: UDP, length 512
09:00:08.636726 IP 10.1.1.2.49153 > 10.1.1.1.discard: UDP, length 512
09:00:08.643081 IP 10.1.1.2.49153 > 10.1.1.1.discard: UDP, length 512
09:00:08.649394 IP 10.1.1.2.49153 > 10.1.1.1.discard: UDP, length 512
09:00:08.660723 IP 10.1.1.2.49153 > 10.1.1.1.discard: UDP, length 512
09:00:08.667478 IP 10.1.1.2.49153 > 10.1.1.1.discard: UDP, length 512
09:00:08.673970 IP 10.1.1.2.49153 > 10.1.1.1.discard: UDP, length 512
09:00:08.684892 IP 10.1.1.2.49153 > 10.1.1.1.discard: UDP, length 512
09:00:08.691900 IP 10.1.1.2.49153 > 10.1.1.1.discard: UDP, length 512
09:00:08.698546 IP 10.1.1.2.49153 > 10.1.1.1.discard: UDP, length 512
09:00:08.709307 IP 10.1.1.2.49153 > 10.1.1.1.discard: UDP, length 512
09:00:08.716222 IP 10.1.1.2.49153 > 10.1.1.1.discard: UDP, length 512
09:00:08.723122 IP 10.1.1.2.49153 > 10.1.1.1.discard: UDP, length 512
09:00:08.733929 IP 10.1.1.2.49153 > 10.1.1.1.discard: UDP, length 512
09:00:08.740925 IP 10.1.1.2.49153 > 10.1.1.1.discard: UDP, length 512
09:00:08.747698 IP 10.1.1.2.49153 > 10.1.1.1.discard: UDP, length 512
09:00:08.758291 IP 10.1.1.2.49153 > 10.1.1.1.discard: UDP, length 512
09:00:08.765384 IP 10.1.1.2.49153 > 10.1.1.1.discard: UDP, length 512
09:00:08.772274 IP 10.1.1.2.49153 > 10.1.1.1.discard: UDP, length 512
09:00:08.782963 IP 10.1.1.2.49153 > 10.1.1.1.discard: UDP, length 512
09:00:08.789948 IP 10.1.1.2.49153 > 10.1.1.1.discard: UDP, length 512
09:00:08.796850 IP 10.1.1.2.49153 > 10.1.1.1.discard: UDP, length 512
09:00:08.807517 IP 10.1.1.2.49153 > 10.1.1.1.discard: UDP, length 512
09:00:08.814473 IP 10.1.1.2.49153 > 10.1.1.1.discard: UDP, length 512
09:00:08.821426 IP 10.1.1.2.49153 > 10.1.1.1.discard: UDP, length 512
09:00:08.832265 IP 10.1.1.2.49153 > 10.1.1.1.discard: UDP, length 512
09:00:08.839110 IP 10.1.1.2.49153 > 10.1.1.1.discard: UDP, length 512
09:00:08.846002 IP 10.1.1.2.49153 > 10.1.1.1.discard: UDP, length 512
09:00:08.856640 IP 10.1.1.2.49153 > 10.1.1.1.discard: UDP, length 512
09:00:08.863487 IP 10.1.1.2.49153 > 10.1.1.1.discard: UDP, length 512
09:00:08.870578 IP 10.1.1.2.49153 > 10.1.1.1.discard: UDP, length 512
09:00:08.881112 IP 10.1.1.2.49153 > 10.1.1.1.discard: UDP, length 512
09:00:08.888608 IP 10.1.1.2.49153 > 10.1.1.1.discard: UDP, length 512
09:00:08.895154 IP 10.1.1.2.49153 > 10.1.1.1.discard: UDP, length 512
09:00:08.906233 IP 10.1.1.2.49153 > 10.1.1.1.discard: UDP, length 512
09:00:08.913102 IP 10.1.1.2.49153 > 10.1.1.1.discard: UDP, length 512
09:00:08.919730 IP 10.1.1.2.49153 > 10.1.1.1.discard: UDP, length 512
09:00:08.931233 IP 10.1.1.2.49153 > 10.1.1.1.discard: UDP, length 512
09:00:08.937358 IP 10.1.1.2.49153 > 10.1.1.1.discard: UDP, length 512
09:00:08.944306 IP 10.1.1.2.49153 > 10.1.1.1.discard: UDP, length 512
09:00:08.954914 IP 10.1.1.2.49153 > 10.1.1.1.discard: UDP, length 512
09:00:08.962062 IP 10.1.1.2.49153 > 10.1.1.1.discard: UDP, length 512
09:00:08.968882 IP 10.1.1.2.49153 > 10.1.1.1.discard: UDP, length 512
09:00:08.979425 IP 10.1.1.2.49153 > 10.1.1.1.discard: UDP, length 512
09:00:08.986512 IP 10.1.1.2.49153 > 10.1.1.1.discard: UDP, length 512
09:00:08.993458 IP 10.1.1.2.49153 > 10.1.1.1.discard: UDP, length 512
09:00:09.004499 IP 10.1.1.2.49153 > 10.1.1.1.discard: UDP, length 512
09:00:09.011046 IP 10.1.1.2.49153 > 10.1.1.1.discard: UDP, length 512
09:00:09.018034 IP 10.1.1.2.49153 > 10.1.1.1.discard: UDP, length 512
09:00:09.028432 IP 10.1.1.2.49153 > 10.1.1.1.discard: UDP, length 512
09:00:09.035486 IP 10.1.1.2.49153 > 10.1.1.1.discard: UDP, length 512
09:00:09.042610 IP 10.1.1.2.49153 > 10.1.1.1.discard: UDP, length 512
09:00:09.053345 IP 10.1.1.2.49153 > 10.1.1.1.discard: UDP, length 512
09:00:09.060429 IP 10.1.1.2.49153 > 10.1.1.1.discard: UDP, length 512
09:00:09.067186 IP 10.1.1.2.49153 > 10.1.1.1.discard: UDP, length 512
09:00:09.077929 IP 10.1.1.2.49153 > 10.1.1.1.discard: UDP, length 512
09:00:09.085097 IP 10.1.1.2.49153 > 10.1.1.1.discard: UDP, length 512
09:00:09.091762 IP 10.1.1.2.49153 > 10.1.1.1.discard: UDP, length 512
09:00:09.102824 IP 10.1.1.2.49153 > 10.1.1.1.discard: UDP, length 512
09:00:09.109697 IP 10.1.1.2.49153 > 10.1.1.1.discard: UDP, length 512
09:00:09.116338 IP 10.1.1.2.49153 > 10.1.1.1.discard: UDP, length 512
09:00:09.127116 IP 10.1.1.2.49153 > 10.1.1.1.discard: UDP, length 512
09:00:09.133961 IP 10.1.1.2.49153 > 10.1.1.1.discard: UDP, length 512
09:00:09.140914 IP 10.1.1.2.49153 > 10.1.1.1.discard: UDP, length 512
09:00:09.151498 IP 10.1.1.2.49153 > 10.1.1.1.discard: UDP, length 512
09:00:09.158528 IP 10.1.1.2.49153 > 10.1.1.1.discard: UDP, length 512
09:00:09.165490 IP 10.1.1.2.49153 > 10.1.1.1.discard: UDP, length 512
09:00:09.176514 IP 10.1.1.2.49153 > 10.1.1.1.discard: UDP, length 512
09:00:09.183305 IP 10.1.1.2.49153 > 10.1.1.1.discard: UDP, length 512
09:00:09.190066 IP 10.1.1.2.49153 > 10.1.1.1.discard: UDP, length 512
09:00:09.201213 IP 10.1.1.2.49153 > 10.1.1.1.discard: UDP, length 512
09:00:09.207859 IP 10.1.1.2.49153 > 10.1.1.1.discard: UDP, length 512
09:00:09.214642 IP 10.1.1.2.49153 > 10.1.1.1.discard: UDP, length 512
09:00:09.225426 IP 10.1.1.2.49153 > 10.1.1.1.discard: UDP, length 512
09:00:09.232258 IP 10.1.1.2.49153 > 10.1.1.1.discard: UDP, length 512
09:00:09.239218 IP 10.1.1.2.49153 > 10.1.1.1.discard: UDP, length 512
09:00:09.249711 IP 10.1.1.2.49153 > 10.1.1.1.discard: UDP, length 512
09:00:09.256697 IP 10.1.1.2.49153 > 10.1.1.1.discard: UDP, length 512
09:00:09.263794 IP 10.1.1.2.49153 > 10.1.1.1.discard: UDP, length 512
09:00:09.274906 IP 10.1.1.2.49153 > 10.1.1.1.discard: UDP, length 512
09:00:09.281419 IP 10.1.1.2.49153 > 10.1.1.1.discard: UDP, length 512
09:00:09.288370 IP 10.1.1.2.49153 > 10.1.1.1.discard: UDP, length 512
09:00:09.298920 IP 10.1.1.2.49153 > 10.1.1.1.discard: UDP, length 512
09:00:09.306351 IP 10.1.1.2.49153 > 10.1.1.1.discard: UDP, length 512
09:00:09.312946 IP 10.1.1.2.49153 > 10.1.1.1.discard: UDP, length 512
09:00:09.324114 IP 10.1.1.2.49153 > 10.1.1.1.discard: UDP, length 512
09:00:09.330344 IP 10.1.1.2.49153 > 10.1.1.1.discard: UDP, length 512
09:00:09.337522 IP 10.1.1.2.49153 > 10.1.1.1.discard: UDP, length 512
09:00:09.347897 IP 10.1.1.2.49153 > 10.1.1.1.discard: UDP, length 512
09:00:09.355448 IP 10.1.1.2.49153 > 10.1.1.1.discard: UDP, length 512
09:00:09.362098 IP 10.1.1.2.49153 > 10.1.1.1.discard: UDP, length 512
09:00:09.373173 IP 10.1.1.2.49153 > 10.1.1.1.discard: UDP, length 512
09:00:09.379932 IP 10.1.1.2.49153 > 10.1.1.1.discard: UDP, length 512
09:00:09.386674 IP 10.1.1.2.49153 > 10.1.1.1.discard: UDP, length 512
09:00:09.397648 IP 10.1.1.2.49153 > 10.1.1.1.discard: UDP, length 512
09:00:09.404609 IP 10.1.1.2.49153 > 10.1.1.1.discard: UDP, length 512
09:00:09.411250 IP 10.1.1.2.49153 > 10.1.1.1.discard: UDP, length 512
09:00:09.422126 IP 10.1.1.2.49153 > 10.1.1.1.discard: UDP, length 512
09:00:09.428872 IP 10.1.1.2.49153 > 10.1.1.1.discard: UDP, length 512
09:00:09.435826 IP 10.1.1.2.49153 > 10.1.1.1.discard: UDP, length 512
09:00:09.446385 IP 10.1.1.2.49153 > 10.1.1.1.discard: UDP, length 512
09:00:09.453407 IP 10.1.1.2.49153 > 10.1.1.1.discard: UDP, length 512
09:00:09.460402 IP 10.1.1.2.49153 > 10.1.1.1.discard: UDP, length 512
09:00:09.471376 IP 10.1.1.2.49153 > 10.1.1.1.discard: UDP, length 512
09:00:09.477946 IP 10.1.1.2.49153 > 10.1.1.1.discard: UDP, length 512
09:00:09.484978 IP 10.1.1.2.49153 > 10.1.1.1.discard: UDP, length 512
09:00:09.495538 IP 10.1.1.2.49153 > 10.1.1.1.discard: UDP, length 512
09:00:09.502364 IP 10.1.1.2.49153 > 10.1.1.1.discard: UDP, length 512
09:00:09.509554 IP 10.1.1.2.49153 > 10.1.1.1.discard: UDP, length 512
09:00:09.519951 IP 10.1.1.2.49153 > 10.1.1.1.discard: UDP, length 512
09:00:09.527136 IP 10.1.1.2.49153 > 10.1.1.1.discard: UDP, length 512
09:00:09.534130 IP 10.1.1.2.49153 > 10.1.1.1.discard: UDP, length 512
09:00:09.544741 IP 10.1.1.2.49153 > 10.1.1.1.discard: UDP, length 512
09:00:09.552047 IP 10.1.1.2.49153 > 10.1.1.1.discard: UDP, length 512
09:00:09.558706 IP 10.1.1.2.49153 > 10.1.1.1.discard: UDP, length 512
09:00:09.569810 IP 10.1.1.2.49153 > 10.1.1.1.discard: UDP, length 512
09:00:09.576115 IP 10.1.1.2.49153 > 10.1.1.1.discard: UDP, length 512
09:00:09.583282 IP 10.1.1.2.49153 > 10.1.1.1.discard: UDP, length 512
09:00:09.593818 IP 10.1.1.2.49153 > 10.1.1.1.discard: UDP, length 512
09:00:09.601216 IP 10.1.1.2.49153 > 10.1.1.1.discard: UDP, length 512
09:00:09.607858 IP 10.1.1.2.49153 > 10.1.1.1.discard: UDP, length 512
09:00:09.618830 IP 10.1.1.2.49153 > 10.1.1.1.discard: UDP, length 512
09:00:09.625615 IP 10.1.1.2.49153 > 10.1.1.1.discard: UDP, length 512
09:00:09.632434 IP 10.1.1.2.49153 > 10.1.1.1.discard: UDP, length 512
09:00:09.643182 IP 10.1.1.2.49153 > 10.1.1.1.discard: UDP, length 512
09:00:09.650416 IP 10.1.1.2.49153 > 10.1.1.1.discard: UDP, length 512
09:00:09.657010 IP 10.1.1.2.49153 > 10.1.1.1.discard: UDP, length 512
09:00:09.667996 IP 10.1.1.2.49153 > 10.1.1.1.discard: UDP, length 512
09:00:09.674398 IP 10.1.1.2.49153 > 10.1.1.1.discard: UDP, length 512
09:00:09.681586 IP 10.1.1.2.49153 > 10.1.1.1.discard: UDP, length 512
09:00:09.692224 IP 10.1.1.2.49153 > 10.1.1.1.discard: UDP, length 512
09:00:09.699362 IP 10.1.1.2.49153 > 10.1.1.1.discard: UDP, length 512
09:00:09.706162 IP 10.1.1.2.49153 > 10.1.1.1.discard: UDP, length 512
09:00:09.716763 IP 10.1.1.2.49153 > 10.1.1.1.discard: UDP, length 512
09:00:09.723644 IP 10.1.1.2.49153 > 10.1.1.1.discard: UDP, length 512
09:00:09.730738 IP 10.1.1.2.49153 > 10.1.1.1.discard: UDP, length 512
09:00:09.741178 IP 10.1.1.2.49153 > 10.1.1.1.discard: UDP, length 512
09:00:09.748515 IP 10.1.1.2.49153 > 10.1.1.1.discard: UDP, length 512
09:00:09.755314 IP 10.1.1.2.49153 > 10.1.1.1.discard: UDP, length 512
09:00:09.766288 IP 10.1.1.2.49153 > 10.1.1.1.discard: UDP, length 512
09:00:09.772802 IP 10.1.1.2.49153 > 10.1.1.1.discard: UDP, length 512
09:00:09.779890 IP 10.1.1.2.49153 > 10.1.1.1.discard: UDP, length 512
09:00:09.790685 IP 10.1.1.2.49153 > 10.1.1.1.discard: UDP, length 512
09:00:09.797488 IP 10.1.1.2.49153 > 10.1.1.1.discard: UDP, length 512
09:00:09.804466 IP 10.1.1.2.49153 > 10.1.1.1.discard: UDP, length 512
09:00:09.815101 IP 10.1.1.2.49153 > 10.1.1.1.discard: UDP, length 512
09:00:09.822125 IP 10.1.1.2.49153 > 10.1.1.1.discard: UDP, length 512
09:00:09.829042 IP 10.1.1.2.49153 > 10.1.1.1.discard: UDP, length 512
09:00:09.839699 IP 10.1.1.2.49153 > 10.1.1.1.discard: UDP, length 512
09:00:09.847087 IP 10.1.1.2.49153 > 10.1.1.1.discard: UDP, length 512
09:00:09.853618 IP 10.1.1.2.49153 > 10.1.1.1.discard: UDP, length 512
09:00:09.864731 IP 10.1.1.2.49153 > 10.1.1.1.discard: UDP, length 512
09:00:09.871196 IP 10.1.1.2.49153 > 10.1.1.1.discard: UDP, length 512
09:00:09.878194 IP 10.1.1.2.49153 > 10.1.1.1.discard: UDP, length 512
09:00:09.888750 IP 10.1.1.2.49153 > 10.1.1.1.discard: UDP, length 512
09:00:09.896429 IP 10.1.1.2.49153 > 10.1.1.1.discard: UDP, length 512
09:00:09.902770 IP 10.1.1.2.49153 > 10.1.1.1.discard: UDP, length 512
09:00:09.913820 IP 10.1.1.2.49153 > 10.1.1.1.discard: UDP, length 512
09:00:09.920379 IP 10.1.1.2.49153 > 10.1.1.1.discard: UDP, length 512
09:00:09.927346 IP 10.1.1.2.49153 > 10.1.1.1.discard: UDP, length 512
09:00:09.938099 IP 10.1.1.2.49153 > 10.1.1.1.discard: UDP, length 512
09:00:09.945301 IP 10.1.1.2.49153 > 10.1.1.1.discard: UDP, length 512
09:00:09.951922 IP 10.1.1.2.49153 > 10.1.1.1.discard: UDP, length 512
09:00:09.962704 IP 10.1.1.2.49153 > 10.1.1.1.discard: UDP, length 512
09:00:09.969646 IP 10.1.1.2.49153 > 10.1.1.1.discard: UDP, length 512
09:00:09.976498 IP 10.1.1.2.49153 > 10.1.1.1.discard: UDP, length 512
09:00:09.987005 IP 10.1.1.2.49153 > 10.1.1.1.discard: UDP, length 512
09:00:09.994419 IP 10.1.1.2.49153 > 10.1.1.1.discard: UDP, length 512
09:00:10.001074 IP 10.1.1.2.49153 > 10.1.1.1.discard: UDP, length 512
09:00:10.012177 IP 10.1.1.2.49153 > 10.1.1.1.discard: UDP, length 512
