09:00:01.019601 ARP, Request who-has 10.1.1.2 (Broadcast) tell 10.1.1.7, length 50
09:00:01.019601 ARP, Request who-has 10.1.1.2 (Broadcast) tell 10.1.1.7, length 50
09:00:01.036422 ARP, Reply 10.1.1.2 is-at 00:00:00:00:00:28 (oui Ethernet), length 50
09:00:01.040857 ARP, Reply 10.1.1.2 is-at 00:00:00:00:00:28 (oui Ethernet), length 50
09:00:06.023601 ARP, Request who-has 10.1.1.7 (Broadcast) tell 10.1.1.2, length 50
09:00:06.023601 ARP, Request who-has 10.1.1.7 (Broadcast) tell 10.1.1.2, length 50
09:00:06.060404 IP 10.1.1.2.49153 > 10.1.1.7.discard: UDP, length 512
09:00:06.066057 IP 10.1.1.2.49153 > 10.1.1.7.discard: UDP, length 512
09:00:06.069585 IP 10.1.1.2.49153 > 10.1.1.7.discard: UDP, length 512
09:00:06.073316 IP 10.1.1.2.49153 > 10.1.1.7.discard: UDP, length 512
09:00:06.076742 IP 10.1.1.2.49153 > 10.1.1.7.discard: UDP, length 512
09:00:06.080014 IP 10.1.1.2.49153 > 10.1.1.7.discard: UDP, length 512
09:00:06.085299 IP 10.1.1.2.49153 > 10.1.1.7.discard: UDP, length 512
09:00:06.093491 IP 10.1.1.2.49153 > 10.1.1.7.discard: UDP, length 512
09:00:06.101683 IP 10.1.1.2.49153 > 10.1.1.7.discard: UDP, length 512
09:00:06.109875 IP 10.1.1.2.49153 > 10.1.1.7.discard: UDP, length 512
09:00:06.118067 IP 10.1.1.2.49153 > 10.1.1.7.discard: UDP, length 512
09:00:06.126259 IP 10.1.1.2.49153 > 10.1.1.7.discard: UDP, length 512
09:00:06.134451 IP 10.1.1.2.49153 > 10.1.1.7.discard: UDP, length 512
09:00:06.142643 IP 10.1.1.2.49153 > 10.1.1.7.discard: UDP, length 512
09:00:06.150835 IP 10.1.1.2.49153 > 10.1.1.7.discard: UDP, length 512
09:00:06.159027 IP 10.1.1.2.49153 > 10.1.1.7.discard: UDP, length 512
09:00:06.167219 IP 10.1.1.2.49153 > 10.1.1.7.discard: UDP, length 512
09:00:06.175411 IP 10.1.1.2.49153 > 10.1.1.7.discard: UDP, length 512
09:00:06.183603 IP 10.1.1.2.49153 > 10.1.1.7.discard: UDP, length 512
09:00:06.191795 IP 10.1.1.2.49153 > 10.1.1.7.discard: UDP, length 512
09:00:06.199987 IP 10.1.1.2.49153 > 10.1.1.7.discard: UDP, length 512
09:00:06.208179 IP 10.1.1.2.49153 > 10.1.1.7.discard: UDP, length 512
09:00:06.216371 IP 10.1.1.2.49153 > 10.1.1.7.discard: UDP, length 512
09:00:06.224563 IP 10.1.1.2.49153 > 10.1.1.7.discard: UDP, length 512
09:00:06.232755 IP 10.1.1.2.49153 > 10.1.1.7.discard: UDP, length 512
09:00:06.240947 IP 10.1.1.2.49153 > 10.1.1.7.discard: UDP, length 512
09:00:06.249139 IP 10.1.1.2.49153 > 10.1.1.7.discard: UDP, length 512
09:00:06.257331 IP 10.1.1.2.49153 > 10.1.1.7.discard: UDP, length 512
09:00:06.265523 IP 10.1.1.2.49153 > 10.1.1.7.discard: UDP, length 512
09:00:06.273715 IP 10.1.1.2.49153 > 10.1.1.7.discard: UDP, length 512
09:00:06.281907 IP 10.1.1.2.49153 > 10.1.1.7.discard: UDP, length 512
09:00:06.290099 IP 10.1.1.2.49153 > 10.1.1.7.discard: UDP, length 512
09:00:06.298291 IP 10.1.1.2.49153 > 10.1.1.7.discard: UDP, length 512
09:00:06.306483 IP 10.1.1.2.49153 > 10.1.1.7.discard: UDP, length 512
09:00:06.314675 IP 10.1.1.2.49153 > 10.1.1.7.discard: UDP, length 512
09:00:06.322867 IP 10.1.1.2.49153 > 10.1.1.7.discard: UDP, length 512
09:00:06.331059 IP 10.1.1.2.49153 > 10.1.1.7.discard: UDP, length 512
09:00:06.339251 IP 10.1.1.2.49153 > 10.1.1.7.discard: UDP, length 512
09:00:06.347443 IP 10.1.1.2.49153 > 10.1.1.7.discard: UDP, length 512
09:00:06.355635 IP 10.1.1.2.49153 > 10.1.1.7.discard: UDP, length 512
09:00:06.363827 IP 10.1.1.2.49153 > 10.1.1.7.discard: UDP, length 512
09:00:06.372019 IP 10.1.1.2.49153 > 10.1.1.7.discard: UDP, length 512
09:00:06.380211 IP 10.1.1.2.49153 > 10.1.1.7.discard: UDP, length 512
09:00:06.388403 IP 10.1.1.2.49153 > 10.1.1.7.discard: UDP, length 512
09:00:06.396595 IP 10.1.1.2.49153 > 10.1.1.7.discard: UDP, length 512
09:00:06.404787 IP 10.1.1.2.49153 > 10.1.1.7.discard: UDP, length 512
09:00:06.412979 IP 10.1.1.2.49153 > 10.1.1.7.discard: UDP, length 512
09:00:06.421171 IP 10.1.1.2.49153 > 10.1.1.7.discard: UDP, length 512
09:00:06.429363 IP 10.1.1.2.49153 > 10.1.1.7.discard: UDP, length 512
09:00:06.437555 IP 10.1.1.2.49153 > 10.1.1.7.discard: UDP, length 512
09:00:06.445747 IP 10.1.1.2.49153 > 10.1.1.7.discard: UDP, length 512
09:00:06.453939 IP 10.1.1.2.49153 > 10.1.1.7.discard: UDP, length 512
09:00:06.462131 IP 10.1.1.2.49153 > 10.1.1.7.discard: UDP, length 512
09:00:06.470323 IP 10.1.1.2.49153 > 10.1.1.7.discard: UDP, length 512
09:00:06.478515 IP 10.1.1.2.49153 > 10.1.1.7.discard: UDP, length 512
09:00:06.486707 IP 10.1.1.2.49153 > 10.1.1.7.discard: UDP, length 512
09:00:06.494899 IP 10.1.1.2.49153 > 10.1.1.7.discard: UDP, length 512
09:00:06.503091 IP 10.1.1.2.49153 > 10.1.1.7.discard: UDP, length 512
09:00:06.511283 IP 10.1.1.2.49153 > 10.1.1.7.discard: UDP, length 512
09:00:06.519475 IP 10.1.1.2.49153 > 10.1.1.7.discard: UDP, length 512
09:00:06.527667 IP 10.1.1.2.49153 > 10.1.1.7.discard: UDP, length 512
09:00:06.535859 IP 10.1.1.2.49153 > 10.1.1.7.discard: UDP, length 512
09:00:06.544051 IP 10.1.1.2.49153 > 10.1.1.7.discard: UDP, length 512
09:00:06.552243 IP 10.1.1.2.49153 > 10.1.1.7.discard: UDP, length 512
09:00:06.560435 IP 10.1.1.2.49153 > 10.1.1.7.discard: UDP, length 512
09:00:06.568627 IP 10.1.1.2.49153 > 10.1.1.7.discard: UDP, length 512
09:00:06.576819 IP 10.1.1.2.49153 > 10.1.1.7.discard: UDP, length 512
09:00:06.585011 IP 10.1.1.2.49153 > 10.1.1.7.discard: UDP, length 512
09:00:06.593203 IP 10.1.1.2.49153 > 10.1.1.7.discard: UDP, length 512
09:00:06.601395 IP 10.1.1.2.49153 > 10.1.1.7.discard: UDP, length 512
09:00:06.609587 IP 10.1.1.2.49153 > 10.1.1.7.discard: UDP, length 512
09:00:06.617779 IP 10.1.1.2.49153 > 10.1.1.7.discard: UDP, length 512
09:00:06.625971 IP 10.1.1.2.49153 > 10.1.1.7.discard: UDP, length 512
09:00:06.634163 IP 10.1.1.2.49153 > 10.1.1.7.discard: UDP, length 512
09:00:06.642355 IP 10.1.1.2.49153 > 10.1.1.7.discard: UDP, length 512
09:00:06.650547 IP 10.1.1.2.49153 > 10.1.1.7.discard: UDP, length 512
09:00:06.658739 IP 10.1.1.2.49153 > 10.1.1.7.discard: UDP, length 512
09:00:06.666931 IP 10.1.1.2.49153 > 10.1.1.7.discard: UDP, length 512
09:00:06.675123 IP 10.1.1.2.49153 > 10.1.1.7.discard: UDP, length 512
09:00:06.683315 IP 10.1.1.2.49153 > 10.1.1.7.discard: UDP, length 512
09:00:06.691507 IP 10.1.1.2.49153 > 10.1.1.7.discard: UDP, length 512
09:00:06.699699 IP 10.1.1.2.49153 > 10.1.1.7.discard: UDP, length 512
09:00:06.707891 IP 10.1.1.2.49153 > 10.1.1.7.discard: UDP, length 512
09:00:06.716083 IP 10.1.1.2.49153 > 10.1.1.7.discard: UDP, length 512
09:00:06.724275 IP 10.1.1.2.49153 > 10.1.1.7.discard: UDP, length 512
09:00:06.732467 IP 10.1.1.2.49153 > 10.1.1.7.discard: UDP, length 512
09:00:06.740659 IP 10.1.1.2.49153 > 10.1.1.7.discard: UDP, length 512
09:00:06.748851 IP 10.1.1.2.49153 > 10.1.1.7.discard: UDP, length 512
09:00:06.757043 IP 10.1.1.2.49153 > 10.1.1.7.discard: UDP, length 512
09:00:06.765235 IP 10.1.1.2.49153 > 10.1.1.7.discard: UDP, length 512
09:00:06.773427 IP 10.1.1.2.49153 > 10.1.1.7.discard: UDP, length 512
09:00:06.781619 IP 10.1.1.2.49153 > 10.1.1.7.discard: UDP, length 512
09:00:06.789811 IP 10.1.1.2.49153 > 10.1.1.7.discard: UDP, length 512
09:00:06.798003 IP 10.1.1.2.49153 > 10.1.1.7.discard: UDP, length 512
09:00:06.806195 IP 10.1.1.2.49153 > 10.1.1.7.discard: UDP, length 512
09:00:06.814387 IP 10.1.1.2.49153 > 10.1.1.7.discard: UDP, length 512
09:00:06.822579 IP 10.1.1.2.49153 > 10.1.1.7.discard: UDP, length 512
09:00:06.830771 IP 10.1.1.2.49153 > 10.1.1.7.discard: UDP, length 512
09:00:06.838963 IP 10.1.1.2.49153 > 10.1.1.7.discard: UDP, length 512
09:00:06.847155 IP 10.1.1.2.49153 > 10.1.1.7.discard: UDP, length 512
09:00:06.855347 IP 10.1.1.2.49153 > 10.1.1.7.discard: UDP, length 512
09:00:06.863539 IP 10.1.1.2.49153 > 10.1.1.7.discard: UDP, length 512
09:00:06.871731 IP 10.1.1.2.49153 > 10.1.1.7.discard: UDP, length 512
09:00:06.879923 IP 10.1.1.2.49153 > 10.1.1.7.discard: UDP, length 512
09:00:06.888115 IP 10.1.1.2.49153 > 10.1.1.7.discard: UDP, length 512
09:00:06.896307 IP 10.1.1.2.49153 > 10.1.1.7.discard: UDP, length 512
09:00:06.904499 IP 10.1.1.2.49153 > 10.1.1.7.discard: UDP, length 512
09:00:06.912691 IP 10.1.1.2.49153 > 10.1.1.7.discard: UDP, length 512
09:00:06.920883 IP 10.1.1.2.49153 > 10.1.1.7.discard: UDP, length 512
09:00:06.929075 IP 10.1.1.2.49153 > 10.1.1.7.discard: UDP, length 512
09:00:06.937267 IP 10.1.1.2.49153 > 10.1.1.7.discard: UDP, length 512
09:00:06.945459 IP 10.1.1.2.49153 > 10.1.1.7.discard: UDP, length 512
09:00:06.953651 IP 10.1.1.2.49153 > 10.1.1.7.discard: UDP, length 512
09:00:06.961843 IP 10.1.1.2.49153 > 10.1.1.7.discard: UDP, length 512
09:00:06.970035 IP 10.1.1.2.49153 > 10.1.1.7.discard: UDP, length 512
09:00:06.978227 IP 10.1.1.2.49153 > 10.1.1.7.discard: UDP, length 512
09:00:06.986419 IP 10.1.1.2.49153 > 10.1.1.7.discard: UDP, length 512
09:00:06.994611 IP 10.1.1.2.49153 > 10.1.1.7.discard: UDP, length 512
09:00:07.002803 IP 10.1.1.2.49153 > 10.1.1.7.discard: UDP, length 512
09:00:07.010995 IP 10.1.1.2.49153 > 10.1.1.7.discard: UDP, length 512
09:00:07.019187 IP 10.1.1.2.49153 > 10.1.1.7.discard: UDP, length 512
09:00:07.027379 IP 10.1.1.2.49153 > 10.1.1.7.discard: UDP, length 512
09:00:07.035571 IP 10.1.1.2.49153 > 10.1.1.7.discard: UDP, length 512
09:00:07.043763 IP 10.1.1.2.49153 > 10.1.1.7.discard: UDP, length 512
09:00:07.051955 IP 10.1.1.2.49153 > 10.1.1.7.discard: UDP, length 512
09:00:07.060147 IP 10.1.1.2.49153 > 10.1.1.7.discard: UDP, length 512
09:00:07.068339 IP 10.1.1.2.49153 > 10.1.1.7.discard: UDP, length 512
09:00:07.076531 IP 10.1.1.2.49153 > 10.1.1.7.discard: UDP, length 512
09:00:07.084723 IP 10.1.1.2.49153 > 10.1.1.7.discard: UDP, length 512
09:00:07.092915 IP 10.1.1.2.49153 > 10.1.1.7.discard: UDP, length 512
09:00:07.101107 IP 10.1.1.2.49153 > 10.1.1.7.discard: UDP, length 512
09:00:07.109299 IP 10.1.1.2.49153 > 10.1.1.7.discard: UDP, length 512
09:00:07.117491 IP 10.1.1.2.49153 > 10.1.1.7.discard: UDP, length 512
09:00:07.125683 IP 10.1.1.2.49153 > 10.1.1.7.discard: UDP, length 512
09:00:07.133875 IP 10.1.1.2.49153 > 10.1.1.7.discard: UDP, length 512
09:00:07.142067 IP 10.1.1.2.49153 > 10.1.1.7.discard: UDP, length 512
09:00:07.150259 IP 10.1.1.2.49153 > 10.1.1.7.discard: UDP, length 512
09:00:07.158451 IP 10.1.1.2.49153 > 10.1.1.7.discard: UDP, length 512
09:00:07.166643 IP 10.1.1.2.49153 > 10.1.1.7.discard: UDP, length 512
09:00:07.174835 IP 10.1.1.2.49153 > 10.1.1.7.discard: UDP, length 512
09:00:07.183027 IP 10.1.1.2.49153 > 10.1.1.7.discard: UDP, length 512
09:00:07.191219 IP 10.1.1.2.49153 > 10.1.1.7.discard: UDP, length 512
09:00:07.199411 IP 10.1.1.2.49153 > 10.1.1.7.discard: UDP, length 512
09:00:07.207603 IP 10.1.1.2.49153 > 10.1.1.7.discard: UDP, length 512
09:00:07.215795 IP 10.1.1.2.49153 > 10.1.1.7.discard: UDP, length 512
09:00:07.223987 IP 10.1.1.2.49153 > 10.1.1.7.discard: UDP, length 512
09:00:07.232179 IP 10.1.1.2.49153 > 10.1.1.7.discard: UDP, length 512
09:00:07.240371 IP 10.1.1.2.49153 > 10.1.1.7.discard: UDP, length 512
09:00:07.248563 IP 10.1.1.2.49153 > 10.1.1.7.discard: UDP, length 512
09:00:07.256755 IP 10.1.1.2.49153 > 10.1.1.7.discard: UDP, length 512
09:00:07.264947 IP 10.1.1.2.49153 > 10.1.1.7.discard: UDP, length 512
09:00:07.273139 IP 10.1.1.2.49153 > 10.1.1.7.discard: UDP, length 512
09:00:07.281331 IP 10.1.1.2.49153 > 10.1.1.7.discard: UDP, length 512
09:00:07.289523 IP 10.1.1.2.49153 > 10.1.1.7.discard: UDP, length 512
09:00:07.297715 IP 10.1.1.2.49153 > 10.1.1.7.discard: UDP, length 512
09:00:07.305907 IP 10.1.1.2.49153 > 10.1.1.7.discard: UDP, length 512
09:00:07.314099 IP 10.1.1.2.49153 > 10.1.1.7.discard: UDP, length 512
09:00:07.322291 IP 10.1.1.2.49153 > 10.1.1.7.discard: UDP, length 512
09:00:07.330483 IP 10.1.1.2.49153 > 10.1.1.7.discard: UDP, length 512
09:00:07.338675 IP 10.1.1.2.49153 > 10.1.1.7.discard: UDP, length 512
09:00:07.346867 IP 10.1.1.2.49153 > 10.1.1.7.discard: UDP, length 512
09:00:07.355059 IP 10.1.1.2.49153 > 10.1.1.7.discard: UDP, length 512
09:00:07.363251 IP 10.1.1.2.49153 > 10.1.1.7.discard: UDP, length 512
09:00:07.371443 IP 10.1.1.2.49153 > 10.1.1.7.discard: UDP, length 512
09:00:07.379635 IP 10.1.1.2.49153 > 10.1.1.7.discard: UDP, length 512
09:00:07.387827 IP 10.1.1.2.49153 > 10.1.1.7.discard: UDP, length 512
09:00:07.396019 IP 10.1.1.2.49153 > 10.1.1.7.discard: UDP, length 512
09:00:07.404211 IP 10.1.1.2.49153 > 10.1.1.7.discard: UDP, length 512
09:00:07.412403 IP 10.1.1.2.49153 > 10.1.1.7.discard: UDP, length 512
09:00:07.420595 IP 10.1.1.2.49153 > 10.1.1.7.discard: UDP, length 512
09:00:07.428787 IP 10.1.1.2.49153 > 10.1.1.7.discard: UDP, length 512
09:00:07.436979 IP 10.1.1.2.49153 > 10.1.1.7.discard: UDP, length 512
09:00:07.445171 IP 10.1.1.2.49153 > 10.1.1.7.discard: UDP, length 512
09:00:07.453363 IP 10.1.1.2.49153 > 10.1.1.7.discard: UDP, length 512
09:00:07.461555 IP 10.1.1.2.49153 > 10.1.1.7.discard: UDP, length 512
09:00:07.469747 IP 10.1.1.2.49153 > 10.1.1.7.discard: UDP, length 512
09:00:07.477939 IP 10.1.1.2.49153 > 10.1.1.7.discard: UDP, length 512
09:00:07.486131 IP 10.1.1.2.49153 > 10.1.1.7.discard: UDP, length 512
09:00:07.494323 IP 10.1.1.2.49153 > 10.1.1.7.discard: UDP, length 512
09:00:07.502515 IP 10.1.1.2.49153 > 10.1.1.7.discard: UDP, length 512
09:00:07.510707 IP 10.1.1.2.49153 > 10.1.1.7.discard: UDP, length 512
09:00:07.518899 IP 10.1.1.2.49153 > 10.1.1.7.discard: UDP, length 512
09:00:07.527091 IP 10.1.1.2.49153 > 10.1.1.7.discard: UDP, length 512
09:00:07.535283 IP 10.1.1.2.49153 > 10.1.1.7.discard: UDP, length 512
09:00:07.543475 IP 10.1.1.2.49153 > 10.1.1.7.discard: UDP, length 512
09:00:07.551667 IP 10.1.1.2.49153 > 10.1.1.7.discard: UDP, length 512
09:00:07.559859 IP 10.1.1.2.49153 > 10.1.1.7.discard: UDP, length 512
09:00:07.568051 IP 10.1.1.2.49153 > 10.1.1.7.discard: UDP, length 512
09:00:07.576243 IP 10.1.1.2.49153 > 10.1.1.7.discard: UDP, length 512
09:00:07.584435 IP 10.1.1.2.49153 > 10.1.1.7.discard: UDP, length 512
09:00:07.592627 IP 10.1.1.2.49153 > 10.1.1.7.discard: UDP, length 512
09:00:07.600819 IP 10.1.1.2.49153 > 10.1.1.7.discard: UDP, length 512
09:00:07.609011 IP 10.1.1.2.49153 > 10.1.1.7.discard: UDP, length 512
09:00:07.617203 IP 10.1.1.2.49153 > 10.1.1.7.discard: UDP, length 512
09:00:07.625395 IP 10.1.1.2.49153 > 10.1.1.7.discard: UDP, length 512
09:00:07.633587 IP 10.1.1.2.49153 > 10.1.1.7.discard: UDP, length 512
09:00:07.641779 IP 10.1.1.2.49153 > 10.1.1.7.discard: UDP, length 512
09:00:07.649971 IP 10.1.1.2.49153 > 10.1.1.7.discard: UDP, length 512
09:00:07.658163 IP 10.1.1.2.49153 > 10.1.1.7.discard: UDP, length 512
09:00:07.666355 IP 10.1.1.2.49153 > 10.1.1.7.discard: UDP, length 512
09:00:07.674547 IP 10.1.1.2.49153 > 10.1.1.7.discard: UDP, length 512
09:00:07.682739 IP 10.1.1.2.49153 > 10.1.1.7.discard: UDP, length 512
09:00:07.690931 IP 10.1.1.2.49153 > 10.1.1.7.discard: UDP, length 512
09:00:07.699123 IP 10.1.1.2.49153 > 10.1.1.7.discard: UDP, length 512
09:00:07.707315 IP 10.1.1.2.49153 > 10.1.1.7.discard: UDP, length 512
09:00:07.715507 IP 10.1.1.2.49153 > 10.1.1.7.discard: UDP, length 512
09:00:07.723699 IP 10.1.1.2.49153 > 10.1.1.7.discard: UDP, length 512
09:00:07.731891 IP 10.1.1.2.49153 > 10.1.1.7.discard: UDP, length 512
09:00:07.740083 IP 10.1.1.2.49153 > 10.1.1.7.discard: UDP, length 512
09:00:07.748275 IP 10.1.1.2.49153 > 10.1.1.7.discard: UDP, length 512
09:00:07.756467 IP 10.1.1.2.49153 > 10.1.1.7.discard: UDP, length 512
09:00:07.764659 IP 10.1.1.2.49153 > 10.1.1.7.discard: UDP, length 512
09:00:07.772851 IP 10.1.1.2.49153 > 10.1.1.7.discard: UDP, length 512
09:00:07.781043 IP 10.1.1.2.49153 > 10.1.1.7.discard: UDP, length 512
09:00:07.789235 IP 10.1.1.2.49153 > 10.1.1.7.discard: UDP, length 512
09:00:07.797427 IP 10.1.1.2.49153 > 10.1.1.7.discard: UDP, length 512
09:00:07.805619 IP 10.1.1.2.49153 > 10.1.1.7.discard: UDP, length 512
09:00:07.813811 IP 10.1.1.2.49153 > 10.1.1.7.discard: UDP, length 512
09:00:07.822003 IP 10.1.1.2.49153 > 10.1.1.7.discard: UDP, length 512
09:00:07.830195 IP 10.1.1.2.49153 > 10.1.1.7.discard: UDP, length 512
09:00:07.838387 IP 10.1.1.2.49153 > 10.1.1.7.discard: UDP, length 512
09:00:07.846579 IP 10.1.1.2.49153 > 10.1.1.7.discard: UDP, length 512
09:00:07.854771 IP 10.1.1.2.49153 > 10.1.1.7.discard: UDP, length 512
09:00:07.862963 IP 10.1.1.2.49153 > 10.1.1.7.discard: UDP, length 512
09:00:07.871155 IP 10.1.1.2.49153 > 10.1.1.7.discard: UDP, length 512
09:00:07.879347 IP 10.1.1.2.49153 > 10.1.1.7.discard: UDP, length 512
09:00:07.887539 IP 10.1.1.2.49153 > 10.1.1.7.discard: UDP, length 512
09:00:07.895731 IP 10.1.1.2.49153 > 10.1.1.7.discard: UDP, length 512
09:00:07.903923 IP 10.1.1.2.49153 > 10.1.1.7.discard: UDP, length 512
09:00:07.912115 IP 10.1.1.2.49153 > 10.1.1.7.discard: UDP, length 512
09:00:07.920307 IP 10.1.1.2.49153 > 10.1.1.7.discard: UDP, length 512
09:00:07.928499 IP 10.1.1.2.49153 > 10.1.1.7.discard: UDP, length 512
09:00:07.936691 IP 10.1.1.2.49153 > 10.1.1.7.discard: UDP, length 512
09:00:07.944883 IP 10.1.1.2.49153 > 10.1.1.7.discard: UDP, length 512
09:00:07.953075 IP 10.1.1.2.49153 > 10.1.1.7.discard: UDP, length 512
09:00:07.961267 IP 10.1.1.2.49153 > 10.1.1.7.discard: UDP, length 512
09:00:07.969459 IP 10.1.1.2.49153 > 10.1.1.7.discard: UDP, length 512
09:00:07.977651 IP 10.1.1.2.49153 > 10.1.1.7.discard: UDP, length 512
09:00:07.985843 IP 10.1.1.2.49153 > 10.1.1.7.discard: UDP, length 512
09:00:07.994035 IP 10.1.1.2.49153 > 10.1.1.7.discard: UDP, length 512
09:00:08.002227 IP 10.1.1.2.49153 > 10.1.1.7.discard: UDP, length 512
09:00:08.010419 IP 10.1.1.2.49153 > 10.1.1.7.discard: UDP, length 512
09:00:08.018611 IP 10.1.1.2.49153 > 10.1.1.7.discard: UDP, length 512
09:00:08.026803 IP 10.1.1.2.49153 > 10.1.1.7.discard: UDP, length 512
09:00:08.034995 IP 10.1.1.2.49153 > 10.1.1.7.discard: UDP, length 512
09:00:08.043187 IP 10.1.1.2.49153 > 10.1.1.7.discard: UDP, length 512
09:00:08.051379 IP 10.1.1.2.49153 > 10.1.1.7.discard: UDP, length 512
09:00:08.059571 IP 10.1.1.2.49153 > 10.1.1.7.discard: UDP, length 512
09:00:08.067763 IP 10.1.1.2.49153 > 10.1.1.7.discard: UDP, length 512
09:00:08.075955 IP 10.1.1.2.49153 > 10.1.1.7.discard: UDP, length 512
09:00:08.084147 IP 10.1.1.2.49153 > 10.1.1.7.discard: UDP, length 512
09:00:08.092339 IP 10.1.1.2.49153 > 10.1.1.7.discard: UDP, length 512
09:00:08.100531 IP 10.1.1.2.49153 > 10.1.1.7.discard: UDP, length 512
09:00:08.108723 IP 10.1.1.2.49153 > 10.1.1.7.discard: UDP, length 512
09:00:08.116915 IP 10.1.1.2.49153 > 10.1.1.7.discard: UDP, length 512
09:00:08.125107 IP 10.1.1.2.49153 > 10.1.1.7.discard: UDP, length 512
09:00:08.133299 IP 10.1.1.2.49153 > 10.1.1.7.discard: UDP, length 512
09:00:08.141491 IP 10.1.1.2.49153 > 10.1.1.7.discard: UDP, length 512
09:00:08.149683 IP 10.1.1.2.49153 > 10.1.1.7.discard: UDP, length 512
09:00:08.157875 IP 10.1.1.2.49153 > 10.1.1.7.discard: UDP, length 512
09:00:08.166067 IP 10.1.1.2.49153 > 10.1.1.7.discard: UDP, length 512
09:00:08.174259 IP 10.1.1.2.49153 > 10.1.1.7.discard: UDP, length 512
09:00:08.182451 IP 10.1.1.2.49153 > 10.1.1.7.discard: UDP, length 512
09:00:08.190643 IP 10.1.1.2.49153 > 10.1.1.7.discard: UDP, length 512
09:00:08.198835 IP 10.1.1.2.49153 > 10.1.1.7.discard: UDP, length 512
09:00:08.207027 IP 10.1.1.2.49153 > 10.1.1.7.discard: UDP, length 512
09:00:08.215219 IP 10.1.1.2.49153 > 10.1.1.7.discard: UDP, length 512
09:00:08.223411 IP 10.1.1.2.49153 > 10.1.1.7.discard: UDP, length 512
09:00:08.231603 IP 10.1.1.2.49153 > 10.1.1.7.discard: UDP, length 512
09:00:08.239795 IP 10.1.1.2.49153 > 10.1.1.7.discard: UDP, length 512
09:00:08.247987 IP 10.1.1.2.49153 > 10.1.1.7.discard: UDP, length 512
09:00:08.256179 IP 10.1.1.2.49153 > 10.1.1.7.discard: UDP, length 512
09:00:08.264371 IP 10.1.1.2.49153 > 10.1.1.7.discard: UDP, length 512
09:00:08.272563 IP 10.1.1.2.49153 > 10.1.1.7.discard: UDP, length 512
09:00:08.280755 IP 10.1.1.2.49153 > 10.1.1.7.discard: UDP, length 512
09:00:08.288947 IP 10.1.1.2.49153 > 10.1.1.7.discard: UDP, length 512
09:00:08.297139 IP 10.1.1.2.49153 > 10.1.1.7.discard: UDP, length 512
09:00:08.305331 IP 10.1.1.2.49153 > 10.1.1.7.discard: UDP, length 512
09:00:08.313523 IP 10.1.1.2.49153 > 10.1.1.7.discard: UDP, length 512
09:00:08.321715 IP 10.1.1.2.49153 > 10.1.1.7.discard: UDP, length 512
09:00:08.329907 IP 10.1.1.2.49153 > 10.1.1.7.discard: UDP, length 512
09:00:08.338099 IP 10.1.1.2.49153 > 10.1.1.7.discard: UDP, length 512
09:00:08.346291 IP 10.1.1.2.49153 > 10.1.1.7.discard: UDP, length 512
09:00:08.354483 IP 10.1.1.2.49153 > 10.1.1.7.discard: UDP, length 512
09:00:08.362675 IP 10.1.1.2.49153 > 10.1.1.7.discard: UDP, length 512
09:00:08.370867 IP 10.1.1.2.49153 > 10.1.1.7.discard: UDP, length 512
09:00:08.379059 IP 10.1.1.2.49153 > 10.1.1.7.discard: UDP, length 512
09:00:08.387251 IP 10.1.1.2.49153 > 10.1.1.7.discard: UDP, length 512
09:00:08.395443 IP 10.1.1.2.49153 > 10.1.1.7.discard: UDP, length 512
09:00:08.403635 IP 10.1.1.2.49153 > 10.1.1.7.discard: UDP, length 512
09:00:08.411827 IP 10.1.1.2.49153 > 10.1.1.7.discard: UDP, length 512
09:00:08.420019 IP 10.1.1.2.49153 > 10.1.1.7.discard: UDP, length 512
09:00:08.428211 IP 10.1.1.2.49153 > 10.1.1.7.discard: UDP, length 512
09:00:08.436403 IP 10.1.1.2.49153 > 10.1.1.7.discard: UDP, length 512
09:00:08.444595 IP 10.1.1.2.49153 > 10.1.1.7.discard: UDP, length 512
09:00:08.452787 IP 10.1.1.2.49153 > 10.1.1.7.discard: UDP, length 512
09:00:08.460979 IP 10.1.1.2.49153 > 10.1.1.7.discard: UDP, length 512
09:00:08.469171 IP 10.1.1.2.49153 > 10.1.1.7.discard: UDP, length 512
09:00:08.477363 IP 10.1.1.2.49153 > 10.1.1.7.discard: UDP, length 512
09:00:08.485555 IP 10.1.1.2.49153 > 10.1.1.7.discard: UDP, length 512
09:00:08.493747 IP 10.1.1.2.49153 > 10.1.1.7.discard: UDP, length 512
09:00:08.501939 IP 10.1.1.2.49153 > 10.1.1.7.discard: UDP, length 512
09:00:08.510131 IP 10.1.1.2.49153 > 10.1.1.7.discard: UDP, length 512
09:00:08.518323 IP 10.1.1.2.49153 > 10.1.1.7.discard: UDP, length 512
09:00:08.526515 IP 10.1.1.2.49153 > 10.1.1.7.discard: UDP, length 512
09:00:08.534707 IP 10.1.1.2.49153 > 10.1.1.7.discard: UDP, length 512
09:00:08.542899 IP 10.1.1.2.49153 > 10.1.1.7.discard: UDP, length 512
09:00:08.551091 IP 10.1.1.2.49153 > 10.1.1.7.discard: UDP, length 512
09:00:08.559283 IP 10.1.1.2.49153 > 10.1.1.7.discard: UDP, length 512
09:00:08.567475 IP 10.1.1.2.49153 > 10.1.1.7.discard: UDP, length 512
09:00:08.575667 IP 10.1.1.2.49153 > 10.1.1.7.discard: UDP, length 512
09:00:08.583859 IP 10.1.1.2.49153 > 10.1.1.7.discard: UDP, length 512
09:00:08.592051 IP 10.1.1.2.49153 > 10.1.1.7.discard: UDP, length 512
09:00:08.600243 IP 10.1.1.2.49153 > 10.1.1.7.discard: UDP, length 512
09:00:08.608435 IP 10.1.1.2.49153 > 10.1.1.7.discard: UDP, length 512
09:00:08.616627 IP 10.1.1.2.49153 > 10.1.1.7.discard: UDP, length 512
09:00:08.624819 IP 10.1.1.2.49153 > 10.1.1.7.discard: UDP, length 512
09:00:08.633011 IP 10.1.1.2.49153 > 10.1.1.7.discard: UDP, length 512
09:00:08.641202 IP 10.1.1.2.49153 > 10.1.1.7.discard: UDP, length 512
09:00:08.649394 IP 10.1.1.2.49153 > 10.1.1.7.discard: UDP, length 512
09:00:08.657586 IP 10.1.1.2.49153 > 10.1.1.7.discard: UDP, length 512
09:00:08.665778 IP 10.1.1.2.49153 > 10.1.1.7.discard: UDP, length 512
09:00:08.673970 IP 10.1.1.2.49153 > 10.1.1.7.discard: UDP, length 512
09:00:08.682162 IP 10.1.1.2.49153 > 10.1.1.7.discard: UDP, length 512
09:00:08.690354 IP 10.1.1.2.49153 > 10.1.1.7.discard: UDP, length 512
09:00:08.698546 IP 10.1.1.2.49153 > 10.1.1.7.discard: UDP, length 512
09:00:08.706738 IP 10.1.1.2.49153 > 10.1.1.7.discard: UDP, length 512
09:00:08.714930 IP 10.1.1.2.49153 > 10.1.1.7.discard: UDP, length 512
09:00:08.723122 IP 10.1.1.2.49153 > 10.1.1.7.discard: UDP, length 512
09:00:08.731314 IP 10.1.1.2.49153 > 10.1.1.7.discard: UDP, length 512
09:00:08.739506 IP 10.1.1.2.49153 > 10.1.1.7.discard: UDP, length 512
09:00:08.747698 IP 10.1.1.2.49153 > 10.1.1.7.discard: UDP, length 512
09:00:08.755890 IP 10.1.1.2.49153 > 10.1.1.7.discard: UDP, length 512
09:00:08.764082 IP 10.1.1.2.49153 > 10.1.1.7.discard: UDP, length 512
09:00:08.772274 IP 10.1.1.2.49153 > 10.1.1.7.discard: UDP, length 512
09:00:08.780466 IP 10.1.1.2.49153 > 10.1.1.7.discard: UDP, length 512
09:00:08.788658 IP 10.1.1.2.49153 > 10.1.1.7.discard: UDP, length 512
09:00:08.796850 IP 10.1.1.2.49153 > 10.1.1.7.discard: UDP, length 512
09:00:08.805042 IP 10.1.1.2.49153 > 10.1.1.7.discard: UDP, length 512
09:00:08.813234 IP 10.1.1.2.49153 > 10.1.1.7.discard: UDP, length 512
09:00:08.821426 IP 10.1.1.2.49153 > 10.1.1.7.discard: UDP, length 512
09:00:08.829618 IP 10.1.1.2.49153 > 10.1.1.7.discard: UDP, length 512
09:00:08.837810 IP 10.1.1.2.49153 > 10.1.1.7.discard: UDP, length 512
09:00:08.846002 IP 10.1.1.2.49153 > 10.1.1.7.discard: UDP, length 512
09:00:08.854194 IP 10.1.1.2.49153 > 10.1.1.7.discard: UDP, length 512
09:00:08.862386 IP 10.1.1.2.49153 > 10.1.1.7.discard: UDP, length 512
09:00:08.870578 IP 10.1.1.2.49153 > 10.1.1.7.discard: UDP, length 512
09:00:08.878770 IP 10.1.1.2.49153 > 10.1.1.7.discard: UDP, length 512
09:00:08.886962 IP 10.1.1.2.49153 > 10.1.1.7.discard: UDP, length 512
09:00:08.895154 IP 10.1.1.2.49153 > 10.1.1.7.discard: UDP, length 512
09:00:08.903346 IP 10.1.1.2.49153 > 10.1.1.7.discard: UDP, length 512
09:00:08.911538 IP 10.1.1.2.49153 > 10.1.1.7.discard: UDP, length 512
09:00:08.919730 IP 10.1.1.2.49153 > 10.1.1.7.discard: UDP, length 512
09:00:08.927922 IP 10.1.1.2.49153 > 10.1.1.7.discard: UDP, length 512
09:00:08.936114 IP 10.1.1.2.49153 > 10.1.1.7.discard: UDP, length 512
09:00:08.944306 IP 10.1.1.2.49153 > 10.1.1.7.discard: UDP, length 512
09:00:08.952498 IP 10.1.1.2.49153 > 10.1.1.7.discard: UDP, length 512
09:00:08.960690 IP 10.1.1.2.49153 > 10.1.1.7.discard: UDP, length 512
09:00:08.968882 IP 10.1.1.2.49153 > 10.1.1.7.discard: UDP, length 512
09:00:08.977074 IP 10.1.1.2.49153 > 10.1.1.7.discard: UDP, length 512
09:00:08.985266 IP 10.1.1.2.49153 > 10.1.1.7.discard: UDP, length 512
09:00:08.993458 IP 10.1.1.2.49153 > 10.1.1.7.discard: UDP, length 512
09:00:09.001650 IP 10.1.1.2.49153 > 10.1.1.7.discard: UDP, length 512
09:00:09.009842 IP 10.1.1.2.49153 > 10.1.1.7.discard: UDP, length 512
09:00:09.018034 IP 10.1.1.2.49153 > 10.1.1.7.discard: UDP, length 512
09:00:09.026226 IP 10.1.1.2.49153 > 10.1.1.7.discard: UDP, length 512
09:00:09.034418 IP 10.1.1.2.49153 > 10.1.1.7.discard: UDP, length 512
09:00:09.042610 IP 10.1.1.2.49153 > 10.1.1.7.discard: UDP, length 512
09:00:09.050802 IP 10.1.1.2.49153 > 10.1.1.7.discard: UDP, length 512
09:00:09.058994 IP 10.1.1.2.49153 > 10.1.1.7.discard: UDP, length 512
09:00:09.067186 IP 10.1.1.2.49153 > 10.1.1.7.discard: UDP, length 512
09:00:09.075378 IP 10.1.1.2.49153 > 10.1.1.7.discard: UDP, length 512
09:00:09.083570 IP 10.1.1.2.49153 > 10.1.1.7.discard: UDP, length 512
09:00:09.091762 IP 10.1.1.2.49153 > 10.1.1.7.discard: UDP, length 512
09:00:09.099954 IP 10.1.1.2.49153 > 10.1.1.7.discard: UDP, length 512
09:00:09.108146 IP 10.1.1.2.49153 > 10.1.1.7.discard: UDP, length 512
09:00:09.116338 IP 10.1.1.2.49153 > 10.1.1.7.discard: UDP, length 512
09:00:09.124530 IP 10.1.1.2.49153 > 10.1.1.7.discard: UDP, length 512
09:00:09.132722 IP 10.1.1.2.49153 > 10.1.1.7.discard: UDP, length 512
09:00:09.140914 IP 10.1.1.2.49153 > 10.1.1.7.discard: UDP, length 512
09:00:09.149106 IP 10.1.1.2.49153 > 10.1.1.7.discard: UDP, length 512
09:00:09.157298 IP 10.1.1.2.49153 > 10.1.1.7.discard: UDP, length 512
09:00:09.165490 IP 10.1.1.2.49153 > 10.1.1.7.discard: UDP, length 512
09:00:09.173682 IP 10.1.1.2.49153 > 10.1.1.7.discard: UDP, length 512
09:00:09.181874 IP 10.1.1.2.49153 > 10.1.1.7.discard: UDP, length 512
09:00:09.190066 IP 10.1.1.2.49153 > 10.1.1.7.discard: UDP, length 512
09:00:09.198258 IP 10.1.1.2.49153 > 10.1.1.7.discard: UDP, length 512
09:00:09.206450 IP 10.1.1.2.49153 > 10.1.1.7.discard: UDP, length 512
09:00:09.214642 IP 10.1.1.2.49153 > 10.1.1.7.discard: UDP, length 512
09:00:09.222834 IP 10.1.1.2.49153 > 10.1.1.7.discard: UDP, length 512
09:00:09.231026 IP 10.1.1.2.49153 > 10.1.1.7.discard: UDP, length 512
09:00:09.239218 IP 10.1.1.2.49153 > 10.1.1.7.discard: UDP, length 512
09:00:09.247410 IP 10.1.1.2.49153 > 10.1.1.7.discard: UDP, length 512
09:00:09.255602 IP 10.1.1.2.49153 > 10.1.1.7.discard: UDP, length 512
09:00:09.263794 IP 10.1.1.2.49153 > 10.1.1.7.discard: UDP, length 512
09:00:09.271986 IP 10.1.1.2.49153 > 10.1.1.7.discard: UDP, length 512
09:00:09.280178 IP 10.1.1.2.49153 > 10.1.1.7.discard: UDP, length 512
09:00:09.288370 IP 10.1.1.2.49153 > 10.1.1.7.discard: UDP, length 512
09:00:09.296562 IP 10.1.1.2.49153 > 10.1.1.7.discard: UDP, length 512
09:00:09.304754 IP 10.1.1.2.49153 > 10.1.1.7.discard: UDP, length 512
09:00:09.312946 IP 10.1.1.2.49153 > 10.1.1.7.discard: UDP, length 512
09:00:09.321138 IP 10.1.1.2.49153 > 10.1.1.7.discard: UDP, length 512
09:00:09.329330 IP 10.1.1.2.49153 > 10.1.1.7.discard: UDP, length 512
09:00:09.337522 IP 10.1.1.2.49153 > 10.1.1.7.discard: UDP, length 512
09:00:09.345714 IP 10.1.1.2.49153 > 10.1.1.7.discard: UDP, length 512
09:00:09.353906 IP 10.1.1.2.49153 > 10.1.1.7.discard: UDP, length 512
09:00:09.362098 IP 10.1.1.2.49153 > 10.1.1.7.discard: UDP, length 512
09:00:09.370290 IP 10.1.1.2.49153 > 10.1.1.7.discard: UDP, length 512
09:00:09.378482 IP 10.1.1.2.49153 > 10.1.1.7.discard: UDP, length 512
09:00:09.386674 IP 10.1.1.2.49153 > 10.1.1.7.discard: UDP, length 512
09:00:09.394866 IP 10.1.1.2.49153 > 10.1.1.7.discard: UDP, length 512
09:00:09.403058 IP 10.1.1.2.49153 > 10.1.1.7.discard: UDP, length 512
09:00:09.411250 IP 10.1.1.2.49153 > 10.1.1.7.discard: UDP, length 512
09:00:09.419442 IP 10.1.1.2.49153 > 10.1.1.7.discard: UDP, length 512
09:00:09.427634 IP 10.1.1.2.49153 > 10.1.1.7.discard: UDP, length 512
09:00:09.435826 IP 10.1.1.2.49153 > 10.1.1.7.discard: UDP, length 512
09:00:09.444018 IP 10.1.1.2.49153 > 10.1.1.7.discard: UDP, length 512
09:00:09.452210 IP 10.1.1.2.49153 > 10.1.1.7.discard: UDP, length 512
09:00:09.460402 IP 10.1.1.2.49153 > 10.1.1.7.discard: UDP, length 512
09:00:09.468594 IP 10.1.1.2.49153 > 10.1.1.7.discard: UDP, length 512
09:00:09.476786 IP 10.1.1.2.49153 > 10.1.1.7.discard: UDP, length 512
09:00:09.484978 IP 10.1.1.2.49153 > 10.1.1.7.discard: UDP, length 512
09:00:09.493170 IP 10.1.1.2.49153 > 10.1.1.7.discard: UDP, length 512
09:00:09.501362 IP 10.1.1.2.49153 > 10.1.1.7.discard: UDP, length 512
09:00:09.509554 IP 10.1.1.2.49153 > 10.1.1.7.discard: UDP, length 512
09:00:09.517746 IP 10.1.1.2.49153 > 10.1.1.7.discard: UDP, length 512
09:00:09.525938 IP 10.1.1.2.49153 > 10.1.1.7.discard: UDP, length 512
09:00:09.534130 IP 10.1.1.2.49153 > 10.1.1.7.discard: UDP, length 512
09:00:09.542322 IP 10.1.1.2.49153 > 10.1.1.7.discard: UDP, length 512
09:00:09.550514 IP 10.1.1.2.49153 > 10.1.1.7.discard: UDP, length 512
09:00:09.558706 IP 10.1.1.2.49153 > 10.1.1.7.discard: UDP, length 512
09:00:09.566898 IP 10.1.1.2.49153 > 10.1.1.7.discard: UDP, length 512
09:00:09.575090 IP 10.1.1.2.49153 > 10.1.1.7.discard: UDP, length 512
09:00:09.583282 IP 10.1.1.2.49153 > 10.1.1.7.discard: UDP, length 512
09:00:09.591474 IP 10.1.1.2.49153 > 10.1.1.7.discard: UDP, length 512
09:00:09.599666 IP 10.1.1.2.49153 > 10.1.1.7.discard: UDP, length 512
09:00:09.607858 IP 10.1.1.2.49153 > 10.1.1.7.discard: UDP, length 512
09:00:09.616050 IP 10.1.1.2.49153 > 10.1.1.7.discard: UDP, length 512
09:00:09.624242 IP 10.1.1.2.49153 > 10.1.1.7.discard: UDP, length 512
09:00:09.632434 IP 10.1.1.2.49153 > 10.1.1.7.discard: UDP, length 512
09:00:09.640626 IP 10.1.1.2.49153 > 10.1.1.7.discard: UDP, length 512
09:00:09.648818 IP 10.1.1.2.49153 > 10.1.1.7.discard: UDP, length 512
09:00:09.657010 IP 10.1.1.2.49153 > 10.1.1.7.discard: UDP, length 512
09:00:09.665202 IP 10.1.1.2.49153 > 10.1.1.7.discard: UDP, length 512
09:00:09.673394 IP 10.1.1.2.49153 > 10.1.1.7.discard: UDP, length 512
09:00:09.681586 IP 10.1.1.2.49153 > 10.1.1.7.discard: UDP, length 512
09:00:09.689778 IP 10.1.1.2.49153 > 10.1.1.7.discard: UDP, length 512
09:00:09.697970 IP 10.1.1.2.49153 > 10.1.1.7.discard: UDP, length 512
09:00:09.706162 IP 10.1.1.2.49153 > 10.1.1.7.discard: UDP, length 512
09:00:09.714354 IP 10.1.1.2.49153 > 10.1.1.7.discard: UDP, length 512
09:00:09.722546 IP 10.1.1.2.49153 > 10.1.1.7.discard: UDP, length 512
09:00:09.730738 IP 10.1.1.2.49153 > 10.1.1.7.discard: UDP, length 512
09:00:09.738930 IP 10.1.1.2.49153 > 10.1.1.7.discard: UDP, length 512
09:00:09.747122 IP 10.1.1.2.49153 > 10.1.1.7.discard: UDP, length 512
09:00:09.755314 IP 10.1.1.2.49153 > 10.1.1.7.discard: UDP, length 512
09:00:09.763506 IP 10.1.1.2.49153 > 10.1.1.7.discard: UDP, length 512
09:00:09.771698 IP 10.1.1.2.49153 > 10.1.1.7.discard: UDP, length 512
09:00:09.779890 IP 10.1.1.2.49153 > 10.1.1.7.discard: UDP, length 512
09:00:09.788082 IP 10.1.1.2.49153 > 10.1.1.7.discard: UDP, length 512
09:00:09.796274 IP 10.1.1.2.49153 > 10.1.1.7.discard: UDP, length 512
09:00:09.804466 IP 10.1.1.2.49153 > 10.1.1.7.discard: UDP, length 512
09:00:09.812658 IP 10.1.1.2.49153 > 10.1.1.7.discard: UDP, length 512
09:00:09.820850 IP 10.1.1.2.49153 > 10.1.1.7.discard: UDP, length 512
09:00:09.829042 IP 10.1.1.2.49153 > 10.1.1.7.discard: UDP, length 512
09:00:09.837234 IP 10.1.1.2.49153 > 10.1.1.7.discard: UDP, length 512
09:00:09.845426 IP 10.1.1.2.49153 > 10.1.1.7.discard: UDP, length 512
09:00:09.853618 IP 10.1.1.2.49153 > 10.1.1.7.discard: UDP, length 512
09:00:09.861810 IP 10.1.1.2.49153 > 10.1.1.7.discard: UDP, length 512
09:00:09.870002 IP 10.1.1.2.49153 > 10.1.1.7.discard: UDP, length 512
09:00:09.878194 IP 10.1.1.2.49153 > 10.1.1.7.discard: UDP, length 512
09:00:09.886386 IP 10.1.1.2.49153 > 10.1.1.7.discard: UDP, length 512
09:00:09.894578 IP 10.1.1.2.49153 > 10.1.1.7.discard: UDP, length 512
09:00:09.902770 IP 10.1.1.2.49153 > 10.1.1.7.discard: UDP, length 512
09:00:09.910962 IP 10.1.1.2.49153 > 10.1.1.7.discard: UDP, length 512
09:00:09.919154 IP 10.1.1.2.49153 > 10.1.1.7.discard: UDP, length 512
09:00:09.927346 IP 10.1.1.2.49153 > 10.1.1.7.discard: UDP, length 512
09:00:09.935538 IP 10.1.1.2.49153 > 10.1.1.7.discard: UDP, length 512
09:00:09.943730 IP 10.1.1.2.49153 > 10.1.1.7.discard: UDP, length 512
09:00:09.951922 IP 10.1.1.2.49153 > 10.1.1.7.discard: UDP, length 512
09:00:09.960114 IP 10.1.1.2.49153 > 10.1.1.7.discard: UDP, length 512
09:00:09.968306 IP 10.1.1.2.49153 > 10.1.1.7.discard: UDP, length 512
09:00:09.976498 IP 10.1.1.2.49153 > 10.1.1.7.discard: UDP, length 512
09:00:09.984690 IP 10.1.1.2.49153 > 10.1.1.7.discard: UDP, length 512
09:00:09.992882 IP 10.1.1.2.49153 > 10.1.1.7.discard: UDP, length 512
09:00:10.001074 IP 10.1.1.2.49153 > 10.1.1.7.discard: UDP, length 512
09:00:10.009266 IP 10.1.1.2.49153 > 10.1.1.7.discard: UDP, length 512
