09:00:01.019601 ARP, Request who-has 10.1.1.2 (Broadcast) tell 10.1.1.7, length 50
09:00:01.019601 ARP, Request who-has 10.1.1.2 (Broadcast) tell 10.1.1.7, length 50
09:00:01.056404 IP 10.1.1.7.49153 > 10.1.1.2.discard: UDP, length 512
09:00:01.062138 IP 10.1.1.7.49153 > 10.1.1.2.discard: UDP, length 512
09:00:01.065809 IP 10.1.1.7.49153 > 10.1.1.2.discard: UDP, length 512
09:00:01.068815 IP 10.1.1.7.49153 > 10.1.1.2.discard: UDP, length 512
09:00:01.072142 IP 10.1.1.7.49153 > 10.1.1.2.discard: UDP, length 512
09:00:01.077107 IP 10.1.1.7.49153 > 10.1.1.2.discard: UDP, length 512
09:00:01.085299 IP 10.1.1.7.49153 > 10.1.1.2.discard: UDP, length 512
09:00:01.093491 IP 10.1.1.7.49153 > 10.1.1.2.discard: UDP, length 512
09:00:01.101683 IP 10.1.1.7.49153 > 10.1.1.2.discard: UDP, length 512
09:00:01.109875 IP 10.1.1.7.49153 > 10.1.1.2.discard: UDP, length 512
09:00:01.118067 IP 10.1.1.7.49153 > 10.1.1.2.discard: UDP, length 512
09:00:01.126259 IP 10.1.1.7.49153 > 10.1.1.2.discard: UDP, length 512
09:00:01.134451 IP 10.1.1.7.49153 > 10.1.1.2.discard: UDP, length 512
09:00:01.142643 IP 10.1.1.7.49153 > 10.1.1.2.discard: UDP, length 512
09:00:01.150835 IP 10.1.1.7.49153 > 10.1.1.2.discard: UDP, length 512
09:00:01.159027 IP 10.1.1.7.49153 > 10.1.1.2.discard: UDP, length 512
09:00:01.167219 IP 10.1.1.7.49153 > 10.1.1.2.discard: UDP, length 512
09:00:01.175411 IP 10.1.1.7.49153 > 10.1.1.2.discard: UDP, length 512
09:00:01.183603 IP 10.1.1.7.49153 > 10.1.1.2.discard: UDP, length 512
09:00:01.191795 IP 10.1.1.7.49153 > 10.1.1.2.discard: UDP, length 512
09:00:01.199987 IP 10.1.1.7.49153 > 10.1.1.2.discard: UDP, length 512
09:00:01.208179 IP 10.1.1.7.49153 > 10.1.1.2.discard: UDP, length 512
09:00:01.216371 IP 10.1.1.7.49153 > 10.1.1.2.discard: UDP, length 512
09:00:01.224563 IP 10.1.1.7.49153 > 10.1.1.2.discard: UDP, length 512
09:00:01.232755 IP 10.1.1.7.49153 > 10.1.1.2.discard: UDP, length 512
09:00:01.240947 IP 10.1.1.7.49153 > 10.1.1.2.discard: UDP, length 512
09:00:01.249139 IP 10.1.1.7.49153 > 10.1.1.2.discard: UDP, length 512
09:00:01.257331 IP 10.1.1.7.49153 > 10.1.1.2.discard: UDP, length 512
09:00:01.265523 IP 10.1.1.7.49153 > 10.1.1.2.discard: UDP, length 512
09:00:01.273715 IP 10.1.1.7.49153 > 10.1.1.2.discard: UDP, length 512
09:00:01.281907 IP 10.1.1.7.49153 > 10.1.1.2.discard: UDP, length 512
09:00:01.290099 IP 10.1.1.7.49153 > 10.1.1.2.discard: UDP, length 512
09:00:01.298291 IP 10.1.1.7.49153 > 10.1.1.2.discard: UDP, length 512
09:00:01.306483 IP 10.1.1.7.49153 > 10.1.1.2.discard: UDP, length 512
09:00:01.314675 IP 10.1.1.7.49153 > 10.1.1.2.discard: UDP, length 512
09:00:01.322867 IP 10.1.1.7.49153 > 10.1.1.2.discard: UDP, length 512
09:00:01.331059 IP 10.1.1.7.49153 > 10.1.1.2.discard: UDP, length 512
09:00:01.339251 IP 10.1.1.7.49153 > 10.1.1.2.discard: UDP, length 512
09:00:01.347443 IP 10.1.1.7.49153 > 10.1.1.2.discard: UDP, length 512
09:00:01.355635 IP 10.1.1.7.49153 > 10.1.1.2.discard: UDP, length 512
09:00:01.363827 IP 10.1.1.7.49153 > 10.1.1.2.discard: UDP, length 512
09:00:01.372019 IP 10.1.1.7.49153 > 10.1.1.2.discard: UDP, length 512
09:00:01.380211 IP 10.1.1.7.49153 > 10.1.1.2.discard: UDP, length 512
09:00:01.388403 IP 10.1.1.7.49153 > 10.1.1.2.discard: UDP, length 512
09:00:01.396595 IP 10.1.1.7.49153 > 10.1.1.2.discard: UDP, length 512
09:00:01.404787 IP 10.1.1.7.49153 > 10.1.1.2.discard: UDP, length 512
09:00:01.412979 IP 10.1.1.7.49153 > 10.1.1.2.discard: UDP, length 512
09:00:01.421171 IP 10.1.1.7.49153 > 10.1.1.2.discard: UDP, length 512
09:00:01.429363 IP 10.1.1.7.49153 > 10.1.1.2.discard: UDP, length 512
09:00:01.437555 IP 10.1.1.7.49153 > 10.1.1.2.discard: UDP, length 512
09:00:01.445747 IP 10.1.1.7.49153 > 10.1.1.2.discard: UDP, length 512
09:00:01.453939 IP 10.1.1.7.49153 > 10.1.1.2.discard: UDP, length 512
09:00:01.462131 IP 10.1.1.7.49153 > 10.1.1.2.discard: UDP, length 512
09:00:01.470323 IP 10.1.1.7.49153 > 10.1.1.2.discard: UDP, length 512
09:00:01.478515 IP 10.1.1.7.49153 > 10.1.1.2.discard: UDP, length 512
09:00:01.486707 IP 10.1.1.7.49153 > 10.1.1.2.discard: UDP, length 512
09:00:01.494899 IP 10.1.1.7.49153 > 10.1.1.2.discard: UDP, length 512
09:00:01.503091 IP 10.1.1.7.49153 > 10.1.1.2.discard: UDP, length 512
09:00:01.511283 IP 10.1.1.7.49153 > 10.1.1.2.discard: UDP, length 512
09:00:01.519475 IP 10.1.1.7.49153 > 10.1.1.2.discard: UDP, length 512
09:00:01.527667 IP 10.1.1.7.49153 > 10.1.1.2.discard: UDP, length 512
09:00:01.535859 IP 10.1.1.7.49153 > 10.1.1.2.discard: UDP, length 512
09:00:01.544051 IP 10.1.1.7.49153 > 10.1.1.2.discard: UDP, length 512
09:00:01.552243 IP 10.1.1.7.49153 > 10.1.1.2.discard: UDP, length 512
09:00:01.560435 IP 10.1.1.7.49153 > 10.1.1.2.discard: UDP, length 512
09:00:01.568627 IP 10.1.1.7.49153 > 10.1.1.2.discard: UDP, length 512
09:00:01.576819 IP 10.1.1.7.49153 > 10.1.1.2.discard: UDP, length 512
09:00:01.585011 IP 10.1.1.7.49153 > 10.1.1.2.discard: UDP, length 512
09:00:01.593203 IP 10.1.1.7.49153 > 10.1.1.2.discard: UDP, length 512
09:00:01.601395 IP 10.1.1.7.49153 > 10.1.1.2.discard: UDP, length 512
09:00:01.609587 IP 10.1.1.7.49153 > 10.1.1.2.discard: UDP, length 512
09:00:01.617779 IP 10.1.1.7.49153 > 10.1.1.2.discard: UDP, length 512
09:00:01.625971 IP 10.1.1.7.49153 > 10.1.1.2.discard: UDP, length 512
09:00:01.634163 IP 10.1.1.7.49153 > 10.1.1.2.discard: UDP, length 512
09:00:01.642355 IP 10.1.1.7.49153 > 10.1.1.2.discard: UDP, length 512
09:00:01.650547 IP 10.1.1.7.49153 > 10.1.1.2.discard: UDP, length 512
09:00:01.658739 IP 10.1.1.7.49153 > 10.1.1.2.discard: UDP, length 512
09:00:01.666931 IP 10.1.1.7.49153 > 10.1.1.2.discard: UDP, length 512
09:00:01.675123 IP 10.1.1.7.49153 > 10.1.1.2.discard: UDP, length 512
09:00:01.683315 IP 10.1.1.7.49153 > 10.1.1.2.discard: UDP, length 512
09:00:01.691507 IP 10.1.1.7.49153 > 10.1.1.2.discard: UDP, length 512
09:00:01.699699 IP 10.1.1.7.49153 > 10.1.1.2.discard: UDP, length 512
09:00:01.707891 IP 10.1.1.7.49153 > 10.1.1.2.discard: UDP, length 512
09:00:01.716083 IP 10.1.1.7.49153 > 10.1.1.2.discard: UDP, length 512
09:00:01.724275 IP 10.1.1.7.49153 > 10.1.1.2.discard: UDP, length 512
09:00:01.732467 IP 10.1.1.7.49153 > 10.1.1.2.discard: UDP, length 512
09:00:01.740659 IP 10.1.1.7.49153 > 10.1.1.2.discard: UDP, length 512
09:00:01.748851 IP 10.1.1.7.49153 > 10.1.1.2.discard: UDP, length 512
09:00:01.757043 IP 10.1.1.7.49153 > 10.1.1.2.discard: UDP, length 512
09:00:01.765235 IP 10.1.1.7.49153 > 10.1.1.2.discard: UDP, length 512
09:00:01.773427 IP 10.1.1.7.49153 > 10.1.1.2.discard: UDP, length 512
09:00:01.781619 IP 10.1.1.7.49153 > 10.1.1.2.discard: UDP, length 512
09:00:01.789811 IP 10.1.1.7.49153 > 10.1.1.2.discard: UDP, length 512
09:00:01.798003 IP 10.1.1.7.49153 > 10.1.1.2.discard: UDP, length 512
09:00:01.806195 IP 10.1.1.7.49153 > 10.1.1.2.discard: UDP, length 512
09:00:01.814387 IP 10.1.1.7.49153 > 10.1.1.2.discard: UDP, length 512
09:00:01.822579 IP 10.1.1.7.49153 > 10.1.1.2.discard: UDP, length 512
09:00:01.830771 IP 10.1.1.7.49153 > 10.1.1.2.discard: UDP, length 512
09:00:01.838963 IP 10.1.1.7.49153 > 10.1.1.2.discard: UDP, length 512
09:00:01.847155 IP 10.1.1.7.49153 > 10.1.1.2.discard: UDP, length 512
09:00:01.855347 IP 10.1.1.7.49153 > 10.1.1.2.discard: UDP, length 512
09:00:01.863539 IP 10.1.1.7.49153 > 10.1.1.2.discard: UDP, length 512
09:00:01.871731 IP 10.1.1.7.49153 > 10.1.1.2.discard: UDP, length 512
09:00:01.879923 IP 10.1.1.7.49153 > 10.1.1.2.discard: UDP, length 512
09:00:01.888115 IP 10.1.1.7.49153 > 10.1.1.2.discard: UDP, length 512
09:00:01.896307 IP 10.1.1.7.49153 > 10.1.1.2.discard: UDP, length 512
09:00:01.904499 IP 10.1.1.7.49153 > 10.1.1.2.discard: UDP, length 512
09:00:01.912691 IP 10.1.1.7.49153 > 10.1.1.2.discard: UDP, length 512
09:00:01.920883 IP 10.1.1.7.49153 > 10.1.1.2.discard: UDP, length 512
09:00:01.929075 IP 10.1.1.7.49153 > 10.1.1.2.discard: UDP, length 512
09:00:01.937267 IP 10.1.1.7.49153 > 10.1.1.2.discard: UDP, length 512
09:00:01.945459 IP 10.1.1.7.49153 > 10.1.1.2.discard: UDP, length 512
09:00:01.953651 IP 10.1.1.7.49153 > 10.1.1.2.discard: UDP, length 512
09:00:01.961843 IP 10.1.1.7.49153 > 10.1.1.2.discard: UDP, length 512
09:00:01.970035 IP 10.1.1.7.49153 > 10.1.1.2.discard: UDP, length 512
09:00:01.978227 IP 10.1.1.7.49153 > 10.1.1.2.discard: UDP, length 512
09:00:01.986419 IP 10.1.1.7.49153 > 10.1.1.2.discard: UDP, length 512
09:00:01.994611 IP 10.1.1.7.49153 > 10.1.1.2.discard: UDP, length 512
09:00:02.002803 IP 10.1.1.7.49153 > 10.1.1.2.discard: UDP, length 512
09:00:02.010995 IP 10.1.1.7.49153 > 10.1.1.2.discard: UDP, length 512
09:00:02.019187 IP 10.1.1.7.49153 > 10.1.1.2.discard: UDP, length 512
09:00:02.027379 IP 10.1.1.7.49153 > 10.1.1.2.discard: UDP, length 512
09:00:02.035571 IP 10.1.1.7.49153 > 10.1.1.2.discard: UDP, length 512
09:00:02.043763 IP 10.1.1.7.49153 > 10.1.1.2.discard: UDP, length 512
09:00:02.051955 IP 10.1.1.7.49153 > 10.1.1.2.discard: UDP, length 512
09:00:02.060147 IP 10.1.1.7.49153 > 10.1.1.2.discard: UDP, length 512
09:00:02.068339 IP 10.1.1.7.49153 > 10.1.1.2.discard: UDP, length 512
09:00:02.076531 IP 10.1.1.7.49153 > 10.1.1.2.discard: UDP, length 512
09:00:02.084723 IP 10.1.1.7.49153 > 10.1.1.2.discard: UDP, length 512
09:00:02.092915 IP 10.1.1.7.49153 > 10.1.1.2.discard: UDP, length 512
09:00:02.101107 IP 10.1.1.7.49153 > 10.1.1.2.discard: UDP, length 512
09:00:02.109299 IP 10.1.1.7.49153 > 10.1.1.2.discard: UDP, length 512
09:00:02.117491 IP 10.1.1.7.49153 > 10.1.1.2.discard: UDP, length 512
09:00:02.125683 IP 10.1.1.7.49153 > 10.1.1.2.discard: UDP, length 512
09:00:02.133875 IP 10.1.1.7.49153 > 10.1.1.2.discard: UDP, length 512
09:00:02.142067 IP 10.1.1.7.49153 > 10.1.1.2.discard: UDP, length 512
09:00:02.150259 IP 10.1.1.7.49153 > 10.1.1.2.discard: UDP, length 512
09:00:02.158451 IP 10.1.1.7.49153 > 10.1.1.2.discard: UDP, length 512
09:00:02.166643 IP 10.1.1.7.49153 > 10.1.1.2.discard: UDP, length 512
09:00:02.174835 IP 10.1.1.7.49153 > 10.1.1.2.discard: UDP, length 512
09:00:02.183027 IP 10.1.1.7.49153 > 10.1.1.2.discard: UDP, length 512
09:00:02.191219 IP 10.1.1.7.49153 > 10.1.1.2.discard: UDP, length 512
09:00:02.199411 IP 10.1.1.7.49153 > 10.1.1.2.discard: UDP, length 512
09:00:02.207603 IP 10.1.1.7.49153 > 10.1.1.2.discard: UDP, length 512
09:00:02.215795 IP 10.1.1.7.49153 > 10.1.1.2.discard: UDP, length 512
09:00:02.223987 IP 10.1.1.7.49153 > 10.1.1.2.discard: UDP, length 512
09:00:02.232179 IP 10.1.1.7.49153 > 10.1.1.2.discard: UDP, length 512
09:00:02.240371 IP 10.1.1.7.49153 > 10.1.1.2.discard: UDP, length 512
09:00:02.248563 IP 10.1.1.7.49153 > 10.1.1.2.discard: UDP, length 512
09:00:02.256755 IP 10.1.1.7.49153 > 10.1.1.2.discard: UDP, length 512
09:00:02.264947 IP 10.1.1.7.49153 > 10.1.1.2.discard: UDP, length 512
09:00:02.273139 IP 10.1.1.7.49153 > 10.1.1.2.discard: UDP, length 512
09:00:02.281331 IP 10.1.1.7.49153 > 10.1.1.2.discard: UDP, length 512
09:00:02.289523 IP 10.1.1.7.49153 > 10.1.1.2.discard: UDP, length 512
09:00:02.297715 IP 10.1.1.7.49153 > 10.1.1.2.discard: UDP, length 512
09:00:02.305907 IP 10.1.1.7.49153 > 10.1.1.2.discard: UDP, length 512
09:00:02.314099 IP 10.1.1.7.49153 > 10.1.1.2.discard: UDP, length 512
09:00:02.322291 IP 10.1.1.7.49153 > 10.1.1.2.discard: UDP, length 512
09:00:02.330483 IP 10.1.1.7.49153 > 10.1.1.2.discard: UDP, length 512
09:00:02.338675 IP 10.1.1.7.49153 > 10.1.1.2.discard: UDP, length 512
09:00:02.346867 IP 10.1.1.7.49153 > 10.1.1.2.discard: UDP, length 512
09:00:02.355059 IP 10.1.1.7.49153 > 10.1.1.2.discard: UDP, length 512
09:00:02.363251 IP 10.1.1.7.49153 > 10.1.1.2.discard: UDP, length 512
09:00:02.371443 IP 10.1.1.7.49153 > 10.1.1.2.discard: UDP, length 512
09:00:02.379635 IP 10.1.1.7.49153 > 10.1.1.2.discard: UDP, length 512
09:00:02.387827 IP 10.1.1.7.49153 > 10.1.1.2.discard: UDP, length 512
09:00:02.396019 IP 10.1.1.7.49153 > 10.1.1.2.discard: UDP, length 512
09:00:02.404211 IP 10.1.1.7.49153 > 10.1.1.2.discard: UDP, length 512
09:00:02.412403 IP 10.1.1.7.49153 > 10.1.1.2.discard: UDP, length 512
09:00:02.420595 IP 10.1.1.7.49153 > 10.1.1.2.discard: UDP, length 512
09:00:02.428787 IP 10.1.1.7.49153 > 10.1.1.2.discard: UDP, length 512
09:00:02.436979 IP 10.1.1.7.49153 > 10.1.1.2.discard: UDP, length 512
09:00:02.445171 IP 10.1.1.7.49153 > 10.1.1.2.discard: UDP, length 512
09:00:02.453363 IP 10.1.1.7.49153 > 10.1.1.2.discard: UDP, length 512
09:00:02.461555 IP 10.1.1.7.49153 > 10.1.1.2.discard: UDP, length 512
09:00:02.469747 IP 10.1.1.7.49153 > 10.1.1.2.discard: UDP, length 512
09:00:02.477939 IP 10.1.1.7.49153 > 10.1.1.2.discard: UDP, length 512
09:00:02.486131 IP 10.1.1.7.49153 > 10.1.1.2.discard: UDP, length 512
09:00:02.494323 IP 10.1.1.7.49153 > 10.1.1.2.discard: UDP, length 512
09:00:02.502515 IP 10.1.1.7.49153 > 10.1.1.2.discard: UDP, length 512
09:00:02.510707 IP 10.1.1.7.49153 > 10.1.1.2.discard: UDP, length 512
09:00:02.518899 IP 10.1.1.7.49153 > 10.1.1.2.discard: UDP, length 512
09:00:02.527091 IP 10.1.1.7.49153 > 10.1.1.2.discard: UDP, length 512
09:00:02.535283 IP 10.1.1.7.49153 > 10.1.1.2.discard: UDP, length 512
09:00:02.543475 IP 10.1.1.7.49153 > 10.1.1.2.discard: UDP, length 512
09:00:02.551667 IP 10.1.1.7.49153 > 10.1.1.2.discard: UDP, length 512
09:00:02.559859 IP 10.1.1.7.49153 > 10.1.1.2.discard: UDP, length 512
09:00:02.568051 IP 10.1.1.7.49153 > 10.1.1.2.discard: UDP, length 512
09:00:02.576243 IP 10.1.1.7.49153 > 10.1.1.2.discard: UDP, length 512
09:00:02.584435 IP 10.1.1.7.49153 > 10.1.1.2.discard: UDP, length 512
09:00:02.592627 IP 10.1.1.7.49153 > 10.1.1.2.discard: UDP, length 512
09:00:02.600819 IP 10.1.1.7.49153 > 10.1.1.2.discard: UDP, length 512
09:00:02.609011 IP 10.1.1.7.49153 > 10.1.1.2.discard: UDP, length 512
09:00:02.617203 IP 10.1.1.7.49153 > 10.1.1.2.discard: UDP, length 512
09:00:02.625395 IP 10.1.1.7.49153 > 10.1.1.2.discard: UDP, length 512
09:00:02.633587 IP 10.1.1.7.49153 > 10.1.1.2.discard: UDP, length 512
09:00:02.641779 IP 10.1.1.7.49153 > 10.1.1.2.discard: UDP, length 512
09:00:02.649971 IP 10.1.1.7.49153 > 10.1.1.2.discard: UDP, length 512
09:00:02.658163 IP 10.1.1.7.49153 > 10.1.1.2.discard: UDP, length 512
09:00:02.666355 IP 10.1.1.7.49153 > 10.1.1.2.discard: UDP, length 512
09:00:02.674547 IP 10.1.1.7.49153 > 10.1.1.2.discard: UDP, length 512
09:00:02.682739 IP 10.1.1.7.49153 > 10.1.1.2.discard: UDP, length 512
09:00:02.690931 IP 10.1.1.7.49153 > 10.1.1.2.discard: UDP, length 512
09:00:02.699123 IP 10.1.1.7.49153 > 10.1.1.2.discard: UDP, length 512
09:00:02.707315 IP 10.1.1.7.49153 > 10.1.1.2.discard: UDP, length 512
09:00:02.715507 IP 10.1.1.7.49153 > 10.1.1.2.discard: UDP, length 512
09:00:02.723699 IP 10.1.1.7.49153 > 10.1.1.2.discard: UDP, length 512
09:00:02.731891 IP 10.1.1.7.49153 > 10.1.1.2.discard: UDP, length 512
09:00:02.740083 IP 10.1.1.7.49153 > 10.1.1.2.discard: UDP, length 512
09:00:02.748275 IP 10.1.1.7.49153 > 10.1.1.2.discard: UDP, length 512
09:00:02.756467 IP 10.1.1.7.49153 > 10.1.1.2.discard: UDP, length 512
09:00:02.764659 IP 10.1.1.7.49153 > 10.1.1.2.discard: UDP, length 512
09:00:02.772851 IP 10.1.1.7.49153 > 10.1.1.2.discard: UDP, length 512
09:00:02.781043 IP 10.1.1.7.49153 > 10.1.1.2.discard: UDP, length 512
09:00:02.789235 IP 10.1.1.7.49153 > 10.1.1.2.discard: UDP, length 512
09:00:02.797427 IP 10.1.1.7.49153 > 10.1.1.2.discard: UDP, length 512
09:00:02.805619 IP 10.1.1.7.49153 > 10.1.1.2.discard: UDP, length 512
09:00:02.813811 IP 10.1.1.7.49153 > 10.1.1.2.discard: UDP, length 512
09:00:02.822003 IP 10.1.1.7.49153 > 10.1.1.2.discard: UDP, length 512
09:00:02.830195 IP 10.1.1.7.49153 > 10.1.1.2.discard: UDP, length 512
09:00:02.838387 IP 10.1.1.7.49153 > 10.1.1.2.discard: UDP, length 512
09:00:02.846579 IP 10.1.1.7.49153 > 10.1.1.2.discard: UDP, length 512
09:00:02.854771 IP 10.1.1.7.49153 > 10.1.1.2.discard: UDP, length 512
09:00:02.862963 IP 10.1.1.7.49153 > 10.1.1.2.discard: UDP, length 512
09:00:02.871155 IP 10.1.1.7.49153 > 10.1.1.2.discard: UDP, length 512
09:00:02.879347 IP 10.1.1.7.49153 > 10.1.1.2.discard: UDP, length 512
09:00:02.887539 IP 10.1.1.7.49153 > 10.1.1.2.discard: UDP, length 512
09:00:02.895731 IP 10.1.1.7.49153 > 10.1.1.2.discard: UDP, length 512
09:00:02.903923 IP 10.1.1.7.49153 > 10.1.1.2.discard: UDP, length 512
09:00:02.912115 IP 10.1.1.7.49153 > 10.1.1.2.discard: UDP, length 512
09:00:02.920307 IP 10.1.1.7.49153 > 10.1.1.2.discard: UDP, length 512
09:00:02.928499 IP 10.1.1.7.49153 > 10.1.1.2.discard: UDP, length 512
09:00:02.936691 IP 10.1.1.7.49153 > 10.1.1.2.discard: UDP, length 512
09:00:02.944883 IP 10.1.1.7.49153 > 10.1.1.2.discard: UDP, length 512
09:00:02.953075 IP 10.1.1.7.49153 > 10.1.1.2.discard: UDP, length 512
09:00:02.961267 IP 10.1.1.7.49153 > 10.1.1.2.discard: UDP, length 512
09:00:02.969459 IP 10.1.1.7.49153 > 10.1.1.2.discard: UDP, length 512
09:00:02.977651 IP 10.1.1.7.49153 > 10.1.1.2.discard: UDP, length 512
09:00:02.985843 IP 10.1.1.7.49153 > 10.1.1.2.discard: UDP, length 512
09:00:02.994035 IP 10.1.1.7.49153 > 10.1.1.2.discard: UDP, length 512
09:00:03.002227 IP 10.1.1.7.49153 > 10.1.1.2.discard: UDP, length 512
09:00:03.010419 IP 10.1.1.7.49153 > 10.1.1.2.discard: UDP, length 512
09:00:03.018611 IP 10.1.1.7.49153 > 10.1.1.2.discard: UDP, length 512
09:00:03.026803 IP 10.1.1.7.49153 > 10.1.1.2.discard: UDP, length 512
09:00:03.034995 IP 10.1.1.7.49153 > 10.1.1.2.discard: UDP, length 512
09:00:03.043187 IP 10.1.1.7.49153 > 10.1.1.2.discard: UDP, length 512
09:00:03.051379 IP 10.1.1.7.49153 > 10.1.1.2.discard: UDP, length 512
09:00:03.059571 IP 10.1.1.7.49153 > 10.1.1.2.discard: UDP, length 512
09:00:03.067763 IP 10.1.1.7.49153 > 10.1.1.2.discard: UDP, length 512
09:00:03.075955 IP 10.1.1.7.49153 > 10.1.1.2.discard: UDP, length 512
09:00:03.084147 IP 10.1.1.7.49153 > 10.1.1.2.discard: UDP, length 512
09:00:03.092339 IP 10.1.1.7.49153 > 10.1.1.2.discard: UDP, length 512
09:00:03.100531 IP 10.1.1.7.49153 > 10.1.1.2.discard: UDP, length 512
09:00:03.108723 IP 10.1.1.7.49153 > 10.1.1.2.discard: UDP, length 512
09:00:03.116915 IP 10.1.1.7.49153 > 10.1.1.2.discard: UDP, length 512
09:00:03.125107 IP 10.1.1.7.49153 > 10.1.1.2.discard: UDP, length 512
09:00:03.133299 IP 10.1.1.7.49153 > 10.1.1.2.discard: UDP, length 512
09:00:03.141491 IP 10.1.1.7.49153 > 10.1.1.2.discard: UDP, length 512
09:00:03.149683 IP 10.1.1.7.49153 > 10.1.1.2.discard: UDP, length 512
09:00:03.157875 IP 10.1.1.7.49153 > 10.1.1.2.discard: UDP, length 512
09:00:03.166067 IP 10.1.1.7.49153 > 10.1.1.2.discard: UDP, length 512
09:00:03.174259 IP 10.1.1.7.49153 > 10.1.1.2.discard: UDP, length 512
09:00:03.182451 IP 10.1.1.7.49153 > 10.1.1.2.discard: UDP, length 512
09:00:03.190643 IP 10.1.1.7.49153 > 10.1.1.2.discard: UDP, length 512
09:00:03.198835 IP 10.1.1.7.49153 > 10.1.1.2.discard: UDP, length 512
09:00:03.207027 IP 10.1.1.7.49153 > 10.1.1.2.discard: UDP, length 512
09:00:03.215219 IP 10.1.1.7.49153 > 10.1.1.2.discard: UDP, length 512
09:00:03.223411 IP 10.1.1.7.49153 > 10.1.1.2.discard: UDP, length 512
09:00:03.231603 IP 10.1.1.7.49153 > 10.1.1.2.discard: UDP, length 512
09:00:03.239795 IP 10.1.1.7.49153 > 10.1.1.2.discard: UDP, length 512
09:00:03.247987 IP 10.1.1.7.49153 > 10.1.1.2.discard: UDP, length 512
09:00:03.256179 IP 10.1.1.7.49153 > 10.1.1.2.discard: UDP, length 512
09:00:03.264371 IP 10.1.1.7.49153 > 10.1.1.2.discard: UDP, length 512
09:00:03.272563 IP 10.1.1.7.49153 > 10.1.1.2.discard: UDP, length 512
09:00:03.280755 IP 10.1.1.7.49153 > 10.1.1.2.discard: UDP, length 512
09:00:03.288947 IP 10.1.1.7.49153 > 10.1.1.2.discard: UDP, length 512
09:00:03.297139 IP 10.1.1.7.49153 > 10.1.1.2.discard: UDP, length 512
09:00:03.305331 IP 10.1.1.7.49153 > 10.1.1.2.discard: UDP, length 512
09:00:03.313523 IP 10.1.1.7.49153 > 10.1.1.2.discard: UDP, length 512
09:00:03.321715 IP 10.1.1.7.49153 > 10.1.1.2.discard: UDP, length 512
09:00:03.329907 IP 10.1.1.7.49153 > 10.1.1.2.discard: UDP, length 512
09:00:03.338099 IP 10.1.1.7.49153 > 10.1.1.2.discard: UDP, length 512
09:00:03.346291 IP 10.1.1.7.49153 > 10.1.1.2.discard: UDP, length 512
09:00:03.354483 IP 10.1.1.7.49153 > 10.1.1.2.discard: UDP, length 512
09:00:03.362675 IP 10.1.1.7.49153 > 10.1.1.2.discard: UDP, length 512
09:00:03.370867 IP 10.1.1.7.49153 > 10.1.1.2.discard: UDP, length 512
09:00:03.379059 IP 10.1.1.7.49153 > 10.1.1.2.discard: UDP, length 512
09:00:03.387251 IP 10.1.1.7.49153 > 10.1.1.2.discard: UDP, length 512
09:00:03.395443 IP 10.1.1.7.49153 > 10.1.1.2.discard: UDP, length 512
09:00:03.403635 IP 10.1.1.7.49153 > 10.1.1.2.discard: UDP, length 512
09:00:03.411827 IP 10.1.1.7.49153 > 10.1.1.2.discard: UDP, length 512
09:00:03.420019 IP 10.1.1.7.49153 > 10.1.1.2.discard: UDP, length 512
09:00:03.428211 IP 10.1.1.7.49153 > 10.1.1.2.discard: UDP, length 512
09:00:03.436403 IP 10.1.1.7.49153 > 10.1.1.2.discard: UDP, length 512
09:00:03.444595 IP 10.1.1.7.49153 > 10.1.1.2.discard: UDP, length 512
09:00:03.452787 IP 10.1.1.7.49153 > 10.1.1.2.discard: UDP, length 512
09:00:03.460979 IP 10.1.1.7.49153 > 10.1.1.2.discard: UDP, length 512
09:00:03.469171 IP 10.1.1.7.49153 > 10.1.1.2.discard: UDP, length 512
09:00:03.477363 IP 10.1.1.7.49153 > 10.1.1.2.discard: UDP, length 512
09:00:03.485555 IP 10.1.1.7.49153 > 10.1.1.2.discard: UDP, length 512
09:00:03.493747 IP 10.1.1.7.49153 > 10.1.1.2.discard: UDP, length 512
09:00:03.501939 IP 10.1.1.7.49153 > 10.1.1.2.discard: UDP, length 512
09:00:03.510131 IP 10.1.1.7.49153 > 10.1.1.2.discard: UDP, length 512
09:00:03.518323 IP 10.1.1.7.49153 > 10.1.1.2.discard: UDP, length 512
09:00:03.526515 IP 10.1.1.7.49153 > 10.1.1.2.discard: UDP, length 512
09:00:03.534707 IP 10.1.1.7.49153 > 10.1.1.2.discard: UDP, length 512
09:00:03.542899 IP 10.1.1.7.49153 > 10.1.1.2.discard: UDP, length 512
09:00:03.551091 IP 10.1.1.7.49153 > 10.1.1.2.discard: UDP, length 512
09:00:03.559283 IP 10.1.1.7.49153 > 10.1.1.2.discard: UDP, length 512
09:00:03.567475 IP 10.1.1.7.49153 > 10.1.1.2.discard: UDP, length 512
09:00:03.575667 IP 10.1.1.7.49153 > 10.1.1.2.discard: UDP, length 512
09:00:03.583859 IP 10.1.1.7.49153 > 10.1.1.2.discard: UDP, length 512
09:00:03.592051 IP 10.1.1.7.49153 > 10.1.1.2.discard: UDP, length 512
09:00:03.600243 IP 10.1.1.7.49153 > 10.1.1.2.discard: UDP, length 512
09:00:03.608435 IP 10.1.1.7.49153 > 10.1.1.2.discard: UDP, length 512
09:00:03.616627 IP 10.1.1.7.49153 > 10.1.1.2.discard: UDP, length 512
09:00:03.624819 IP 10.1.1.7.49153 > 10.1.1.2.discard: UDP, length 512
09:00:03.633011 IP 10.1.1.7.49153 > 10.1.1.2.discard: UDP, length 512
09:00:03.641202 IP 10.1.1.7.49153 > 10.1.1.2.discard: UDP, length 512
09:00:03.649394 IP 10.1.1.7.49153 > 10.1.1.2.discard: UDP, length 512
09:00:03.657586 IP 10.1.1.7.49153 > 10.1.1.2.discard: UDP, length 512
09:00:03.665778 IP 10.1.1.7.49153 > 10.1.1.2.discard: UDP, length 512
09:00:03.673970 IP 10.1.1.7.49153 > 10.1.1.2.discard: UDP, length 512
09:00:03.682162 IP 10.1.1.7.49153 > 10.1.1.2.discard: UDP, length 512
09:00:03.690354 IP 10.1.1.7.49153 > 10.1.1.2.discard: UDP, length 512
09:00:03.698546 IP 10.1.1.7.49153 > 10.1.1.2.discard: UDP, length 512
09:00:03.706738 IP 10.1.1.7.49153 > 10.1.1.2.discard: UDP, length 512
09:00:03.714930 IP 10.1.1.7.49153 > 10.1.1.2.discard: UDP, length 512
09:00:03.723122 IP 10.1.1.7.49153 > 10.1.1.2.discard: UDP, length 512
09:00:03.731314 IP 10.1.1.7.49153 > 10.1.1.2.discard: UDP, length 512
09:00:03.739506 IP 10.1.1.7.49153 > 10.1.1.2.discard: UDP, length 512
09:00:03.747698 IP 10.1.1.7.49153 > 10.1.1.2.discard: UDP, length 512
09:00:03.755890 IP 10.1.1.7.49153 > 10.1.1.2.discard: UDP, length 512
09:00:03.764082 IP 10.1.1.7.49153 > 10.1.1.2.discard: UDP, length 512
09:00:03.772274 IP 10.1.1.7.49153 > 10.1.1.2.discard: UDP, length 512
09:00:03.780466 IP 10.1.1.7.49153 > 10.1.1.2.discard: UDP, length 512
09:00:03.788658 IP 10.1.1.7.49153 > 10.1.1.2.discard: UDP, length 512
09:00:03.796850 IP 10.1.1.7.49153 > 10.1.1.2.discard: UDP, length 512
09:00:03.805042 IP 10.1.1.7.49153 > 10.1.1.2.discard: UDP, length 512
09:00:03.813234 IP 10.1.1.7.49153 > 10.1.1.2.discard: UDP, length 512
09:00:03.821426 IP 10.1.1.7.49153 > 10.1.1.2.discard: UDP, length 512
09:00:03.829618 IP 10.1.1.7.49153 > 10.1.1.2.discard: UDP, length 512
09:00:03.837810 IP 10.1.1.7.49153 > 10.1.1.2.discard: UDP, length 512
09:00:03.846002 IP 10.1.1.7.49153 > 10.1.1.2.discard: UDP, length 512
09:00:03.854194 IP 10.1.1.7.49153 > 10.1.1.2.discard: UDP, length 512
09:00:03.862386 IP 10.1.1.7.49153 > 10.1.1.2.discard: UDP, length 512
09:00:03.870578 IP 10.1.1.7.49153 > 10.1.1.2.discard: UDP, length 512
09:00:03.878770 IP 10.1.1.7.49153 > 10.1.1.2.discard: UDP, length 512
09:00:03.886962 IP 10.1.1.7.49153 > 10.1.1.2.discard: UDP, length 512
09:00:03.895154 IP 10.1.1.7.49153 > 10.1.1.2.discard: UDP, length 512
09:00:03.903346 IP 10.1.1.7.49153 > 10.1.1.2.discard: UDP, length 512
09:00:03.911538 IP 10.1.1.7.49153 > 10.1.1.2.discard: UDP, length 512
09:00:03.919730 IP 10.1.1.7.49153 > 10.1.1.2.discard: UDP, length 512
09:00:03.927922 IP 10.1.1.7.49153 > 10.1.1.2.discard: UDP, length 512
09:00:03.936114 IP 10.1.1.7.49153 > 10.1.1.2.discard: UDP, length 512
09:00:03.944306 IP 10.1.1.7.49153 > 10.1.1.2.discard: UDP, length 512
09:00:03.952498 IP 10.1.1.7.49153 > 10.1.1.2.discard: UDP, length 512
09:00:03.960690 IP 10.1.1.7.49153 > 10.1.1.2.discard: UDP, length 512
09:00:03.968882 IP 10.1.1.7.49153 > 10.1.1.2.discard: UDP, length 512
09:00:03.977074 IP 10.1.1.7.49153 > 10.1.1.2.discard: UDP, length 512
09:00:03.985266 IP 10.1.1.7.49153 > 10.1.1.2.discard: UDP, length 512
09:00:03.993458 IP 10.1.1.7.49153 > 10.1.1.2.discard: UDP, length 512
09:00:04.001650 IP 10.1.1.7.49153 > 10.1.1.2.discard: UDP, length 512
09:00:04.009842 IP 10.1.1.7.49153 > 10.1.1.2.discard: UDP, length 512
09:00:04.018034 IP 10.1.1.7.49153 > 10.1.1.2.discard: UDP, length 512
09:00:04.026226 IP 10.1.1.7.49153 > 10.1.1.2.discard: UDP, length 512
09:00:04.034418 IP 10.1.1.7.49153 > 10.1.1.2.discard: UDP, length 512
09:00:04.042610 IP 10.1.1.7.49153 > 10.1.1.2.discard: UDP, length 512
09:00:04.050802 IP 10.1.1.7.49153 > 10.1.1.2.discard: UDP, length 512
09:00:04.058994 IP 10.1.1.7.49153 > 10.1.1.2.discard: UDP, length 512
09:00:04.067186 IP 10.1.1.7.49153 > 10.1.1.2.discard: UDP, length 512
09:00:04.075378 IP 10.1.1.7.49153 > 10.1.1.2.discard: UDP, length 512
09:00:04.083570 IP 10.1.1.7.49153 > 10.1.1.2.discard: UDP, length 512
09:00:04.091762 IP 10.1.1.7.49153 > 10.1.1.2.discard: UDP, length 512
09:00:04.099954 IP 10.1.1.7.49153 > 10.1.1.2.discard: UDP, length 512
09:00:04.108146 IP 10.1.1.7.49153 > 10.1.1.2.discard: UDP, length 512
09:00:04.116338 IP 10.1.1.7.49153 > 10.1.1.2.discard: UDP, length 512
09:00:04.124530 IP 10.1.1.7.49153 > 10.1.1.2.discard: UDP, length 512
09:00:04.132722 IP 10.1.1.7.49153 > 10.1.1.2.discard: UDP, length 512
09:00:04.140914 IP 10.1.1.7.49153 > 10.1.1.2.discard: UDP, length 512
09:00:04.149106 IP 10.1.1.7.49153 > 10.1.1.2.discard: UDP, length 512
09:00:04.157298 IP 10.1.1.7.49153 > 10.1.1.2.discard: UDP, length 512
09:00:04.165490 IP 10.1.1.7.49153 > 10.1.1.2.discard: UDP, length 512
09:00:04.173682 IP 10.1.1.7.49153 > 10.1.1.2.discard: UDP, length 512
09:00:04.181874 IP 10.1.1.7.49153 > 10.1.1.2.discard: UDP, length 512
09:00:04.190066 IP 10.1.1.7.49153 > 10.1.1.2.discard: UDP, length 512
09:00:04.198258 IP 10.1.1.7.49153 > 10.1.1.2.discard: UDP, length 512
09:00:04.206450 IP 10.1.1.7.49153 > 10.1.1.2.discard: UDP, length 512
09:00:04.214642 IP 10.1.1.7.49153 > 10.1.1.2.discard: UDP, length 512
09:00:04.222834 IP 10.1.1.7.49153 > 10.1.1.2.discard: UDP, length 512
09:00:04.231026 IP 10.1.1.7.49153 > 10.1.1.2.discard: UDP, length 512
09:00:04.239218 IP 10.1.1.7.49153 > 10.1.1.2.discard: UDP, length 512
09:00:04.247410 IP 10.1.1.7.49153 > 10.1.1.2.discard: UDP, length 512
09:00:04.255602 IP 10.1.1.7.49153 > 10.1.1.2.discard: UDP, length 512
09:00:04.263794 IP 10.1.1.7.49153 > 10.1.1.2.discard: UDP, length 512
09:00:04.271986 IP 10.1.1.7.49153 > 10.1.1.2.discard: UDP, length 512
09:00:04.280178 IP 10.1.1.7.49153 > 10.1.1.2.discard: UDP, length 512
09:00:04.288370 IP 10.1.1.7.49153 > 10.1.1.2.discard: UDP, length 512
09:00:04.296562 IP 10.1.1.7.49153 > 10.1.1.2.discard: UDP, length 512
09:00:04.304754 IP 10.1.1.7.49153 > 10.1.1.2.discard: UDP, length 512
09:00:04.312946 IP 10.1.1.7.49153 > 10.1.1.2.discard: UDP, length 512
09:00:04.321138 IP 10.1.1.7.49153 > 10.1.1.2.discard: UDP, length 512
09:00:04.329330 IP 10.1.1.7.49153 > 10.1.1.2.discard: UDP, length 512
09:00:04.337522 IP 10.1.1.7.49153 > 10.1.1.2.discard: UDP, length 512
09:00:04.345714 IP 10.1.1.7.49153 > 10.1.1.2.discard: UDP, length 512
09:00:04.353906 IP 10.1.1.7.49153 > 10.1.1.2.discard: UDP, length 512
09:00:04.362098 IP 10.1.1.7.49153 > 10.1.1.2.discard: UDP, length 512
09:00:04.370290 IP 10.1.1.7.49153 > 10.1.1.2.discard: UDP, length 512
09:00:04.378482 IP 10.1.1.7.49153 > 10.1.1.2.discard: UDP, length 512
09:00:04.386674 IP 10.1.1.7.49153 > 10.1.1.2.discard: UDP, length 512
09:00:04.394866 IP 10.1.1.7.49153 > 10.1.1.2.discard: UDP, length 512
09:00:04.403058 IP 10.1.1.7.49153 > 10.1.1.2.discard: UDP, length 512
09:00:04.411250 IP 10.1.1.7.49153 > 10.1.1.2.discard: UDP, length 512
09:00:04.419442 IP 10.1.1.7.49153 > 10.1.1.2.discard: UDP, length 512
09:00:04.427634 IP 10.1.1.7.49153 > 10.1.1.2.discard: UDP, length 512
09:00:04.435826 IP 10.1.1.7.49153 > 10.1.1.2.discard: UDP, length 512
09:00:04.444018 IP 10.1.1.7.49153 > 10.1.1.2.discard: UDP, length 512
09:00:04.452210 IP 10.1.1.7.49153 > 10.1.1.2.discard: UDP, length 512
09:00:04.460402 IP 10.1.1.7.49153 > 10.1.1.2.discard: UDP, length 512
09:00:04.468594 IP 10.1.1.7.49153 > 10.1.1.2.discard: UDP, length 512
09:00:04.476786 IP 10.1.1.7.49153 > 10.1.1.2.discard: UDP, length 512
09:00:04.484978 IP 10.1.1.7.49153 > 10.1.1.2.discard: UDP, length 512
09:00:04.493170 IP 10.1.1.7.49153 > 10.1.1.2.discard: UDP, length 512
09:00:04.501362 IP 10.1.1.7.49153 > 10.1.1.2.discard: UDP, length 512
09:00:04.509554 IP 10.1.1.7.49153 > 10.1.1.2.discard: UDP, length 512
09:00:04.517746 IP 10.1.1.7.49153 > 10.1.1.2.discard: UDP, length 512
09:00:04.525938 IP 10.1.1.7.49153 > 10.1.1.2.discard: UDP, length 512
09:00:04.534130 IP 10.1.1.7.49153 > 10.1.1.2.discard: UDP, length 512
09:00:04.542322 IP 10.1.1.7.49153 > 10.1.1.2.discard: UDP, length 512
09:00:04.550514 IP 10.1.1.7.49153 > 10.1.1.2.discard: UDP, length 512
09:00:04.558706 IP 10.1.1.7.49153 > 10.1.1.2.discard: UDP, length 512
09:00:04.566898 IP 10.1.1.7.49153 > 10.1.1.2.discard: UDP, length 512
09:00:04.575090 IP 10.1.1.7.49153 > 10.1.1.2.discard: UDP, length 512
09:00:04.583282 IP 10.1.1.7.49153 > 10.1.1.2.discard: UDP, length 512
09:00:04.591474 IP 10.1.1.7.49153 > 10.1.1.2.discard: UDP, length 512
09:00:04.599666 IP 10.1.1.7.49153 > 10.1.1.2.discard: UDP, length 512
09:00:04.607858 IP 10.1.1.7.49153 > 10.1.1.2.discard: UDP, length 512
09:00:04.616050 IP 10.1.1.7.49153 > 10.1.1.2.discard: UDP, length 512
09:00:04.624242 IP 10.1.1.7.49153 > 10.1.1.2.discard: UDP, length 512
09:00:04.632434 IP 10.1.1.7.49153 > 10.1.1.2.discard: UDP, length 512
09:00:04.640626 IP 10.1.1.7.49153 > 10.1.1.2.discard: UDP, length 512
09:00:04.648818 IP 10.1.1.7.49153 > 10.1.1.2.discard: UDP, length 512
09:00:04.657010 IP 10.1.1.7.49153 > 10.1.1.2.discard: UDP, length 512
09:00:04.665202 IP 10.1.1.7.49153 > 10.1.1.2.discard: UDP, length 512
09:00:04.673394 IP 10.1.1.7.49153 > 10.1.1.2.discard: UDP, length 512
09:00:04.681586 IP 10.1.1.7.49153 > 10.1.1.2.discard: UDP, length 512
09:00:04.689778 IP 10.1.1.7.49153 > 10.1.1.2.discard: UDP, length 512
09:00:04.697970 IP 10.1.1.7.49153 > 10.1.1.2.discard: UDP, length 512
09:00:04.706162 IP 10.1.1.7.49153 > 10.1.1.2.discard: UDP, length 512
09:00:04.714354 IP 10.1.1.7.49153 > 10.1.1.2.discard: UDP, length 512
09:00:04.722546 IP 10.1.1.7.49153 > 10.1.1.2.discard: UDP, length 512
09:00:04.730738 IP 10.1.1.7.49153 > 10.1.1.2.discard: UDP, length 512
09:00:04.738930 IP 10.1.1.7.49153 > 10.1.1.2.discard: UDP, length 512
09:00:04.747122 IP 10.1.1.7.49153 > 10.1.1.2.discard: UDP, length 512
09:00:04.755314 IP 10.1.1.7.49153 > 10.1.1.2.discard: UDP, length 512
09:00:04.763506 IP 10.1.1.7.49153 > 10.1.1.2.discard: UDP, length 512
09:00:04.771698 IP 10.1.1.7.49153 > 10.1.1.2.discard: UDP, length 512
09:00:04.779890 IP 10.1.1.7.49153 > 10.1.1.2.discard: UDP, length 512
09:00:04.788082 IP 10.1.1.7.49153 > 10.1.1.2.discard: UDP, length 512
09:00:04.796274 IP 10.1.1.7.49153 > 10.1.1.2.discard: UDP, length 512
09:00:04.804466 IP 10.1.1.7.49153 > 10.1.1.2.discard: UDP, length 512
09:00:04.812658 IP 10.1.1.7.49153 > 10.1.1.2.discard: UDP, length 512
09:00:04.820850 IP 10.1.1.7.49153 > 10.1.1.2.discard: UDP, length 512
09:00:04.829042 IP 10.1.1.7.49153 > 10.1.1.2.discard: UDP, length 512
09:00:04.837234 IP 10.1.1.7.49153 > 10.1.1.2.discard: UDP, length 512
09:00:04.845426 IP 10.1.1.7.49153 > 10.1.1.2.discard: UDP, length 512
09:00:04.853618 IP 10.1.1.7.49153 > 10.1.1.2.discard: UDP, length 512
09:00:04.861810 IP 10.1.1.7.49153 > 10.1.1.2.discard: UDP, length 512
09:00:04.870002 IP 10.1.1.7.49153 > 10.1.1.2.discard: UDP, length 512
09:00:04.878194 IP 10.1.1.7.49153 > 10.1.1.2.discard: UDP, length 512
09:00:04.886386 IP 10.1.1.7.49153 > 10.1.1.2.discard: UDP, length 512
09:00:04.894578 IP 10.1.1.7.49153 > 10.1.1.2.discard: UDP, length 512
09:00:04.902770 IP 10.1.1.7.49153 > 10.1.1.2.discard: UDP, length 512
09:00:04.910962 IP 10.1.1.7.49153 > 10.1.1.2.discard: UDP, length 512
09:00:04.919154 IP 10.1.1.7.49153 > 10.1.1.2.discard: UDP, length 512
09:00:04.927346 IP 10.1.1.7.49153 > 10.1.1.2.discard: UDP, length 512
09:00:04.935538 IP 10.1.1.7.49153 > 10.1.1.2.discard: UDP, length 512
09:00:04.943730 IP 10.1.1.7.49153 > 10.1.1.2.discard: UDP, length 512
09:00:04.951922 IP 10.1.1.7.49153 > 10.1.1.2.discard: UDP, length 512
09:00:04.960114 IP 10.1.1.7.49153 > 10.1.1.2.discard: UDP, length 512
09:00:04.968306 IP 10.1.1.7.49153 > 10.1.1.2.discard: UDP, length 512
09:00:04.976498 IP 10.1.1.7.49153 > 10.1.1.2.discard: UDP, length 512
09:00:04.984690 IP 10.1.1.7.49153 > 10.1.1.2.discard: UDP, length 512
09:00:04.992882 IP 10.1.1.7.49153 > 10.1.1.2.discard: UDP, length 512
09:00:05.001074 IP 10.1.1.7.49153 > 10.1.1.2.discard: UDP, length 512
09:00:05.009266 IP 10.1.1.7.49153 > 10.1.1.2.discard: UDP, length 512
09:00:06.023601 ARP, Request who-has 10.1.1.7 (Broadcast) tell 10.1.1.2, length 50
09:00:06.023601 ARP, Request who-has 10.1.1.7 (Broadcast) tell 10.1.1.2, length 50
09:00:06.040422 ARP, Reply 10.1.1.7 is-at 00:00:00:00:00:32 (oui Ethernet), length 50
09:00:06.044998 ARP, Reply 10.1.1.7 is-at 00:00:00:00:00:32 (oui Ethernet), length 50
