09:00:01.019601 ARP, Request who-has 10.1.1.2 (Broadcast) tell 10.1.1.1, length 50
09:00:01.019601 ARP, Request who-has 10.1.1.2 (Broadcast) tell 10.1.1.1, length 50
09:00:01.056404 IP 10.1.1.1.49153 > 10.1.1.2.discard: UDP, length 512
09:00:01.059650 IP 10.1.1.1.49153 > 10.1.1.2.discard: UDP, length 512
09:00:01.065004 IP 10.1.1.1.49153 > 10.1.1.2.discard: UDP, length 512
09:00:01.068421 IP 10.1.1.1.49153 > 10.1.1.2.discard: UDP, length 512
09:00:01.077814 IP 10.1.1.1.49153 > 10.1.1.2.discard: UDP, length 512
09:00:01.087012 IP 10.1.1.1.49153 > 10.1.1.2.discard: UDP, length 512
09:00:01.090031 IP 10.1.1.1.49153 > 10.1.1.2.discard: UDP, length 512
09:00:01.095941 IP 10.1.1.1.49153 > 10.1.1.2.discard: UDP, length 512
09:00:01.107562 IP 10.1.1.1.49153 > 10.1.1.2.discard: UDP, length 512
09:00:01.113600 IP 10.1.1.1.49153 > 10.1.1.2.discard: UDP, length 512
09:00:01.118067 IP 10.1.1.1.49153 > 10.1.1.2.discard: UDP, length 512
09:00:01.126259 IP 10.1.1.1.49153 > 10.1.1.2.discard: UDP, length 512
09:00:01.135760 IP 10.1.1.1.49153 > 10.1.1.2.discard: UDP, length 512
09:00:01.144306 IP 10.1.1.1.49153 > 10.1.1.2.discard: UDP, length 512
09:00:01.153448 IP 10.1.1.1.49153 > 10.1.1.2.discard: UDP, length 512
09:00:01.162292 IP 10.1.1.1.49153 > 10.1.1.2.discard: UDP, length 512
09:00:01.167219 IP 10.1.1.1.49153 > 10.1.1.2.discard: UDP, length 512
09:00:01.175411 IP 10.1.1.1.49153 > 10.1.1.2.discard: UDP, length 512
09:00:01.184951 IP 10.1.1.1.49153 > 10.1.1.2.discard: UDP, length 512
09:00:01.193069 IP 10.1.1.1.49153 > 10.1.1.2.discard: UDP, length 512
09:00:01.202523 IP 10.1.1.1.49153 > 10.1.1.2.discard: UDP, length 512
09:00:01.210436 IP 10.1.1.1.49153 > 10.1.1.2.discard: UDP, length 512
09:00:01.216371 IP 10.1.1.1.49153 > 10.1.1.2.discard: UDP, length 512
09:00:01.224563 IP 10.1.1.1.49153 > 10.1.1.2.discard: UDP, length 512
09:00:01.233848 IP 10.1.1.1.49153 > 10.1.1.2.discard: UDP, length 512
09:00:01.242070 IP 10.1.1.1.49153 > 10.1.1.2.discard: UDP, length 512
09:00:01.251362 IP 10.1.1.1.49153 > 10.1.1.2.discard: UDP, length 512
09:00:01.259571 IP 10.1.1.1.49153 > 10.1.1.2.discard: UDP, length 512
09:00:01.265523 IP 10.1.1.1.49153 > 10.1.1.2.discard: UDP, length 512
09:00:01.273715 IP 10.1.1.1.49153 > 10.1.1.2.discard: UDP, length 512
09:00:01.283005 IP 10.1.1.1.49153 > 10.1.1.2.discard: UDP, length 512
09:00:01.291357 IP 10.1.1.1.49153 > 10.1.1.2.discard: UDP, length 512
09:00:01.300776 IP 10.1.1.1.49153 > 10.1.1.2.discard: UDP, length 512
09:00:01.309258 IP 10.1.1.1.49153 > 10.1.1.2.discard: UDP, length 512
09:00:01.314675 IP 10.1.1.1.49153 > 10.1.1.2.discard: UDP, length 512
09:00:01.322867 IP 10.1.1.1.49153 > 10.1.1.2.discard: UDP, length 512
09:00:01.332181 IP 10.1.1.1.49153 > 10.1.1.2.discard: UDP, length 512
09:00:01.340884 IP 10.1.1.1.49153 > 10.1.1.2.discard: UDP, length 512
09:00:01.350282 IP 10.1.1.1.49153 > 10.1.1.2.discard: UDP, length 512
09:00:01.358473 IP 10.1.1.1.49153 > 10.1.1.2.discard: UDP, length 512
09:00:01.363827 IP 10.1.1.1.49153 > 10.1.1.2.discard: UDP, length 512
09:00:01.372019 IP 10.1.1.1.49153 > 10.1.1.2.discard: UDP, length 512
09:00:01.381343 IP 10.1.1.1.49153 > 10.1.1.2.discard: UDP, length 512
09:00:01.389815 IP 10.1.1.1.49153 > 10.1.1.2.discard: UDP, length 512
09:00:01.399170 IP 10.1.1.1.49153 > 10.1.1.2.discard: UDP, length 512
09:00:01.407736 IP 10.1.1.1.49153 > 10.1.1.2.discard: UDP, length 512
09:00:01.412979 IP 10.1.1.1.49153 > 10.1.1.2.discard: UDP, length 512
09:00:01.421171 IP 10.1.1.1.49153 > 10.1.1.2.discard: UDP, length 512
09:00:01.430549 IP 10.1.1.1.49153 > 10.1.1.2.discard: UDP, length 512
09:00:01.438648 IP 10.1.1.1.49153 > 10.1.1.2.discard: UDP, length 512
09:00:01.448090 IP 10.1.1.1.49153 > 10.1.1.2.discard: UDP, length 512
09:00:01.456078 IP 10.1.1.1.49153 > 10.1.1.2.discard: UDP, length 512
09:00:01.462131 IP 10.1.1.1.49153 > 10.1.1.2.discard: UDP, length 512
09:00:01.470323 IP 10.1.1.1.49153 > 10.1.1.2.discard: UDP, length 512
09:00:01.479786 IP 10.1.1.1.49153 > 10.1.1.2.discard: UDP, length 512
09:00:01.487921 IP 10.1.1.1.49153 > 10.1.1.2.discard: UDP, length 512
09:00:01.497227 IP 10.1.1.1.49153 > 10.1.1.2.discard: UDP, length 512
09:00:01.505675 IP 10.1.1.1.49153 > 10.1.1.2.discard: UDP, length 512
09:00:01.511283 IP 10.1.1.1.49153 > 10.1.1.2.discard: UDP, length 512
09:00:01.519475 IP 10.1.1.1.49153 > 10.1.1.2.discard: UDP, length 512
09:00:01.529007 IP 10.1.1.1.49153 > 10.1.1.2.discard: UDP, length 512
09:00:01.537041 IP 10.1.1.1.49153 > 10.1.1.2.discard: UDP, length 512
09:00:01.547091 IP 10.1.1.1.49153 > 10.1.1.2.discard: UDP, length 512
09:00:01.554492 IP 10.1.1.1.49153 > 10.1.1.2.discard: UDP, length 512
09:00:01.560435 IP 10.1.1.1.49153 > 10.1.1.2.discard: UDP, length 512
09:00:01.568627 IP 10.1.1.1.49153 > 10.1.1.2.discard: UDP, length 512
09:00:01.577975 IP 10.1.1.1.49153 > 10.1.1.2.discard: UDP, length 512
09:00:01.586177 IP 10.1.1.1.49153 > 10.1.1.2.discard: UDP, length 512
09:00:01.595472 IP 10.1.1.1.49153 > 10.1.1.2.discard: UDP, length 512
09:00:01.603844 IP 10.1.1.1.49153 > 10.1.1.2.discard: UDP, length 512
09:00:01.609587 IP 10.1.1.1.49153 > 10.1.1.2.discard: UDP, length 512
09:00:01.617779 IP 10.1.1.1.49153 > 10.1.1.2.discard: UDP, length 512
09:00:01.627554 IP 10.1.1.1.49153 > 10.1.1.2.discard: UDP, length 512
09:00:01.635146 IP 10.1.1.1.49153 > 10.1.1.2.discard: UDP, length 512
09:00:01.645321 IP 10.1.1.1.49153 > 10.1.1.2.discard: UDP, length 512
09:00:01.652664 IP 10.1.1.1.49153 > 10.1.1.2.discard: UDP, length 512
09:00:01.658739 IP 10.1.1.1.49153 > 10.1.1.2.discard: UDP, length 512
09:00:01.666931 IP 10.1.1.1.49153 > 10.1.1.2.discard: UDP, length 512
09:00:01.676418 IP 10.1.1.1.49153 > 10.1.1.2.discard: UDP, length 512
09:00:01.685203 IP 10.1.1.1.49153 > 10.1.1.2.discard: UDP, length 512
09:00:01.693822 IP 10.1.1.1.49153 > 10.1.1.2.discard: UDP, length 512
09:00:01.702690 IP 10.1.1.1.49153 > 10.1.1.2.discard: UDP, length 512
09:00:01.707891 IP 10.1.1.1.49153 > 10.1.1.2.discard: UDP, length 512
09:00:01.716083 IP 10.1.1.1.49153 > 10.1.1.2.discard: UDP, length 512
09:00:01.726181 IP 10.1.1.1.49153 > 10.1.1.2.discard: UDP, length 512
09:00:01.733533 IP 10.1.1.1.49153 > 10.1.1.2.discard: UDP, length 512
09:00:01.743683 IP 10.1.1.1.49153 > 10.1.1.2.discard: UDP, length 512
09:00:01.751514 IP 10.1.1.1.49153 > 10.1.1.2.discard: UDP, length 512
09:00:01.757043 IP 10.1.1.1.49153 > 10.1.1.2.discard: UDP, length 512
09:00:01.765235 IP 10.1.1.1.49153 > 10.1.1.2.discard: UDP, length 512
09:00:01.774838 IP 10.1.1.1.49153 > 10.1.1.2.discard: UDP, length 512
09:00:01.783180 IP 10.1.1.1.49153 > 10.1.1.2.discard: UDP, length 512
09:00:01.792225 IP 10.1.1.1.49153 > 10.1.1.2.discard: UDP, length 512
09:00:01.800704 IP 10.1.1.1.49153 > 10.1.1.2.discard: UDP, length 512
09:00:01.806195 IP 10.1.1.1.49153 > 10.1.1.2.discard: UDP, length 512
09:00:01.814387 IP 10.1.1.1.49153 > 10.1.1.2.discard: UDP, length 512
09:00:01.823713 IP 10.1.1.1.49153 > 10.1.1.2.discard: UDP, length 512
09:00:01.832160 IP 10.1.1.1.49153 > 10.1.1.2.discard: UDP, length 512
09:00:01.841085 IP 10.1.1.1.49153 > 10.1.1.2.discard: UDP, length 512
09:00:01.849648 IP 10.1.1.1.49153 > 10.1.1.2.discard: UDP, length 512
09:00:01.855347 IP 10.1.1.1.49153 > 10.1.1.2.discard: UDP, length 512
09:00:01.863539 IP 10.1.1.1.49153 > 10.1.1.2.discard: UDP, length 512
09:00:01.873339 IP 10.1.1.1.49153 > 10.1.1.2.discard: UDP, length 512
09:00:01.881039 IP 10.1.1.1.49153 > 10.1.1.2.discard: UDP, length 512
09:00:01.891008 IP 10.1.1.1.49153 > 10.1.1.2.discard: UDP, length 512
09:00:01.898437 IP 10.1.1.1.49153 > 10.1.1.2.discard: UDP, length 512
09:00:01.904499 IP 10.1.1.1.49153 > 10.1.1.2.discard: UDP, length 512
09:00:01.912691 IP 10.1.1.1.49153 > 10.1.1.2.discard: UDP, length 512
09:00:01.922234 IP 10.1.1.1.49153 > 10.1.1.2.discard: UDP, length 512
09:00:01.930361 IP 10.1.1.1.49153 > 10.1.1.2.discard: UDP, length 512
09:00:01.940077 IP 10.1.1.1.49153 > 10.1.1.2.discard: UDP, length 512
09:00:01.948364 IP 10.1.1.1.49153 > 10.1.1.2.discard: UDP, length 512
09:00:01.953651 IP 10.1.1.1.49153 > 10.1.1.2.discard: UDP, length 512
09:00:01.961843 IP 10.1.1.1.49153 > 10.1.1.2.discard: UDP, length 512
09:00:01.971699 IP 10.1.1.1.49153 > 10.1.1.2.discard: UDP, length 512
09:00:01.979882 IP 10.1.1.1.49153 > 10.1.1.2.discard: UDP, length 512
09:00:01.989344 IP 10.1.1.1.49153 > 10.1.1.2.discard: UDP, length 512
09:00:01.997730 IP 10.1.1.1.49153 > 10.1.1.2.discard: UDP, length 512
09:00:02.002803 IP 10.1.1.1.49153 > 10.1.1.2.discard: UDP, length 512
09:00:02.010995 IP 10.1.1.1.49153 > 10.1.1.2.discard: UDP, length 512
09:00:02.020547 IP 10.1.1.1.49153 > 10.1.1.2.discard: UDP, length 512
09:00:02.028570 IP 10.1.1.1.49153 > 10.1.1.2.discard: UDP, length 512
09:00:02.038175 IP 10.1.1.1.49153 > 10.1.1.2.discard: UDP, length 512
09:00:02.046083 IP 10.1.1.1.49153 > 10.1.1.2.discard: UDP, length 512
09:00:02.051955 IP 10.1.1.1.49153 > 10.1.1.2.discard: UDP, length 512
09:00:02.060147 IP 10.1.1.1.49153 > 10.1.1.2.discard: UDP, length 512
09:00:02.069422 IP 10.1.1.1.49153 > 10.1.1.2.discard: UDP, length 512
09:00:02.077533 IP 10.1.1.1.49153 > 10.1.1.2.discard: UDP, length 512
09:00:02.087349 IP 10.1.1.1.49153 > 10.1.1.2.discard: UDP, length 512
09:00:02.095169 IP 10.1.1.1.49153 > 10.1.1.2.discard: UDP, length 512
09:00:02.101107 IP 10.1.1.1.49153 > 10.1.1.2.discard: UDP, length 512
09:00:02.109299 IP 10.1.1.1.49153 > 10.1.1.2.discard: UDP, length 512
09:00:02.119246 IP 10.1.1.1.49153 > 10.1.1.2.discard: UDP, length 512
09:00:02.126783 IP 10.1.1.1.49153 > 10.1.1.2.discard: UDP, length 512
09:00:02.136651 IP 10.1.1.1.49153 > 10.1.1.2.discard: UDP, length 512
09:00:02.144158 IP 10.1.1.1.49153 > 10.1.1.2.discard: UDP, length 512
09:00:02.150259 IP 10.1.1.1.49153 > 10.1.1.2.discard: UDP, length 512
09:00:02.158451 IP 10.1.1.1.49153 > 10.1.1.2.discard: UDP, length 512
09:00:02.168493 IP 10.1.1.1.49153 > 10.1.1.2.discard: UDP, length 512
09:00:02.175900 IP 10.1.1.1.49153 > 10.1.1.2.discard: UDP, length 512
09:00:02.186345 IP 10.1.1.1.49153 > 10.1.1.2.discard: UDP, length 512
09:00:02.193748 IP 10.1.1.1.49153 > 10.1.1.2.discard: UDP, length 512
09:00:02.199411 IP 10.1.1.1.49153 > 10.1.1.2.discard: UDP, length 512
09:00:02.207603 IP 10.1.1.1.49153 > 10.1.1.2.discard: UDP, length 512
09:00:02.217413 IP 10.1.1.1.49153 > 10.1.1.2.discard: UDP, length 512
09:00:02.225556 IP 10.1.1.1.49153 > 10.1.1.2.discard: UDP, length 512
09:00:02.235064 IP 10.1.1.1.49153 > 10.1.1.2.discard: UDP, length 512
09:00:02.243573 IP 10.1.1.1.49153 > 10.1.1.2.discard: UDP, length 512
09:00:02.248563 IP 10.1.1.1.49153 > 10.1.1.2.discard: UDP, length 512
09:00:02.256755 IP 10.1.1.1.49153 > 10.1.1.2.discard: UDP, length 512
09:00:02.266204 IP 10.1.1.1.49153 > 10.1.1.2.discard: UDP, length 512
09:00:02.274753 IP 10.1.1.1.49153 > 10.1.1.2.discard: UDP, length 512
09:00:02.284280 IP 10.1.1.1.49153 > 10.1.1.2.discard: UDP, length 512
09:00:02.292777 IP 10.1.1.1.49153 > 10.1.1.2.discard: UDP, length 512
09:00:02.297715 IP 10.1.1.1.49153 > 10.1.1.2.discard: UDP, length 512
09:00:02.305907 IP 10.1.1.1.49153 > 10.1.1.2.discard: UDP, length 512
09:00:02.315462 IP 10.1.1.1.49153 > 10.1.1.2.discard: UDP, length 512
09:00:02.323312 IP 10.1.1.1.49153 > 10.1.1.2.discard: UDP, length 512
09:00:02.332848 IP 10.1.1.1.49153 > 10.1.1.2.discard: UDP, length 512
09:00:02.340937 IP 10.1.1.1.49153 > 10.1.1.2.discard: UDP, length 512
09:00:02.346867 IP 10.1.1.1.49153 > 10.1.1.2.discard: UDP, length 512
09:00:02.355059 IP 10.1.1.1.49153 > 10.1.1.2.discard: UDP, length 512
09:00:02.364356 IP 10.1.1.1.49153 > 10.1.1.2.discard: UDP, length 512
09:00:02.372505 IP 10.1.1.1.49153 > 10.1.1.2.discard: UDP, length 512
09:00:02.381874 IP 10.1.1.1.49153 > 10.1.1.2.discard: UDP, length 512
09:00:02.390601 IP 10.1.1.1.49153 > 10.1.1.2.discard: UDP, length 512
09:00:02.396019 IP 10.1.1.1.49153 > 10.1.1.2.discard: UDP, length 512
09:00:02.404211 IP 10.1.1.1.49153 > 10.1.1.2.discard: UDP, length 512
09:00:02.413406 IP 10.1.1.1.49153 > 10.1.1.2.discard: UDP, length 512
09:00:02.421790 IP 10.1.1.1.49153 > 10.1.1.2.discard: UDP, length 512
09:00:02.430970 IP 10.1.1.1.49153 > 10.1.1.2.discard: UDP, length 512
09:00:02.439431 IP 10.1.1.1.49153 > 10.1.1.2.discard: UDP, length 512
09:00:02.445171 IP 10.1.1.1.49153 > 10.1.1.2.discard: UDP, length 512
09:00:02.453363 IP 10.1.1.1.49153 > 10.1.1.2.discard: UDP, length 512
09:00:02.463208 IP 10.1.1.1.49153 > 10.1.1.2.discard: UDP, length 512
09:00:02.471036 IP 10.1.1.1.49153 > 10.1.1.2.discard: UDP, length 512
09:00:02.480934 IP 10.1.1.1.49153 > 10.1.1.2.discard: UDP, length 512
09:00:02.488687 IP 10.1.1.1.49153 > 10.1.1.2.discard: UDP, length 512
09:00:02.494323 IP 10.1.1.1.49153 > 10.1.1.2.discard: UDP, length 512
09:00:02.502515 IP 10.1.1.1.49153 > 10.1.1.2.discard: UDP, length 512
09:00:02.512591 IP 10.1.1.1.49153 > 10.1.1.2.discard: UDP, length 512
09:00:02.520071 IP 10.1.1.1.49153 > 10.1.1.2.discard: UDP, length 512
09:00:02.530261 IP 10.1.1.1.49153 > 10.1.1.2.discard: UDP, length 512
09:00:02.537551 IP 10.1.1.1.49153 > 10.1.1.2.discard: UDP, length 512
09:00:02.543475 IP 10.1.1.1.49153 > 10.1.1.2.discard: UDP, length 512
09:00:02.551667 IP 10.1.1.1.49153 > 10.1.1.2.discard: UDP, length 512
09:00:02.561474 IP 10.1.1.1.49153 > 10.1.1.2.discard: UDP, length 512
09:00:02.569070 IP 10.1.1.1.49153 > 10.1.1.2.discard: UDP, length 512
09:00:02.579255 IP 10.1.1.1.49153 > 10.1.1.2.discard: UDP, length 512
09:00:02.586713 IP 10.1.1.1.49153 > 10.1.1.2.discard: UDP, length 512
09:00:02.592627 IP 10.1.1.1.49153 > 10.1.1.2.discard: UDP, length 512
09:00:02.600819 IP 10.1.1.1.49153 > 10.1.1.2.discard: UDP, length 512
09:00:02.610583 IP 10.1.1.1.49153 > 10.1.1.2.discard: UDP, length 512
09:00:02.618494 IP 10.1.1.1.49153 > 10.1.1.2.discard: UDP, length 512
09:00:02.628462 IP 10.1.1.1.49153 > 10.1.1.2.discard: UDP, length 512
09:00:02.635899 IP 10.1.1.1.49153 > 10.1.1.2.discard: UDP, length 512
09:00:02.641779 IP 10.1.1.1.49153 > 10.1.1.2.discard: UDP, length 512
09:00:02.649971 IP 10.1.1.1.49153 > 10.1.1.2.discard: UDP, length 512
09:00:02.659246 IP 10.1.1.1.49153 > 10.1.1.2.discard: UDP, length 512
09:00:02.667970 IP 10.1.1.1.49153 > 10.1.1.2.discard: UDP, length 512
09:00:02.677252 IP 10.1.1.1.49153 > 10.1.1.2.discard: UDP, length 512
09:00:02.685493 IP 10.1.1.1.49153 > 10.1.1.2.discard: UDP, length 512
09:00:02.690931 IP 10.1.1.1.49153 > 10.1.1.2.discard: UDP, length 512
09:00:02.699123 IP 10.1.1.1.49153 > 10.1.1.2.discard: UDP, length 512
09:00:02.708417 IP 10.1.1.1.49153 > 10.1.1.2.discard: UDP, length 512
09:00:02.716632 IP 10.1.1.1.49153 > 10.1.1.2.discard: UDP, length 512
09:00:02.725822 IP 10.1.1.1.49153 > 10.1.1.2.discard: UDP, length 512
09:00:02.734360 IP 10.1.1.1.49153 > 10.1.1.2.discard: UDP, length 512
09:00:02.740083 IP 10.1.1.1.49153 > 10.1.1.2.discard: UDP, length 512
09:00:02.748275 IP 10.1.1.1.49153 > 10.1.1.2.discard: UDP, length 512
09:00:02.757563 IP 10.1.1.1.49153 > 10.1.1.2.discard: UDP, length 512
09:00:02.766171 IP 10.1.1.1.49153 > 10.1.1.2.discard: UDP, length 512
09:00:02.774974 IP 10.1.1.1.49153 > 10.1.1.2.discard: UDP, length 512
09:00:02.783552 IP 10.1.1.1.49153 > 10.1.1.2.discard: UDP, length 512
09:00:02.789235 IP 10.1.1.1.49153 > 10.1.1.2.discard: UDP, length 512
09:00:02.797427 IP 10.1.1.1.49153 > 10.1.1.2.discard: UDP, length 512
09:00:02.807253 IP 10.1.1.1.49153 > 10.1.1.2.discard: UDP, length 512
09:00:02.814860 IP 10.1.1.1.49153 > 10.1.1.2.discard: UDP, length 512
09:00:02.824870 IP 10.1.1.1.49153 > 10.1.1.2.discard: UDP, length 512
09:00:02.832238 IP 10.1.1.1.49153 > 10.1.1.2.discard: UDP, length 512
09:00:02.838387 IP 10.1.1.1.49153 > 10.1.1.2.discard: UDP, length 512
09:00:02.846579 IP 10.1.1.1.49153 > 10.1.1.2.discard: UDP, length 512
09:00:02.856149 IP 10.1.1.1.49153 > 10.1.1.2.discard: UDP, length 512
09:00:02.864177 IP 10.1.1.1.49153 > 10.1.1.2.discard: UDP, length 512
09:00:02.873533 IP 10.1.1.1.49153 > 10.1.1.2.discard: UDP, length 512
09:00:02.881942 IP 10.1.1.1.49153 > 10.1.1.2.discard: UDP, length 512
09:00:02.887539 IP 10.1.1.1.49153 > 10.1.1.2.discard: UDP, length 512
09:00:02.895731 IP 10.1.1.1.49153 > 10.1.1.2.discard: UDP, length 512
09:00:02.905115 IP 10.1.1.1.49153 > 10.1.1.2.discard: UDP, length 512
09:00:02.913655 IP 10.1.1.1.49153 > 10.1.1.2.discard: UDP, length 512
09:00:02.922945 IP 10.1.1.1.49153 > 10.1.1.2.discard: UDP, length 512
09:00:02.931666 IP 10.1.1.1.49153 > 10.1.1.2.discard: UDP, length 512
09:00:02.936691 IP 10.1.1.1.49153 > 10.1.1.2.discard: UDP, length 512
09:00:02.944883 IP 10.1.1.1.49153 > 10.1.1.2.discard: UDP, length 512
09:00:02.954239 IP 10.1.1.1.49153 > 10.1.1.2.discard: UDP, length 512
09:00:02.962705 IP 10.1.1.1.49153 > 10.1.1.2.discard: UDP, length 512
09:00:02.972389 IP 10.1.1.1.49153 > 10.1.1.2.discard: UDP, length 512
09:00:02.980319 IP 10.1.1.1.49153 > 10.1.1.2.discard: UDP, length 512
09:00:02.985843 IP 10.1.1.1.49153 > 10.1.1.2.discard: UDP, length 512
09:00:02.994035 IP 10.1.1.1.49153 > 10.1.1.2.discard: UDP, length 512
09:00:03.003381 IP 10.1.1.1.49153 > 10.1.1.2.discard: UDP, length 512
09:00:03.011859 IP 10.1.1.1.49153 > 10.1.1.2.discard: UDP, length 512
09:00:03.020881 IP 10.1.1.1.49153 > 10.1.1.2.discard: UDP, length 512
09:00:03.029376 IP 10.1.1.1.49153 > 10.1.1.2.discard: UDP, length 512
09:00:03.034995 IP 10.1.1.1.49153 > 10.1.1.2.discard: UDP, length 512
09:00:03.043187 IP 10.1.1.1.49153 > 10.1.1.2.discard: UDP, length 512
09:00:03.052662 IP 10.1.1.1.49153 > 10.1.1.2.discard: UDP, length 512
09:00:03.061191 IP 10.1.1.1.49153 > 10.1.1.2.discard: UDP, length 512
09:00:03.070138 IP 10.1.1.1.49153 > 10.1.1.2.discard: UDP, length 512
09:00:03.079138 IP 10.1.1.1.49153 > 10.1.1.2.discard: UDP, length 512
09:00:03.084147 IP 10.1.1.1.49153 > 10.1.1.2.discard: UDP, length 512
09:00:03.092339 IP 10.1.1.1.49153 > 10.1.1.2.discard: UDP, length 512
09:00:03.101590 IP 10.1.1.1.49153 > 10.1.1.2.discard: UDP, length 512
09:00:03.109991 IP 10.1.1.1.49153 > 10.1.1.2.discard: UDP, length 512
09:00:03.119021 IP 10.1.1.1.49153 > 10.1.1.2.discard: UDP, length 512
09:00:03.127464 IP 10.1.1.1.49153 > 10.1.1.2.discard: UDP, length 512
09:00:03.133299 IP 10.1.1.1.49153 > 10.1.1.2.discard: UDP, length 512
09:00:03.141491 IP 10.1.1.1.49153 > 10.1.1.2.discard: UDP, length 512
09:00:03.151879 IP 10.1.1.1.49153 > 10.1.1.2.discard: UDP, length 512
09:00:03.159441 IP 10.1.1.1.49153 > 10.1.1.2.discard: UDP, length 512
09:00:03.166067 IP 10.1.1.1.49153 > 10.1.1.2.discard: UDP, length 512
09:00:03.177037 IP 10.1.1.1.49153 > 10.1.1.2.discard: UDP, length 512
09:00:03.183843 IP 10.1.1.1.49153 > 10.1.1.2.discard: UDP, length 512
09:00:03.190643 IP 10.1.1.1.49153 > 10.1.1.2.discard: UDP, length 512
09:00:03.201636 IP 10.1.1.1.49153 > 10.1.1.2.discard: UDP, length 512
09:00:03.208183 IP 10.1.1.1.49153 > 10.1.1.2.discard: UDP, length 512
09:00:03.215219 IP 10.1.1.1.49153 > 10.1.1.2.discard: UDP, length 512
09:00:03.225904 IP 10.1.1.1.49153 > 10.1.1.2.discard: UDP, length 512
09:00:03.233156 IP 10.1.1.1.49153 > 10.1.1.2.discard: UDP, length 512
09:00:03.239795 IP 10.1.1.1.49153 > 10.1.1.2.discard: UDP, length 512
09:00:03.250736 IP 10.1.1.1.49153 > 10.1.1.2.discard: UDP, length 512
09:00:03.257557 IP 10.1.1.1.49153 > 10.1.1.2.discard: UDP, length 512
09:00:03.264371 IP 10.1.1.1.49153 > 10.1.1.2.discard: UDP, length 512
09:00:03.275070 IP 10.1.1.1.49153 > 10.1.1.2.discard: UDP, length 512
09:00:03.282044 IP 10.1.1.1.49153 > 10.1.1.2.discard: UDP, length 512
09:00:03.288947 IP 10.1.1.1.49153 > 10.1.1.2.discard: UDP, length 512
09:00:03.300055 IP 10.1.1.1.49153 > 10.1.1.2.discard: UDP, length 512
09:00:03.306644 IP 10.1.1.1.49153 > 10.1.1.2.discard: UDP, length 512
09:00:03.313523 IP 10.1.1.1.49153 > 10.1.1.2.discard: UDP, length 512
09:00:03.324001 IP 10.1.1.1.49153 > 10.1.1.2.discard: UDP, length 512
09:00:03.330978 IP 10.1.1.1.49153 > 10.1.1.2.discard: UDP, length 512
09:00:03.338099 IP 10.1.1.1.49153 > 10.1.1.2.discard: UDP, length 512
09:00:03.348904 IP 10.1.1.1.49153 > 10.1.1.2.discard: UDP, length 512
09:00:03.355966 IP 10.1.1.1.49153 > 10.1.1.2.discard: UDP, length 512
09:00:03.362675 IP 10.1.1.1.49153 > 10.1.1.2.discard: UDP, length 512
09:00:03.373816 IP 10.1.1.1.49153 > 10.1.1.2.discard: UDP, length 512
09:00:03.380150 IP 10.1.1.1.49153 > 10.1.1.2.discard: UDP, length 512
09:00:03.387251 IP 10.1.1.1.49153 > 10.1.1.2.discard: UDP, length 512
09:00:03.397530 IP 10.1.1.1.49153 > 10.1.1.2.discard: UDP, length 512
09:00:03.404956 IP 10.1.1.1.49153 > 10.1.1.2.discard: UDP, length 512
09:00:03.411827 IP 10.1.1.1.49153 > 10.1.1.2.discard: UDP, length 512
09:00:03.422815 IP 10.1.1.1.49153 > 10.1.1.2.discard: UDP, length 512
09:00:03.429854 IP 10.1.1.1.49153 > 10.1.1.2.discard: UDP, length 512
09:00:03.436403 IP 10.1.1.1.49153 > 10.1.1.2.discard: UDP, length 512
09:00:03.447551 IP 10.1.1.1.49153 > 10.1.1.2.discard: UDP, length 512
09:00:03.454272 IP 10.1.1.1.49153 > 10.1.1.2.discard: UDP, length 512
09:00:03.460979 IP 10.1.1.1.49153 > 10.1.1.2.discard: UDP, length 512
09:00:03.471865 IP 10.1.1.1.49153 > 10.1.1.2.discard: UDP, length 512
09:00:03.479104 IP 10.1.1.1.49153 > 10.1.1.2.discard: UDP, length 512
09:00:03.485555 IP 10.1.1.1.49153 > 10.1.1.2.discard: UDP, length 512
09:00:03.497402 IP 10.1.1.1.49153 > 10.1.1.2.discard: UDP, length 512
09:00:03.503331 IP 10.1.1.1.49153 > 10.1.1.2.discard: UDP, length 512
09:00:03.510131 IP 10.1.1.1.49153 > 10.1.1.2.discard: UDP, length 512
09:00:03.521094 IP 10.1.1.1.49153 > 10.1.1.2.discard: UDP, length 512
09:00:03.527850 IP 10.1.1.1.49153 > 10.1.1.2.discard: UDP, length 512
09:00:03.534707 IP 10.1.1.1.49153 > 10.1.1.2.discard: UDP, length 512
09:00:03.545361 IP 10.1.1.1.49153 > 10.1.1.2.discard: UDP, length 512
09:00:03.552465 IP 10.1.1.1.49153 > 10.1.1.2.discard: UDP, length 512
09:00:03.559283 IP 10.1.1.1.49153 > 10.1.1.2.discard: UDP, length 512
09:00:03.570332 IP 10.1.1.1.49153 > 10.1.1.2.discard: UDP, length 512
09:00:03.576649 IP 10.1.1.1.49153 > 10.1.1.2.discard: UDP, length 512
09:00:03.583859 IP 10.1.1.1.49153 > 10.1.1.2.discard: UDP, length 512
09:00:03.594086 IP 10.1.1.1.49153 > 10.1.1.2.discard: UDP, length 512
09:00:03.601376 IP 10.1.1.1.49153 > 10.1.1.2.discard: UDP, length 512
09:00:03.608435 IP 10.1.1.1.49153 > 10.1.1.2.discard: UDP, length 512
09:00:03.619373 IP 10.1.1.1.49153 > 10.1.1.2.discard: UDP, length 512
09:00:03.626134 IP 10.1.1.1.49153 > 10.1.1.2.discard: UDP, length 512
09:00:03.633011 IP 10.1.1.1.49153 > 10.1.1.2.discard: UDP, length 512
09:00:03.643718 IP 10.1.1.1.49153 > 10.1.1.2.discard: UDP, length 512
09:00:03.650432 IP 10.1.1.1.49153 > 10.1.1.2.discard: UDP, length 512
09:00:03.657586 IP 10.1.1.1.49153 > 10.1.1.2.discard: UDP, length 512
09:00:03.667817 IP 10.1.1.1.49153 > 10.1.1.2.discard: UDP, length 512
09:00:03.675060 IP 10.1.1.1.49153 > 10.1.1.2.discard: UDP, length 512
09:00:03.682162 IP 10.1.1.1.49153 > 10.1.1.2.discard: UDP, length 512
09:00:03.692459 IP 10.1.1.1.49153 > 10.1.1.2.discard: UDP, length 512
09:00:03.699815 IP 10.1.1.1.49153 > 10.1.1.2.discard: UDP, length 512
09:00:03.706738 IP 10.1.1.1.49153 > 10.1.1.2.discard: UDP, length 512
09:00:03.717596 IP 10.1.1.1.49153 > 10.1.1.2.discard: UDP, length 512
09:00:03.724840 IP 10.1.1.1.49153 > 10.1.1.2.discard: UDP, length 512
09:00:03.731314 IP 10.1.1.1.49153 > 10.1.1.2.discard: UDP, length 512
09:00:03.742307 IP 10.1.1.1.49153 > 10.1.1.2.discard: UDP, length 512
09:00:03.748865 IP 10.1.1.1.49153 > 10.1.1.2.discard: UDP, length 512
09:00:03.755890 IP 10.1.1.1.49153 > 10.1.1.2.discard: UDP, length 512
09:00:03.766708 IP 10.1.1.1.49153 > 10.1.1.2.discard: UDP, length 512
09:00:03.774206 IP 10.1.1.1.49153 > 10.1.1.2.discard: UDP, length 512
09:00:03.780466 IP 10.1.1.1.49153 > 10.1.1.2.discard: UDP, length 512
09:00:03.788658 IP 10.1.1.1.49153 > 10.1.1.2.discard: UDP, length 512
09:00:03.798530 IP 10.1.1.1.49153 > 10.1.1.2.discard: UDP, length 512
09:00:03.806391 IP 10.1.1.1.49153 > 10.1.1.2.discard: UDP, length 512
09:00:03.816074 IP 10.1.1.1.49153 > 10.1.1.2.discard: UDP, length 512
09:00:03.823818 IP 10.1.1.1.49153 > 10.1.1.2.discard: UDP, length 512
09:00:03.829618 IP 10.1.1.1.49153 > 10.1.1.2.discard: UDP, length 512
09:00:03.837810 IP 10.1.1.1.49153 > 10.1.1.2.discard: UDP, length 512
09:00:03.847450 IP 10.1.1.1.49153 > 10.1.1.2.discard: UDP, length 512
09:00:03.855520 IP 10.1.1.1.49153 > 10.1.1.2.discard: UDP, length 512
09:00:03.865031 IP 10.1.1.1.49153 > 10.1.1.2.discard: UDP, length 512
09:00:03.873142 IP 10.1.1.1.49153 > 10.1.1.2.discard: UDP, length 512
09:00:03.878770 IP 10.1.1.1.49153 > 10.1.1.2.discard: UDP, length 512
09:00:03.886962 IP 10.1.1.1.49153 > 10.1.1.2.discard: UDP, length 512
09:00:03.896827 IP 10.1.1.1.49153 > 10.1.1.2.discard: UDP, length 512
09:00:03.904595 IP 10.1.1.1.49153 > 10.1.1.2.discard: UDP, length 512
09:00:03.914820 IP 10.1.1.1.49153 > 10.1.1.2.discard: UDP, length 512
09:00:03.922288 IP 10.1.1.1.49153 > 10.1.1.2.discard: UDP, length 512
09:00:03.927922 IP 10.1.1.1.49153 > 10.1.1.2.discard: UDP, length 512
09:00:03.936114 IP 10.1.1.1.49153 > 10.1.1.2.discard: UDP, length 512
09:00:03.945360 IP 10.1.1.1.49153 > 10.1.1.2.discard: UDP, length 512
09:00:03.953542 IP 10.1.1.1.49153 > 10.1.1.2.discard: UDP, length 512
09:00:03.963082 IP 10.1.1.1.49153 > 10.1.1.2.discard: UDP, length 512
09:00:03.971080 IP 10.1.1.1.49153 > 10.1.1.2.discard: UDP, length 512
09:00:03.977074 IP 10.1.1.1.49153 > 10.1.1.2.discard: UDP, length 512
09:00:03.985266 IP 10.1.1.1.49153 > 10.1.1.2.discard: UDP, length 512
09:00:03.994775 IP 10.1.1.1.49153 > 10.1.1.2.discard: UDP, length 512
09:00:04.002777 IP 10.1.1.1.49153 > 10.1.1.2.discard: UDP, length 512
09:00:04.012892 IP 10.1.1.1.49153 > 10.1.1.2.discard: UDP, length 512
09:00:04.020320 IP 10.1.1.1.49153 > 10.1.1.2.discard: UDP, length 512
09:00:04.026226 IP 10.1.1.1.49153 > 10.1.1.2.discard: UDP, length 512
09:00:04.034418 IP 10.1.1.1.49153 > 10.1.1.2.discard: UDP, length 512
09:00:04.043728 IP 10.1.1.1.49153 > 10.1.1.2.discard: UDP, length 512
09:00:04.052519 IP 10.1.1.1.49153 > 10.1.1.2.discard: UDP, length 512
09:00:04.061138 IP 10.1.1.1.49153 > 10.1.1.2.discard: UDP, length 512
09:00:04.070025 IP 10.1.1.1.49153 > 10.1.1.2.discard: UDP, length 512
09:00:04.075378 IP 10.1.1.1.49153 > 10.1.1.2.discard: UDP, length 512
09:00:04.083570 IP 10.1.1.1.49153 > 10.1.1.2.discard: UDP, length 512
09:00:04.093465 IP 10.1.1.1.49153 > 10.1.1.2.discard: UDP, length 512
09:00:04.101268 IP 10.1.1.1.49153 > 10.1.1.2.discard: UDP, length 512
09:00:04.110996 IP 10.1.1.1.49153 > 10.1.1.2.discard: UDP, length 512
09:00:04.118787 IP 10.1.1.1.49153 > 10.1.1.2.discard: UDP, length 512
09:00:04.124530 IP 10.1.1.1.49153 > 10.1.1.2.discard: UDP, length 512
09:00:04.132722 IP 10.1.1.1.49153 > 10.1.1.2.discard: UDP, length 512
09:00:04.141939 IP 10.1.1.1.49153 > 10.1.1.2.discard: UDP, length 512
09:00:04.150850 IP 10.1.1.1.49153 > 10.1.1.2.discard: UDP, length 512
09:00:04.159543 IP 10.1.1.1.49153 > 10.1.1.2.discard: UDP, length 512
09:00:04.169126 IP 10.1.1.1.49153 > 10.1.1.2.discard: UDP, length 512
09:00:04.173682 IP 10.1.1.1.49153 > 10.1.1.2.discard: UDP, length 512
09:00:04.181874 IP 10.1.1.1.49153 > 10.1.1.2.discard: UDP, length 512
09:00:04.191393 IP 10.1.1.1.49153 > 10.1.1.2.discard: UDP, length 512
09:00:04.199451 IP 10.1.1.1.49153 > 10.1.1.2.discard: UDP, length 512
09:00:04.209329 IP 10.1.1.1.49153 > 10.1.1.2.discard: UDP, length 512
09:00:04.216865 IP 10.1.1.1.49153 > 10.1.1.2.discard: UDP, length 512
09:00:04.222834 IP 10.1.1.1.49153 > 10.1.1.2.discard: UDP, length 512
09:00:04.231026 IP 10.1.1.1.49153 > 10.1.1.2.discard: UDP, length 512
09:00:04.240940 IP 10.1.1.1.49153 > 10.1.1.2.discard: UDP, length 512
09:00:04.249021 IP 10.1.1.1.49153 > 10.1.1.2.discard: UDP, length 512
09:00:04.258854 IP 10.1.1.1.49153 > 10.1.1.2.discard: UDP, length 512
09:00:04.267030 IP 10.1.1.1.49153 > 10.1.1.2.discard: UDP, length 512
09:00:04.271986 IP 10.1.1.1.49153 > 10.1.1.2.discard: UDP, length 512
09:00:04.280178 IP 10.1.1.1.49153 > 10.1.1.2.discard: UDP, length 512
09:00:04.290756 IP 10.1.1.1.49153 > 10.1.1.2.discard: UDP, length 512
09:00:04.297740 IP 10.1.1.1.49153 > 10.1.1.2.discard: UDP, length 512
09:00:04.304754 IP 10.1.1.1.49153 > 10.1.1.2.discard: UDP, length 512
09:00:04.315363 IP 10.1.1.1.49153 > 10.1.1.2.discard: UDP, length 512
09:00:04.322594 IP 10.1.1.1.49153 > 10.1.1.2.discard: UDP, length 512
09:00:04.329330 IP 10.1.1.1.49153 > 10.1.1.2.discard: UDP, length 512
09:00:04.340245 IP 10.1.1.1.49153 > 10.1.1.2.discard: UDP, length 512
09:00:04.347061 IP 10.1.1.1.49153 > 10.1.1.2.discard: UDP, length 512
09:00:04.353906 IP 10.1.1.1.49153 > 10.1.1.2.discard: UDP, length 512
09:00:04.364480 IP 10.1.1.1.49153 > 10.1.1.2.discard: UDP, length 512
09:00:04.371749 IP 10.1.1.1.49153 > 10.1.1.2.discard: UDP, length 512
09:00:04.378482 IP 10.1.1.1.49153 > 10.1.1.2.discard: UDP, length 512
09:00:04.389283 IP 10.1.1.1.49153 > 10.1.1.2.discard: UDP, length 512
09:00:04.396047 IP 10.1.1.1.49153 > 10.1.1.2.discard: UDP, length 512
09:00:04.403058 IP 10.1.1.1.49153 > 10.1.1.2.discard: UDP, length 512
09:00:04.413627 IP 10.1.1.1.49153 > 10.1.1.2.discard: UDP, length 512
09:00:04.420678 IP 10.1.1.1.49153 > 10.1.1.2.discard: UDP, length 512
09:00:04.427634 IP 10.1.1.1.49153 > 10.1.1.2.discard: UDP, length 512
09:00:04.438861 IP 10.1.1.1.49153 > 10.1.1.2.discard: UDP, length 512
09:00:04.445905 IP 10.1.1.1.49153 > 10.1.1.2.discard: UDP, length 512
09:00:04.452210 IP 10.1.1.1.49153 > 10.1.1.2.discard: UDP, length 512
09:00:04.463477 IP 10.1.1.1.49153 > 10.1.1.2.discard: UDP, length 512
09:00:04.469800 IP 10.1.1.1.49153 > 10.1.1.2.discard: UDP, length 512
09:00:04.476786 IP 10.1.1.1.49153 > 10.1.1.2.discard: UDP, length 512
09:00:04.487470 IP 10.1.1.1.49153 > 10.1.1.2.discard: UDP, length 512
09:00:04.494165 IP 10.1.1.1.49153 > 10.1.1.2.discard: UDP, length 512
09:00:04.501362 IP 10.1.1.1.49153 > 10.1.1.2.discard: UDP, length 512
09:00:04.511814 IP 10.1.1.1.49153 > 10.1.1.2.discard: UDP, length 512
09:00:04.519349 IP 10.1.1.1.49153 > 10.1.1.2.discard: UDP, length 512
09:00:04.525938 IP 10.1.1.1.49153 > 10.1.1.2.discard: UDP, length 512
09:00:04.537314 IP 10.1.1.1.49153 > 10.1.1.2.discard: UDP, length 512
09:00:04.543626 IP 10.1.1.1.49153 > 10.1.1.2.discard: UDP, length 512
09:00:04.550514 IP 10.1.1.1.49153 > 10.1.1.2.discard: UDP, length 512
09:00:04.561039 IP 10.1.1.1.49153 > 10.1.1.2.discard: UDP, length 512
09:00:04.568490 IP 10.1.1.1.49153 > 10.1.1.2.discard: UDP, length 512
09:00:04.575090 IP 10.1.1.1.49153 > 10.1.1.2.discard: UDP, length 512
09:00:04.585939 IP 10.1.1.1.49153 > 10.1.1.2.discard: UDP, length 512
09:00:04.592586 IP 10.1.1.1.49153 > 10.1.1.2.discard: UDP, length 512
09:00:04.599666 IP 10.1.1.1.49153 > 10.1.1.2.discard: UDP, length 512
09:00:04.610021 IP 10.1.1.1.49153 > 10.1.1.2.discard: UDP, length 512
09:00:04.617332 IP 10.1.1.1.49153 > 10.1.1.2.discard: UDP, length 512
09:00:04.624242 IP 10.1.1.1.49153 > 10.1.1.2.discard: UDP, length 512
09:00:04.634768 IP 10.1.1.1.49153 > 10.1.1.2.discard: UDP, length 512
09:00:04.641961 IP 10.1.1.1.49153 > 10.1.1.2.discard: UDP, length 512
09:00:04.648818 IP 10.1.1.1.49153 > 10.1.1.2.discard: UDP, length 512
09:00:04.659807 IP 10.1.1.1.49153 > 10.1.1.2.discard: UDP, length 512
09:00:04.666530 IP 10.1.1.1.49153 > 10.1.1.2.discard: UDP, length 512
09:00:04.673394 IP 10.1.1.1.49153 > 10.1.1.2.discard: UDP, length 512
09:00:04.684045 IP 10.1.1.1.49153 > 10.1.1.2.discard: UDP, length 512
09:00:04.690851 IP 10.1.1.1.49153 > 10.1.1.2.discard: UDP, length 512
09:00:04.697970 IP 10.1.1.1.49153 > 10.1.1.2.discard: UDP, length 512
09:00:04.708480 IP 10.1.1.1.49153 > 10.1.1.2.discard: UDP, length 512
09:00:04.715919 IP 10.1.1.1.49153 > 10.1.1.2.discard: UDP, length 512
09:00:04.722546 IP 10.1.1.1.49153 > 10.1.1.2.discard: UDP, length 512
09:00:04.733422 IP 10.1.1.1.49153 > 10.1.1.2.discard: UDP, length 512
09:00:04.740233 IP 10.1.1.1.49153 > 10.1.1.2.discard: UDP, length 512
09:00:04.747122 IP 10.1.1.1.49153 > 10.1.1.2.discard: UDP, length 512
09:00:04.757631 IP 10.1.1.1.49153 > 10.1.1.2.discard: UDP, length 512
09:00:04.764775 IP 10.1.1.1.49153 > 10.1.1.2.discard: UDP, length 512
09:00:04.771698 IP 10.1.1.1.49153 > 10.1.1.2.discard: UDP, length 512
09:00:04.782337 IP 10.1.1.1.49153 > 10.1.1.2.discard: UDP, length 512
09:00:04.789226 IP 10.1.1.1.49153 > 10.1.1.2.discard: UDP, length 512
09:00:04.796274 IP 10.1.1.1.49153 > 10.1.1.2.discard: UDP, length 512
09:00:04.806970 IP 10.1.1.1.49153 > 10.1.1.2.discard: UDP, length 512
09:00:04.813930 IP 10.1.1.1.49153 > 10.1.1.2.discard: UDP, length 512
09:00:04.820850 IP 10.1.1.1.49153 > 10.1.1.2.discard: UDP, length 512
09:00:04.831486 IP 10.1.1.1.49153 > 10.1.1.2.discard: UDP, length 512
09:00:04.838607 IP 10.1.1.1.49153 > 10.1.1.2.discard: UDP, length 512
09:00:04.845426 IP 10.1.1.1.49153 > 10.1.1.2.discard: UDP, length 512
09:00:04.856035 IP 10.1.1.1.49153 > 10.1.1.2.discard: UDP, length 512
09:00:04.862848 IP 10.1.1.1.49153 > 10.1.1.2.discard: UDP, length 512
09:00:04.870002 IP 10.1.1.1.49153 > 10.1.1.2.discard: UDP, length 512
09:00:04.880769 IP 10.1.1.1.49153 > 10.1.1.2.discard: UDP, length 512
09:00:04.887456 IP 10.1.1.1.49153 > 10.1.1.2.discard: UDP, length 512
09:00:04.894578 IP 10.1.1.1.49153 > 10.1.1.2.discard: UDP, length 512
09:00:04.905131 IP 10.1.1.1.49153 > 10.1.1.2.discard: UDP, length 512
09:00:04.912061 IP 10.1.1.1.49153 > 10.1.1.2.discard: UDP, length 512
09:00:04.919154 IP 10.1.1.1.49153 > 10.1.1.2.discard: UDP, length 512
09:00:04.929927 IP 10.1.1.1.49153 > 10.1.1.2.discard: UDP, length 512
09:00:04.936578 IP 10.1.1.1.49153 > 10.1.1.2.discard: UDP, length 512
09:00:04.943730 IP 10.1.1.1.49153 > 10.1.1.2.discard: UDP, length 512
09:00:04.954235 IP 10.1.1.1.49153 > 10.1.1.2.discard: UDP, length 512
09:00:04.961231 IP 10.1.1.1.49153 > 10.1.1.2.discard: UDP, length 512
09:00:04.968306 IP 10.1.1.1.49153 > 10.1.1.2.discard: UDP, length 512
09:00:04.978661 IP 10.1.1.1.49153 > 10.1.1.2.discard: UDP, length 512
09:00:04.986508 IP 10.1.1.1.49153 > 10.1.1.2.discard: UDP, length 512
09:00:04.992882 IP 10.1.1.1.49153 > 10.1.1.2.discard: UDP, length 512
09:00:05.004131 IP 10.1.1.1.49153 > 10.1.1.2.discard: UDP, length 512
09:00:05.010744 IP 10.1.1.1.49153 > 10.1.1.2.discard: UDP, length 512
09:00:06.023601 ARP, Request who-has 10.1.1.1 (Broadcast) tell 10.1.1.2, length 50
09:00:06.023601 ARP, Request who-has 10.1.1.1 (Broadcast) tell 10.1.1.2, length 50
09:00:06.040422 ARP, Reply 10.1.1.1 is-at 00:00:00:00:00:26 (oui Ethernet), length 50
09:00:06.045094 ARP, Reply 10.1.1.1 is-at 00:00:00:00:00:26 (oui Ethernet), length 50
